name,priceNormal,priceWithoutax,branch,link
"Bourbon Q Barbecue Rub for Sissies, 16oz.",$15.50,$13.95,Kentucky Bourbon Q,https://www.hotsauce.com/Bourbon-Q-Barbecue-Rub-For-Sissies/
"Bourbon Q Barrel Select Kentucky Bourbon Grilling Sauce, 12.7oz.",$8.50,$7.95,Kentucky Bourbon Q,https://www.hotsauce.com/Bourbon-Q-Barrel-Select-Kentucky-Bourbon-Grilling-Sauce/
"Bourbon Q Classic Kentucky Bourbon BBQ Sauce, 12.7oz.",$8.50,$7.95,Kentucky Bourbon Q,https://www.hotsauce.com/Kentucky-Bourbon-BBQ-Sauce/
"Bourbon Q Gold Reserve Roasted Garlic and Chipotle Kentucky Bourbon BBQ, 12.7oz.",$8.50,$7.95,Kentucky Bourbon Q,https://www.hotsauce.com/Bourbon-Q-Gold-Reserve-Roasted-Garlic-And-Chipotle-Kentucky-Bourbon-BBQ/
"Bourbon Q Hottest Ride In Town Barbecue Rub, 16oz",$15.50,$13.95,Kentucky Bourbon Q,https://www.hotsauce.com/Bourbon-Q-Hottest-Ride-In-Town-Barbecue-Rub/
"Bourbon Q Kentucky Bourbon BBQ Sauce Gift Pack, 3/12.7oz.",$23.00,$19.95,Kentucky Bourbon Q,https://www.hotsauce.com/Bourbon-Q-Kentucky-Bourbon-BBQ-Sauce-Gift-Pack/
"Bourbon Q Moonshine Madness Barbecue Rub, 16oz",$15.50,$13.95,Kentucky Bourbon Q,https://www.hotsauce.com/Bourbon-Q-Moonshine-Madness-Barbecue-Rub/
"Bourbon Q XXX White Lightnin Barbecue Rub, 16oz",$15.50,$13.95,Kentucky Bourbon Q,https://www.hotsauce.com/Bourbon-Q-XXX-White-Lightnin-Barbecue-Rub/
"Fighting Cock Kentucky Bourbon BBQ Sauce, 12.7oz.",$7.50,$6.95,Pappy's BBQ,https://www.hotsauce.com/fighting-cock-kentucky-bourbon-bbq-sauce/
"Fighting Cock Kentucky Bourbon Hot Nuts, 8oz.",$7.50,$6.95,Kentucky Bourbon Q,https://www.hotsauce.com/Fighting-Cock-Kentucky-Bourbon-Hot-Nuts/
"Fighting Cock Kentucky Bourbon Hot Sauce, 3.4oz.",$7.00,$4.95,Pappy's BBQ,https://www.hotsauce.com/Fighting-Cock-Kentucky-Bourbon-Hot-Sauce/
"Larceny Kentucky Bourbon BBQ Sauce, 12.7oz.",$8.00,$7.49,Pappy's BBQ,https://www.hotsauce.com/Larceny-Kentucky-Bourbon-BBQ-Sauce/
"Larceny Kentucky Bourbon Hot Sauce, 3.4oz.",$5.50,$4.95,Pappy's BBQ,https://www.hotsauce.com/Larceny-Kentucky-Bourbon-Hot-Sauce/
"Pappy's Buffalo Wing Sauce, 12.7oz.",$7.50,$6.95,Pappy's BBQ,https://www.hotsauce.com/pappys-buffalo-wing-sauce/
"Pappy's Chicks Dig Me Mango Chipotle Grilling Sauce, 12.7oz.",$7.50,$6.95,Pappy's BBQ,https://www.hotsauce.com/chicks-dig-me-mango-chipotle-grilling-sauce/
"Pappy's Hottest Ride in Town BBQ Sauce, 12.7oz.",$7.50,$6.95,Pappy's BBQ,https://www.hotsauce.com/pappys-hottest-ride-in-town-bbq-sauce/
"Pappy's Moonshine Madness BBQ Sauce, 12.7oz.",$7.50,$6.95,Pappy's BBQ,https://www.hotsauce.com/pappys-moonshine-madness-bbq-sauce/
"Pappy's Moonshine Madness Clear Hot Sauce, 3.4oz.",$7.50,$5.95,Pappy's BBQ,https://www.hotsauce.com/Pappys-Moonshine-Madness-Clear-Hot-Sauce/
"Pappy's Not made In China BBQ and Dipping Sauce, 12.7oz.",$7.50,$6.95,Pappy's BBQ,https://www.hotsauce.com/not-made-in-china-bbq-and-dipping-sauce/
"Pappy's Sauce for Sissies BBQ Sauce, 12.7oz.",$7.50,$6.95,Pappy's BBQ,https://www.hotsauce.com/Pappys-Sauce-For-Sissies-BBQ-Sauce/
"Pappy's XXX White Lightnin' BBQ Sauce, 12.7oz.",$7.50,$6.95,Pappy's BBQ,https://www.hotsauce.com/pappys-xxx-white-lightnin-bbq-sauce/
