Name,Price,Price witout Tax,Brand,Link
"Danny Cash's Cajun Cayenne Salvation Sauce (w/mini bible), 5oz.",$8.50,$7.95,Danny Cash,https://www.hotsauce.com/danny-cashs-cajun-cayenne-salvation-hot-sauce-mini-bible/
"Danny Cash's Dirt Rider Garlic Ghost Chile Hot Sauce, 5oz.",$9.50,$8.95,Danny Cash,https://www.hotsauce.com/Danny-Cashs-Dirt-Rider-Garlic-Ghost-Chile-Hot-Sauce/
"Danny Cash's Garlic Serrano Salvation Sauce (w/mini bible), 5oz.",$8.50,$7.95,Danny Cash,https://www.hotsauce.com/danny-cashs-garlic-serrano-salvation-hot-sauce-mini-bible/
"Danny Cash's Ghost Rider Hot Sauce, 5oz.",$10.50,$9.49,Danny Cash,https://www.hotsauce.com/danny-cashs-ghost-rider-hot-sauce/
"Danny Cash's Red Habanero Salvation Sauce (w/mini bible), 5oz.",$8.50,$7.95,Danny Cash,https://www.hotsauce.com/danny-cashs-red-habanero-salvation-sauce-mini-bible/
"Danny Cash's Salvation Gift Set, 7/5oz.",$63.00,$57.65,Danny Cash,https://www.hotsauce.com/danny-cashs-salvation-gift-set/
