Name,Price,Price witout Tax,Brand,Link
"Melinda's 3 Pack Hot Sauce Gift Set, 3/5oz.",$14.00,$12.95,Melinda's,https://www.hotsauce.com/melindas-3-pack-hot-sauce-gift-set/
"Melinda's Amarillo Mustard Pepper Sauce, 5oz.",$5.50,$4.95,Melinda's,https://www.hotsauce.com/melindas-amarillo-mustard-pepper-sauce/
"Melinda's Black Pepper Ketchup, 14oz.",$7.50,$6.95,Melinda's,https://www.hotsauce.com/Melindas-Black-Pepper-Ketchup/
"Melinda's Bold & Spicy Habanero Ketchup, 14oz.",$7.50,$6.95,Melinda's,https://www.hotsauce.com/melindas-bold-spicy-habanero-ketchup/
"Melinda's Chipotle Habanero Hot Sauce, 5oz.",$6.50,$5.95,Melinda's,https://www.hotsauce.com/melindas-chipotle-habanero-hot-sauce/
"Melinda's Extra Hot Habanero Sauce, 5oz.",$6.50,$5.95,Melinda's,https://www.hotsauce.com/melindas-extra-hot-habanero-sauce/
"Melinda's Garlic Habanero Hot Sauce, 5oz.",$6.50,$5.95,Melinda's,https://www.hotsauce.com/melindas-garlic-habanero-hot-sauce/
"Melinda's Habanero Variety 4 Pack, 4/5oz.",$23.80,$5.95,Melinda's,https://www.hotsauce.com/melindas-habanero-variety-4-pack/
"Melinda's Hot Habanero Pepper Sauce, 5oz.",$6.50,$40.50,Melinda's,https://www.hotsauce.com/melindas-hot-habanero-pepper-sauce/
"Melinda's Hottest Hot Sauces Gift Set, 6/5oz.",$39.70,$5.95,Melinda's,https://www.hotsauce.com/Melindas-Hottest-Hot-Sauces-Gift-Set/
"Melinda's Jalapeno Pepper Sauce, 5oz.",$6.50,$38.50,Melinda's,https://www.hotsauce.com/melindas-jalapeno-pepper-sauce/
"Melinda's Ketchup Complete Gift Set, 5/14oz.",$35.83,$5.95,Melinda's,https://www.hotsauce.com/Melindas-Ketchup-Complete-Gift-Set/
"Melinda's Mango Habanero Sauce, 5oz.",$6.50,$34.70,Melinda's,https://www.hotsauce.com/melindas-mango-habanero-sauce/
"Melinda's Mildest Hot Sauces Gift Set, 6/5oz.",$9.00,$6.95,Melinda's,https://www.hotsauce.com/Melindas-Mildest-Hot-Sauces-Gift-Set/
"Melinda's Naga Jolokia Hot Sauce, 5oz.",$8.00,$7.49,Melinda's,https://www.hotsauce.com/melindas-naga-jolokia-hot-sauce/
"Melinda's Naga Jolokia Ketchup, 14oz.",$7.50,$6.95,Melinda's,https://www.hotsauce.com/melindas-naga-jolokia-ketchup/
"Melinda's NEW Creamy Style Buffalo Wing Sauce, 12oz.",$7.50,$6.95,Melinda's,https://www.hotsauce.com/Melindas-New-Creamy-Style-Buffalo-Wing-Sauce/
"Melinda's NEW Creamy Style Ghost Pepper Wing Sauce, 12oz.",$7.50,$6.95,Melinda's,https://www.hotsauce.com/Melindas-Creamy-Style-Ghost-Pepper-Wing-Sauce/
"Melinda's NEW Creamy Style Habanero Wing Sauce, 12oz.",$7.50,$6.95,Melinda's,https://www.hotsauce.com/Melindas-Creamy-Style-Habanero-Wing-Sauce/
"Melinda's NEW Creamy Style Sriracha Wing Sauce, 12oz.",$7.50,$6.95,Melinda's,https://www.hotsauce.com/Melindas-Creamy-Style-Sriracha-Wing-Sauce/
"Melinda's NEW GHOST Pepper Steak Sauce, 12oz.",$7.50,$6.95,Melinda's,https://www.hotsauce.com/Melindas-New-Ghost-Pepper-Steak-Sauce/
"Melinda's NEW Jalapeno Green Hot Sauce, 12oz.",$7.50,$6.95,Melinda's,https://www.hotsauce.com/Melindas-Jalapeno-Green-Hot-Sauce/
"Melinda's NEW Peri Peri Garlic Hot Sauce, 12oz.",$7.50,$6.95,Melinda's,https://www.hotsauce.com/Melindas-Peri-Peri-Garlic-Hot-Sauce/
"Melinda's NEW Peri Peri Hot Sauce, 12oz.",$7.50,$6.95,Melinda's,https://www.hotsauce.com/Melindas-Peri-Peri-Hot-Sauce/
"Melinda's NEW Sriracha Hot Sauce, 12oz.",$7.50,$6.95,Melinda's,https://www.hotsauce.com/Melindas-Sriracha-Hot-Sauce/
"Melinda's NEW Thai Sweet Chili Sauce, 12oz.",$30.00,$27.80,Melinda's,https://www.hotsauce.com/Melindas-Thai-Sweet-Chili-Sauce/
"Melinda's NEWEST Creamy Style Wing Sauces Gift Set, 4/12oz.",$37.50,$34.75,Melinda's,https://www.hotsauce.com/Melindas-Newest-Creamy-Style-Wing-Sauces-Gift-Set/
"Melinda's NEWEST Hot Sauces Gift Set, 5/12oz.",$6.50,$5.95,Melinda's,https://www.hotsauce.com/Melindas-Newest-Hot-Sauces-Gift-Set/
"Melinda's Red Savina Hot Sauce, 5oz.",$8.00,$7.49,Melinda's,https://www.hotsauce.com/melindas-red-savina-hot-sauce/
Name,Price,Price witout Tax,Brand,Link
"Melinda's Scotch Bonnet Hot Sauce, 5oz.",$6.50,$5.95,Melinda's,https://www.hotsauce.com/melindas-scotch-bonnet-hot-sauce/
"Melinda's Tangy & Spicy Jalapeno Ketchup, 14oz.",$7.50,$6.95,Melinda's,https://www.hotsauce.com/melindas-tangy-spicy-jalapeno-ketchup/
"Melinda's XXXTra Hot Hot Sauce, 5oz.",$6.50,$5.95,Melinda's,https://www.hotsauce.com/melindas-xxxtra-hot-hot-sauce/
