Name,Price,Price witout Tax,Brand,Link
"Fire Ant Juice Gourmet Hot Sauce, 5oz.",$6.50,$5.95,HotSauce,https://www.hotsauce.com/fire-ant-juice-gourmet-hot-sauce/
"First Responder's EMS Hot Sauce, 5oz.",$6.50,$5.95,HotSauce,https://www.hotsauce.com/first-responders-ems-hot-sauce/
"First Responder's Firefighter Hot Sauce, 5oz.",$6.50,$5.95,HotSauce,https://www.hotsauce.com/first-responders-firefighter-hot-sauce/
"First Responder's Police Hot Sauce, 5oz.",$6.50,$5.95,HotSauce,https://www.hotsauce.com/first-responders-police-hot-sauce/
"Flamin' Flatulence X-Hot Hot Sauce, 5.7oz.",$8.50,$7.95,Professor Payne,https://www.hotsauce.com/flamin-flatulence-x-hot-hot-sauce/
"Frostbite Hot Sauce, 5oz.",$9.50,$8.95,CaJohns,https://www.hotsauce.com/frostbite-hot-sauce/
"Funky Monkey Banana Rum Pepper Sauce, 5.7oz.",$8.50,$7.95,HotSauce,https://www.hotsauce.com/funky-monkey-banana-rum-pepper-sauce/
"Garlic -O- Holic Hot Sauce Gift Set, 4/5oz.",$23.50,$19.95,HotSauce,https://www.hotsauce.com/garlic-o-holic-hot-sauce-gift-set/
"Girls in Heat Hot Sauce Gift Box, 4/5oz.",$22.00,$19.95,HotSauce,https://www.hotsauce.com/girls-in-heat-hot-sauce-gift-box/
"Habanero Hot Sauce From Hell Beyond Hot, 5oz.",$6.50,$5.95,Habanero From Hell,https://www.hotsauce.com/habanero-hot-sauce-from-hell-beyond-hot/
"Habanero Hot Sauce From Hell Devil's Revenge, 5oz.",$9.50,$8.95,Habanero From Hell,https://www.hotsauce.com/habanero-hot-sauce-from-hell-devils-revenge/
"Haboob Heat One Hot Prick Hot Sauce, 5oz.",$11.50,$9.95,CaJohns,https://www.hotsauce.com/Haboob-Heat-Hot-Sauce/
"Heartbeat Dill Pickle Serrano Hot Sauce, 6oz.",$13.00,$11.95,Heartbeat Hot Sauces,https://www.hotsauce.com/Heartbeat-Dill-Pickle-Serrano-Hot-Sauce/
"Heartbeat Hot Sauces 4 Pack, 4/6oz.",$54.00,$47.80,Heartbeat Hot Sauces,https://www.hotsauce.com/Heartbeat-Hot-Sauces-4-Pack/
"Heartbeat Lion's Mane Piri Piri Hot Sauce, 6oz.",$13.00,$11.95,Heartbeat Hot Sauces,https://www.hotsauce.com/Heartbeat-Lions-Mane-Piri-Piri-Hot-Sauce/
"Heartbeat Pineapple Habanero Hot Sauce, 6oz.",$13.50,$11.95,Heartbeat Hot Sauces,https://www.hotsauce.com/Heartbeat-Pineapple-Habanero-Hot-Sauce/
"Heartbeat Red Habanero Hot Sauce, 6oz.",$13.50,$11.95,Heartbeat Hot Sauces,https://www.hotsauce.com/Heartbeat-Red-Habanero-Hot-Sauce/
"Heartbeat Scorpion Hot Sauce, 6oz.",$13.50,$11.95,Heartbeat Hot Sauces,https://www.hotsauce.com/Heartbeat-Scorpion-Hot-Sauce/
"Heartbreaking Dawns Classic Gold Habanero Hot Sauce, 5oz.",$6.50,$5.95,Heartbreaking Dawns,https://www.hotsauce.com/Heartbreaking-Dawns-Classic-Gold-Hot-Sauce/
"Heartbreaking Dawns Mango Habanero Hot Sauce, 5oz.",$6.50,$5.95,Heartbreaking Dawns,https://www.hotsauce.com/heartbreaking-dawns-mango-habanero-hot-sauce/
"Heartbreaking Dawns Milder Hot Sauce 3 Pack, 3/5oz.",$19.50,$17.85,Heartbreaking Dawns,https://www.hotsauce.com/heartbreaking-dawns-milder-3-pack/
"Heartbreaking Dawns Papa Boi Caribbean Scotch Bonnet Hot Sauce, 5oz.",$7.50,$6.95,Heartbreaking Dawns,https://www.hotsauce.com/heartbreaking-dawns-papa-boi-caribbean-scotch-bonnet-sauce/
"Heartbreaking Dawns Skylarking Anytime Hot Sauce, 5oz.",$7.50,$6.95,Heartbreaking Dawns,https://www.hotsauce.com/Heartbreaking-Dawns-Skylarking-Anytime-Sauce/
"Heartbreaking Dawns The Green Verde Hot Sauce, 5oz.",$7.50,$6.95,Heartbreaking Dawns,https://www.hotsauce.com/heartbreaking-dawns-the-green-verde-hot-sauce/
"Hellfire Blueberry Hell Hot Sauce, 5oz.",$10.50,$9.95,Hellfire Hot Sauce,https://www.hotsauce.com/hellfire-blueberry-hell-hot-sauce/
"Hellfire Gourmet Red Hot Sauce, 5oz.",$9.00,$7.95,Hellfire Hot Sauce,https://www.hotsauce.com/hellfire-gourmet-red-hot-sauce/
"Hellfire Ritual Habitual Hot Sauce, 5oz.",$10.00,$8.95,Hellfire Hot Sauce,https://www.hotsauce.com/Hellfire-Ritual-Habitual-Hot-Sauce/
"Hemorrhoid Helper Burns Both Ways Hot Sauce, 5oz.",$7.50,$6.95,FireWorks,https://www.hotsauce.com/hemorrhoid-helper-burns-both-ways-hot-sauce/
"High River Sauces Cheeba Gold Barbados Style Scotch Bonnet Pepper Sauce, 5oz.",$7.50,$6.95,High River Sauces,https://www.hotsauce.com/high-river-sauces-cheeba-gold-barbados-style-scotch-bonnet-pepper-sauce/
"High River Sauces Grapes of Wrath Hot Sauce, 5.4oz.",$10.00,$9.49,High River Sauces,https://www.hotsauce.com/high-river-sauces-grapes-of-wrath-hot-sauce/
"High River Sauces Green Manalishi Verde Hot Sauce, 5oz.",$8.00,$7.49,High River Sauces,https://www.hotsauce.com/High-River-Sauces-Green-Manalishi-Verde-Hot-Sauce/
"High River Sauces Hellacious Hot Sauce, 5.4oz.",$7.50,$6.95,High River Sauces,https://www.hotsauce.com/high-river-sauces-hellacious-hot-sauce/
"High River Sauces Tears of the Sun Hot Sauce, 5.4oz.",$7.50,$6.95,High River Sauces,https://www.hotsauce.com/high-river-sauces-tears-of-the-sun-hot-sauce/
"High River Sauces Tears of the Sun Private Reserve Hot Sauce, 5oz.",$12.00,$9.95,High River Sauces,https://www.hotsauce.com/High-River-Sauces-Tears-Of-The-Sun-Private-Reserve-Hot-Sauce/
"Historic Lynchburg Tennessee Whiskey Habanero Hot Sauce with Jack Daniels, 6oz.",$6.50,$5.95,Tennessee Whiskey,https://www.hotsauce.com/historic-lynchburg-tennessee-whiskey-habanero-hot-sauce-with-jack-daniels/
"Historic Lynchburg Tennessee Whiskey Jack Daniel's 151 Proof BBQ, 16oz.",$8.50,$7.95,Tennessee Whiskey,https://www.hotsauce.com/historic-lynchburg-tennessee-whiskey-jack-daniels-151-proof-bbq/
"Historic Lynchburg Tennessee Whiskey Jalapeno Hot Sauce with Jack Daniels, 6oz.",$6.50,$5.95,Tennessee Whiskey,https://www.hotsauce.com/historic-lynchburg-tennessee-whiskey-jalapeno-jack-daniels-hot-sauce/
"Hog's Ass Garlic Habanero Hot Sauce, 5oz.",$7.00,$6.49,Hogs Ass,https://www.hotsauce.com/hogs-ass-garlic-habanero-hot-sauce/
"Hog's Breath Key West Extra Hot Sauce, 5oz.",$7.00,$6.49,Hogs Breath,https://www.hotsauce.com/hogs-breath-key-west-extra-hot-sauce/
"Hot 'N Horny Scorching Hot Sauce, 5oz.",$6.50,$5.95,HotSauce,https://www.hotsauce.com/hot-n-horny-scorching-hot-sauce/
"Hot Spots Chief Smoky Hot Sauce, 5oz.",$7.50,$6.95,CaJohns,https://www.hotsauce.com/hot-spots-chief-smoky-hot-sauce/
"Hot Spots Ember Hot Sauce, 5oz.",$7.50,$6.95,CaJohns,https://www.hotsauce.com/hot-spots-ember-hot-sauce/
"Hot Spots Fireball Hot Sauce, 5oz.",$7.50,$6.95,CaJohns,https://www.hotsauce.com/hot-spots-fireball-hot-sauce/
"Hot Spots Sparky Hot Sauce, 5oz.",$7.50,$6.95,CaJohns,https://www.hotsauce.com/hot-spots-sparky-hot-sauce/
"Hotsy Totsy XXX Rated Hot Sauce, 5oz.",$6.50,$5.95,FireWorks,https://www.hotsauce.com/hotsy-totsy-xxx-rated-hot-sauce/
"Howler Monkey Amarillo Hot Sauce, 5oz.",$6.50,$5.95,Howler Monkey,https://www.hotsauce.com/howler-monkey-amarillo-hot-sauce/
"Howler Monkey Hot Sauce Variety 4 Pack, 4/5oz.",$26.00,$23.80,Howler Monkey,https://www.hotsauce.com/howler-monkey-hot-sauce-variety-4-pack/
"Howler Monkey Original Hot Sauce, 5oz.",$6.50,$5.95,Howler Monkey,https://www.hotsauce.com/howler-monkey-original-hot-sauce/
"Howler Monkey Red Hot Sauce, 5oz.",$6.50,$5.95,Howler Monkey,https://www.hotsauce.com/howler-monkey-red-hot-sauce/
"Howler Monkey Verde Hot Sauce, 5oz.",$6.50,$5.95,Howler Monkey,https://www.hotsauce.com/howler-monkey-verde-hot-sauce/
"I Am Sofa King Stew Ped Hot Sauce, 5oz.",$6.50,$5.95,Hot Sauce Fanatics,https://www.hotsauce.com/i-am-sofa-king-stew-ped-hot-sauce/
"Iguana Bold Gold Habanero Mini Hot Sauce, 2oz.",$3.00,$2.49,Iguana Sauces,https://www.hotsauce.com/iguana-bold-gold-habanero-mini-hot-sauce/
"Iguana Fearsome Five Variety Pack, 5/5oz.",$32.50,$29.75,Iguana Sauces,https://www.hotsauce.com/iguana-fearsome-five-variety-pack/
"Iguana Gold Golden Habanero Island Pepper Sauce, 5oz.",$6.50,$5.95,Iguana Sauces,https://www.hotsauce.com/iguana-gold-golden-habanero-island-pepper-sauce/
"Iguana Radioactive Explosively Hot Atomic Pepper Sauce, 5oz.",$6.50,$5.95,Iguana Sauces,https://www.hotsauce.com/iguana-radioactive-explosively-hot-atomic-pepper-sauce/
"Iguana Red Habanero Mini Pepper Sauce, 2oz.",$3.00,$2.49,Iguana Sauces,https://www.hotsauce.com/iguana-red-habanero-mini-pepper-sauce/
"Iguana Red Moderately Hot Cayenne Pepper Sauce, 5oz.",$6.50,$5.95,Iguana Sauces,https://www.hotsauce.com/iguana-red-moderately-hot-cayenne-pepper-sauce/
"Iguana Tropic Thunder Red Jalapeno & Habanero Tropical Pepper, 5oz.",$6.50,$5.95,Iguana Sauces,https://www.hotsauce.com/iguana-tropic-thunder-red-jalapeno-habanero-tropical-pepper-sauce/
"Iguana Ultimate en Fuego Pepper Sauce Gift Set, 8/5oz.",$52.00,$47.60,Iguana Sauces,https://www.hotsauce.com/iguana-ultimate-en-fuego-pepper-sauce-gift-set/
"Iguana Vicious Jalapeno Mini Pepper Sauce, 2oz.",$3.00,$2.49,Iguana Sauces,https://www.hotsauce.com/iguana-vicious-jalapeno-mini-pepper-sauce/
"Iguana XXX Pretty Damn Hot Habanero Pepper Sauce, 5oz.",$6.50,$5.95,Iguana Sauces,https://www.hotsauce.com/iguana-xxx-pretty-damn-hot-habanero-pepper-sauce/
"Jack Ass Salsa, With Habanero Pepper Packet, 13oz.",$9.50,$8.95,Ass Kickin,https://www.hotsauce.com/jack-ass-salsa-with-habanero-pepper-packet/
"JohnBoy and Billy's Hot & Spicy Grillin' Sauce, 19oz.",$7.50,$6.95,JohnBoy & Billys,https://www.hotsauce.com/johnboy-and-billys-hot-spicy-grillin-sauce/
"Karma Sauce Red Habanero Cherry Bomb Hot Sauce, 5oz.",$9.50,$8.95,Karma,https://www.hotsauce.com/karma-sauce-cherry-bomb-hot-sauce/
"Karma Sauce The Goblin Hot Sauce, 5oz.",$10.50,$9.95,Karma,https://www.hotsauce.com/karma-sauce-the-goblin-hot-sauce/
"Keep Calm and Pour More Habanero On Hot Sauce, 5oz.",$6.50,$5.95,Hot Sauce Fanatics,https://www.hotsauce.com/keep-calm-and-pour-more-habanero-on-hot-sauce/
"Kentucky Straight Bourbon Ghost Pepper Hot Sauce, 5oz.",$8.00,$7.49,Kentucky Straight,https://www.hotsauce.com/kentucky-straight-bourbon-ghost-pepper-hot-sauce/
"Kentucky Straight Bourbon Habanero Hot Sauce, 5oz.",$6.50,$5.95,Kentucky Straight,https://www.hotsauce.com/kentucky-straight-bourbon-habanero-hot-sauce/
"Kentucky Straight Bourbon Hot Sauce Gift Box, 4/5oz.",$29.00,$26.95,Kentucky Straight,https://www.hotsauce.com/kentucky-straight-bourbon-hot-sauce-gift-box/
"Kiss of Fire the Ultimate XXX Hot Sauce, 5oz.",$9.00,$7.95,HotSauce,https://www.hotsauce.com/kiss-of-fire-the-ultimate-xxx-hot-sauce/
"Lilly Lager Pilsner Hot Sauce, 5oz.",$7.50,$6.95,HotSauce,https://www.hotsauce.com/lilly-lager-pilsner-hot-sauce/
"Macioce's Hot Italian Salsa & Sauce, 16oz.",$9.50,$8.95,CaJohns,https://www.hotsauce.com/macioces-hot-italian-salsa-sauce/
"Mad Cat Hot Sauce, Not For PussyCats!, 5oz.",$7.50,$6.95,FireWorks,https://www.hotsauce.com/mad-cat-hot-sauce-not-for-pussycats/
"Marie Sharp's Belizean Heat Hot Sauce, 10oz.",$10.00,$7.95,Marie Sharps,https://www.hotsauce.com/marie-sharps-belizean-heat-hot-sauce/
"Marie Sharp's Belizean Heat Hot Sauce, 5oz.",$6.50,$5.95,Marie Sharps,https://www.hotsauce.com/marie-sharps-belizean-heat-hot-sauce-5oz/
"Marie Sharp's Belizean Heat Mini Habanero Hot Sauce, 1.69oz.",$3.00,$2.49,Marie Sharps,https://www.hotsauce.com/marie-sharps-belizean-heat-mini-habanero-hot-sauce/
"Marie Sharp's Belizean Season All, 10oz.",$6.50,$5.95,Marie Sharps,https://www.hotsauce.com/marie-sharps-belizean-season-all/
"Marie Sharp's Beware Comatose Hot Sauce Mini, 1.69oz.",$3.00,$2.49,Marie Sharps,https://www.hotsauce.com/marie-sharps-beware-comatose-mini-hot-sauce/
"Marie Sharp's Beware Comatose Hot Sauce, 10oz.",$8.00,$6.95,Marie Sharps,https://www.hotsauce.com/marie-sharps-beware-comatose-hot-sauce/
"Marie Sharp's Beware Comatose Hot Sauce, 5oz.",$6.50,$5.95,Marie Sharps,https://www.hotsauce.com/marie-sharps-beware-comatose-hot-sauce-5oz/
"Marie Sharp's Exotic Steak Hot Sauce, 11.5oz.",$8.00,$6.95,Marie Sharps,https://www.hotsauce.com/marie-sharps-exotic-hot-sauce/
"Marie Sharp's Fiery Hot Habanero Hot Sauce, 10oz.",$8.00,$6.95,Marie Sharps,https://www.hotsauce.com/marie-sharps-fiery-hot-habanero-hot-sauce/
"Marie Sharp's Fiery Hot Habanero Mini Pepper Sauce, 1.69oz.",$3.00,$2.49,Marie Sharps,https://www.hotsauce.com/marie-sharps-fiery-hot-habanero-mini-pepper-sauce/
"Marie Sharp's Fiery Hot Red Habanero Sauce, 5oz.",$5.50,$4.95,Marie Sharps,https://www.hotsauce.com/marie-sharps-fiery-hot-red-habanero-sauce/
"Marie Sharp's Grapefruit Pulp Habanero, 5oz.",$6.50,$5.95,Marie Sharps,https://www.hotsauce.com/marie-sharps-grapefruit-pulp-habanero/
"Marie Sharp's Green Habanero Mini Hot Sauce with Prickly Pears, 1.69oz.",$3.00,$2.49,Marie Sharps,https://www.hotsauce.com/marie-sharps-green-habanero-mini-hot-sauce-with-prickly-pears/
"Marie Sharp's Hot Habanero Hot Sauce, 10oz.",$8.00,$6.95,Marie Sharps,https://www.hotsauce.com/marie-sharps-hot-habanero-hot-sauce/
"Marie Sharp's Hot Habanero Mini Pepper Sauce, 1.69oz.",$3.00,$2.49,Marie Sharps,https://www.hotsauce.com/marie-sharps-hot-habanero-mini-pepper-sauce/
"Marie Sharp's Hot Habanero Pepper Sauce, 5oz.",$5.50,$4.95,Marie Sharps,https://www.hotsauce.com/marie-sharps-hot-habanero-pepper-sauce/
"Marie Sharp's Hot Nopal / Prickly Pear Green Habanero, 10oz.",$8.00,$6.95,Marie Sharps,https://www.hotsauce.com/marie-sharps-hot-nopal-prickly-pear-green-habanero/
"Marie Sharp's Hot Nopal / Prickly Pear Green Habanero, 5oz.",$6.50,$5.95,Marie Sharps,https://www.hotsauce.com/marie-sharps-hot-nopal-prickly-pear-green-habanero-5oz/
"Marie Sharp's No Wimps Allowed Hot Sauce, 5oz.",$6.50,$5.95,Marie Sharps,https://www.hotsauce.com/marie-sharps-no-wimps-allowed-hot-sauce/
"Marie Sharp's Orange Pulp Habanero, 5oz.",$6.50,$5.95,Marie Sharps,https://www.hotsauce.com/marie-sharps-orange-pulp-habanero/
"Marie Sharp's Orange Pulp Mini, 1.69oz.",$3.00,$2.49,Marie Sharps,https://www.hotsauce.com/marie-sharps-orange-pulp-mini-hot-sauce/
"Marie Sharp's Original Garlic Habanero Pepper Sauce, 5oz.",$6.50,$5.95,Marie Sharps,https://www.hotsauce.com/Marie-Sharps-Original-Garlic-Habanero-Pepper-Sauce/
"Marie Sharp's Pure Love Pineapple Habanero Pepper Sauce, 5oz.",$7.00,$5.95,Marie Sharps,https://www.hotsauce.com/Marie-Sharps-Pure-Love-Pineapple-Habanero-Pepper-Sauce/
"Marie Sharp's Pure Mango Habanero Pepper Sauce, 5oz.",$7.00,$5.95,Marie Sharps,https://www.hotsauce.com/marie-sharps-pure-mango-habanero-pepper-sauce/
"Marie Sharp's Smoked Habanero Pepper Sauce, 5oz.",$6.50,$5.95,Marie Sharps,https://www.hotsauce.com/marie-sharps-smoked-habanero-pepper-sauce/
"Matouk's (New) Soca Hot Sauce, 10oz.",$6.00,$5.75,Matouks,https://www.hotsauce.com/matouks-soca-hot-sauce/
"Matouk's Hot Calypso Hot Sauce, 10oz.",$6.00,$5.75,Matouks,https://www.hotsauce.com/matouks-hot-calypso-hot-sauce/
"Matouk's Salsa Picante Hot Pepper Sauce, 10oz.",$6.00,$5.75,Matouks,https://www.hotsauce.com/matouks-salsa-picante-hot-pepper-sauce/
"Matouk's West Indian Flambeau Hot Sauce, 10oz.",$6.00,$5.75,Matouks,https://www.hotsauce.com/matouks-west-indian-flambeau-hot-sauce/
"Matouk's West Indian Hot Sauces 4 Pack, 4/10oz.",$26.00,$23.00,Matouks,https://www.hotsauce.com/matouks-west-indian-hot-sauces-4-pack/
"Matouk's West Indian Hot Sauces Full Set, 6/10oz.",$43.00,$40.70,Matouks,https://www.hotsauce.com/matouks-west-indian-hot-sauces-full-set/
"Matouk's West Indian Salsa Picante Hot Sauce, 10oz.",$6.00,$5.75,Matouks,https://www.hotsauce.com/matouks-west-indian-salsa-picante-hot-sauce/
"Melinda's 3 Pack Hot Sauce Gift Set, 3/5oz.",$14.00,$12.95,Melinda's,https://www.hotsauce.com/melindas-3-pack-hot-sauce-gift-set/
"Melinda's Amarillo Mustard Pepper Sauce, 5oz.",$5.50,$4.95,Melinda's,https://www.hotsauce.com/melindas-amarillo-mustard-pepper-sauce/
"Melinda's Chipotle Habanero Hot Sauce, 5oz.",$6.50,$5.95,Melinda's,https://www.hotsauce.com/melindas-chipotle-habanero-hot-sauce/
"Melinda's Extra Hot Habanero Sauce, 5oz.",$6.50,$5.95,Melinda's,https://www.hotsauce.com/melindas-extra-hot-habanero-sauce/
"Melinda's Hot Habanero Pepper Sauce, 5oz.",$6.50,$5.95,Melinda's,https://www.hotsauce.com/melindas-hot-habanero-pepper-sauce/
"Melinda's Ketchup Complete Gift Set, 5/14oz.",$38.50,$35.83,Melinda's,https://www.hotsauce.com/Melindas-Ketchup-Complete-Gift-Set/
"Melinda's Mango Habanero Sauce, 5oz.",$6.50,$5.95,Melinda's,https://www.hotsauce.com/melindas-mango-habanero-sauce/
"Melinda's Naga Jolokia Ketchup, 14oz.",$8.00,$7.49,Melinda's,https://www.hotsauce.com/melindas-naga-jolokia-ketchup/
"Melinda's NEW Creamy Style Ghost Pepper Wing Sauce, 12oz.",$7.50,$6.95,Melinda's,https://www.hotsauce.com/Melindas-Creamy-Style-Ghost-Pepper-Wing-Sauce/
"Melinda's NEW Peri Peri Garlic Hot Sauce, 12oz.",$7.50,$6.95,Melinda's,https://www.hotsauce.com/Melindas-Peri-Peri-Garlic-Hot-Sauce/
"Melinda's NEW Peri Peri Hot Sauce, 12oz.",$7.50,$6.95,Melinda's,https://www.hotsauce.com/Melindas-Peri-Peri-Hot-Sauce/
"Melinda's Scotch Bonnet Hot Sauce, 5oz.",$6.50,$5.95,Melinda's,https://www.hotsauce.com/melindas-scotch-bonnet-hot-sauce/
"Melinda's XXXTra Hot Hot Sauce, 5oz.",$6.50,$5.95,Melinda's,https://www.hotsauce.com/melindas-xxxtra-hot-hot-sauce/
"Merry Fuckin' Christmas Hot Sauce, 5oz. (Seasonal)",$6.50,$5.95,Hot Sauce Fanatics,https://www.hotsauce.com/merry-fuckin-christmas-hot-sauce/
"Micanopy Gold Hot Sauce, 5oz.",$7.50,$6.95,Micanopy Gold,https://www.hotsauce.com/micanopy-gold-hot-sauce/
"Micanopy Gold Xtra Hot Sauce, 5oz.",$7.50,$6.95,Micanopy Gold,https://www.hotsauce.com/micanopy-gold-xtra-hot-sauce/
"Ming Loy Sriracha Hot Sauce, 5oz.",$5.50,$4.95,HotSauce,https://www.hotsauce.com/ming-loy-sriracha-hot-sauce/
"Mini Ass Kickin Roasted Garlic Hot Sauce, .75oz.",$2.50,$1.99,Ass Kickin,https://www.hotsauce.com/ass-kickin-roasted-garlic-mini-hot-sauce/
"Mini Ass Kickin' Ass Blaster Hot Sauce, .75oz.",$2.50,$1.99,Ass Kickin,https://www.hotsauce.com/ass-kickin-ass-blaster-mini-hot-sauce/
"Mini Ass Kickin' Cajun Hot Sauce, .75oz.",$2.50,$1.99,Ass Kickin,https://www.hotsauce.com/ass-kickin-cajun-mini-hot-sauce/
"Mini Ass Kickin' Original Hot Sauce, .75oz.",$2.50,$1.99,Ass Kickin,https://www.hotsauce.com/mini-ass-kickin-original-hot-sauce/
"Mini Ass Kickin' Wasabi Horseradish Hot Sauce, .75oz.",$2.50,$1.99,Ass Kickin,https://www.hotsauce.com/ass-kickin-wasabi-horseradish-mini-hot-sauce/
"Mini Hot Sauce From Hell, .75oz.",$2.50,$1.99,Habanero From Hell,https://www.hotsauce.com/hot-sauce-from-hell-mini-hot-sauce/
"Mini Spontaneous Combustion Hot Sauce, .75oz.",$2.50,$1.99,Spontaneous Combust,https://www.hotsauce.com/spontaneous-combustion-mini-hot-sauce/
"Mo Hotta Mo Betta Cayenne Garlic Hot Sauce, 5oz.",$6.50,$5.95,Mo Hotta,https://www.hotsauce.com/mo-hotta-mo-betta-cayenne-garlic-hot-sauce/
"Mountain Man Chipotle Hot Sauce, 5oz.",$6.50,$5.95,Mountain Man,https://www.hotsauce.com/mountain-man-chipotle-hot-sauce/
"Mountain Man Fire Roasted Habanero, 5oz.",$8.00,$6.95,Mountain Man,https://www.hotsauce.com/mountain-man-fire-roasted-habanero/
"Mountain Man Sauces Gift Set, 1/12oz, 3/5oz.",$30.00,$26.80,Mountain Man,https://www.hotsauce.com/mountain-man-sauces-gift-set/
"Naga Jolokia 10 BBQ Sauce, 16oz.",$11.00,$9.95,CaJohns,https://www.hotsauce.com/naga-jolokia-10-bbq-sauce/
"Naga Jolokia 10 Mustard, 9oz.",$11.00,$9.95,CaJohns,https://www.hotsauce.com/naga-jolokia-10-mustard/
"Naga Jolokia 10 Rub, 6oz.",$10.50,$8.95,CaJohns,https://www.hotsauce.com/naga-jolokia-10-rub/
"Naga Jolokia 10 Salsa, 16oz.",$11.00,$9.95,CaJohns,https://www.hotsauce.com/naga-jolokia-10-salsa/
"Naga Jolokia 10 Spice, 2oz.",$9.50,$8.49,CaJohns,https://www.hotsauce.com/naga-jolokia-10-spice/
"Naga Jolokia 10 Wing Sauce, 12oz.",$11.00,$9.95,CaJohns,https://www.hotsauce.com/naga-jolokia-10-wing-sauce/
"No Shit This Is Hot! Hot Sauce, 5oz.",$6.50,$5.95,HotSauce,https://www.hotsauce.com/no-shit-this-is-hot-hot-sauce/
"No Survivors Hot Sauce Gift Box, 4/5oz.",$30.00,$25.95,HotSauce,https://www.hotsauce.com/no-survivors-hot-sauce-gift-box/
"North Carolina Hot Sauce, 5oz.",$8.50,$7.95,HotSauce,https://www.hotsauce.com/north-carolina-hot-sauce/
"Oaxacan Hot Sauce, 5oz.",$8.00,$7.49,CaJohns,https://www.hotsauce.com/oaxacan-hot-sauce/
"Orange Krush The Habanero Sauce, 5.7oz.",$8.00,$7.49,HotSauce,https://www.hotsauce.com/orange-krush-the-habanero-sauce/
"Pain and Suffering XXX Rated Hurts So Bad, 5oz.",$6.50,$5.95,HotSauce,https://www.hotsauce.com/pain-and-suffering-xxx-rated-hurts-so-bad/
"Pain In The Ass Hot Pepper Sauce, 5oz.",$6.50,$5.95,FireWorks,https://www.hotsauce.com/pain-in-the-ass-hot-pepper-sauce/
"Pain is Good #37 Honey Habanero Screamin' Wing Sauce, 13.5oz.",$10.50,$9.95,Pain Is Good,https://www.hotsauce.com/pain-is-good-37-honey-habanero-screamin-wing-sauce/
"Pain Is Good Batch #114 Jamaican Style Hot Sauce, 7oz.",$13.00,$10.49,Pain Is Good,https://www.hotsauce.com/pain-is-good-batch-114-jamaican-style-hot-sauce/
"Pain is Good Batch #114 Salsa, 15.5oz.",$7.50,$6.95,Pain Is Good,https://www.hotsauce.com/pain-is-good-batch-114-salsa/
"Pain Is Good Batch #218 Louisiana Style, 7oz.",$13.00,$10.49,Pain Is Good,https://www.hotsauce.com/pain-is-good-batch-218-louisiana-style-hot-sauce/
"Pain is Good Batch #218 Salsa, 15.5oz.",$10.50,$9.95,Pain Is Good,https://www.hotsauce.com/pain-is-good-batch-218-salsa/
"Pain Is Good Batch #37 Garlic Style Hot Sauce, 7oz.",$13.00,$10.49,Pain Is Good,https://www.hotsauce.com/pain-is-good-batch-37-garlic-style-hot-sauce/
"Pain Is Good Batch #37 Habanero Garlic Salsa, 15.5oz.",$7.50,$6.95,Pain Is Good,https://www.hotsauce.com/pain-is-good-batch-37-habanero-garlic-salsa/
"Pain is Good Chipotle Hot Sauce, 7oz.",$12.00,$10.49,Pain Is Good,https://www.hotsauce.com/most-wanted-pain-is-good-chipotle-hot-sauce/
"Pain Is Good Ghost Pepper Spicy Virginia Peanuts, 9oz.",$10.00,$8.95,Pain Is Good,https://www.hotsauce.com/Pain_Is_Good_Ghost_Pepper_Spicy_Virginia_Peanuts/
"Pain is Good Habanero Gochujang Hot Sauce, 7oz.",$13.00,$10.49,Pain Is Good,https://www.hotsauce.com/Pain-Is-Good-Habanero-Gochujang-Hot-Sauce/
"Pain is Good Habanero Sambal Hot Sauce, 7oz.",$13.00,$10.49,Pain Is Good,https://www.hotsauce.com/Pain-Is-Good-Habanero-Sambal-Hot-Sauce/
"Pain Is Good Original 3 Gift Set, 3/6.75oz.",$36.50,$31.47,Pain Is Good,https://www.hotsauce.com/pain-is-good-original-3-gift-set/
"Pain is Good Sriracha Hot Sauce, 7oz.",$8.50,$6.95,Pain Is Good,https://www.hotsauce.com/most-wanted-pain-is-good-sriracha-hot-sauce/
"Pappy's Hottest Ride in Town BBQ Sauce, 12.7oz.",$7.50,$6.95,Pappy's BBQ,https://www.hotsauce.com/pappys-hottest-ride-in-town-bbq-sauce/
"Pappy's Moonshine Madness BBQ Sauce, 12.7oz.",$7.50,$6.95,Pappy's BBQ,https://www.hotsauce.com/pappys-moonshine-madness-bbq-sauce/
"Pappy's Moonshine Madness Clear Hot Sauce, 3.4oz.",$7.50,$5.95,Pappy's BBQ,https://www.hotsauce.com/Pappys-Moonshine-Madness-Clear-Hot-Sauce/
"Pappy's XXX White Lightnin' BBQ Sauce, 12.7oz.",$7.50,$6.95,Pappy's BBQ,https://www.hotsauce.com/pappys-xxx-white-lightnin-bbq-sauce/
"Peppers Original Blue Crab Salsa, 12oz.",$8.50,$7.95,HotSauce,https://www.hotsauce.com/peppers-original-blue-crab-salsa/
"Peppers Zesty Blue Crab Salsa, 12oz.",$9.00,$8.49,HotSauce,https://www.hotsauce.com/peppers-zesty-blue-crab-salsa/
"PETA Garlic Habanero Hot Sauce, 5oz.",$5.50,$4.95,PETA Sauces,https://www.hotsauce.com/peta-garlic-habanero-hot-sauce/
"Pittsburgh Sucks! Hot Sauce, 5oz.",$6.50,$5.95,HotSauce,https://www.hotsauce.com/pittsburgh-sucks-hot-sauce/
"Pleasure & Pain XXX Rated Hot Sauce, 5oz.",$5.50,$4.95,HotSauce,https://www.hotsauce.com/pleasure-pain-xxx-rated-hot-sauce/
"Poirier's Louisiana Style Hot Sauce, 6oz.",$16.50,$14.95,Heartbeat Hot Sauces,https://www.hotsauce.com/Poiriers-Louisiana-Style-Hot-Sauce/
"Poots Peppa Sauce, The Cats Meow, 5oz.",$6.50,$5.95,FireWorks,https://www.hotsauce.com/poots-peppa-sauce-the-cats-meow/
"Pucker Butt Peach Habanero Hot Sauce, 5oz.",$12.50,$9.95,Pucker Butt,https://www.hotsauce.com/pucker-butt-peach-habanero-hot-sauce/
"Pucker Butt Shoot That's Hot, 5oz.",$11.00,$9.95,Pucker Butt,https://www.hotsauce.com/pucker-butt-shoot-thats-hot/
"Pure Habanero Red Savina Hot Sauce, 4oz.",$11.50,$9.95,Ass Kickin,https://www.hotsauce.com/pure-habanero-red-savina-hot-sauce/
"Raw Heat Vintage 69' Hot Sauce, 7.5oz.",$8.50,$7.95,Original Juan,https://www.hotsauce.com/raw-heat-vintage-69-hot-sauce/
"Rebel Yell Redneck Hot Sauce, 5oz.",$6.50,$5.95,FireWorks,https://www.hotsauce.com/ass-whoopin-redneck-hot-sauce/
"Rectal Revenge Hot Sauce, 5oz.",$6.50,$5.95,HotSauce,https://www.hotsauce.com/rectal-revenge-hot-sauce/
"Rectal Rocket Fuel Island Jerk Hot Sauce, 5oz.",$7.00,$6.49,HotSauce,https://www.hotsauce.com/rectal-rocket-fuel-island-jerk-hot-sauce/
"Rectum Ripper XXX 1/2 Mustard & Ginger, 5oz.",$6.50,$5.95,Tahiti Joes,https://www.hotsauce.com/rectum-ripper-xxx-mustard-ginger/
"Red Ghost Blistering Heat Ghost Wing Sauce, 12oz.",$7.50,$6.95,HotSauce,https://www.hotsauce.com/red-ghost-blistering-heat-ghost-wing-sauce/
"Red Ghost Buffalo Garlic Ghost Wing Sauce, 12oz.",$7.50,$6.95,HotSauce,https://www.hotsauce.com/red-ghost-buffalo-garlic-ghost-wing-sauce/
"Red Ghost Honey BBQ Ghost Wing Sauce, 12oz.",$7.50,$6.95,HotSauce,https://www.hotsauce.com/red-ghost-honey-bbq-ghost-wing-sauce/
"Red Hot Mama Hot Sauce, 5oz.",$6.50,$5.95,FireWorks,https://www.hotsauce.com/red-hot-mama-hot-sauce/
"Red Rectum Hot Sauce, 5oz.",$6.50,$5.95,FireWorks,https://www.hotsauce.com/red-rectum-hot-sauce/
"Red Rectum Revenge Hot Sauce, 5oz.",$6.50,$5.95,FireWorks,https://www.hotsauce.com/red-rectum-revenge-hot-sauce/
"Rincon Heat Mango Chipotle Hot Sauce, 5oz.",$7.00,$6.49,HotSauce,https://www.hotsauce.com/rincon-heat-mango-chipotle-hot-sauce/
"Ring of Fire Chipotle & Roasted Garlic, 12.5oz.",$11.00,$9.95,Ring Of Fire,https://www.hotsauce.com/ring-of-fire-chipotle-roasted-garlic/
"Ring of Fire Hot Sauce Complete Set, 7/12.5oz.",$70.50,$66.65,Ring Of Fire,https://www.hotsauce.com/Ring-Of-Fire-Hot-Sauce-Complete-Set/
"Ring of Fire Hot Sauce Gift Box, 4/12.5oz.",$50.00,$39.95,Ring Of Fire,https://www.hotsauce.com/ring-of-fire-hot-sauce-gift-box/
"Ring Of Fire Original Habanero Sauce, 12.5oz.",$11.00,$9.95,Ring Of Fire,https://www.hotsauce.com/ring-of-fire-original-habanero-hot-sauce/
