Name,Price,Price witout Tax,Brand,Link
"A Taste Of THAI Garlic Chili Sriracha Hot Sauce, 7oz.",$6.50,$5.95,HotSauce,https://www.hotsauce.com/A-Taste-Of-Thai-Garlic-Hot-Sauce/
"African Rhino Peri Peri Gift Set, 3/6.75oz.",$25.50,$23.85,African Rhino,https://www.hotsauce.com/african-rhino-peri-peri-gift-set/
"African Rhino Peri-Peri Extra Hot Sauce, 6.75oz.",$8.50,$7.95,African Rhino,https://www.hotsauce.com/african-rhino-peri-peri-extra-hot-sauce/
"African Rhino Peri-Peri Hot Sauce, 6.75oz.",$8.50,$7.95,African Rhino,https://www.hotsauce.com/african-rhino-peri-peri-hot-sauce/
"Alice Cooper Hot Sauce 3 Pack, 3/5oz.",$33.00,$30.00,Alice Cooper,https://www.hotsauce.com/Alice-Cooper-Hot-Sauce-3-Pack/
"Analize This XXX Garlic Hot Sauce, 5oz.",$6.50,$5.95,Tahiti Joes,https://www.hotsauce.com/analize-this-xxx-garlic-hot-sauce/
"Anchor Bar Hot Wing Sauces Gift Box, 3/12oz.",$22.00,$19.95,Anchor Bar,https://www.hotsauce.com/Anchor-Bar-Hot-Wing-Sauces-Gift-Box/
"Anchor Bar Hotter Buffalo Wing Sauce, 12oz.",$6.50,$5.95,Anchor Bar,https://www.hotsauce.com/Anchor-Bar-Hotter-Buffalo-Wing-Sauce/
"Angry Goat Pepper Co. Black Bison Hot Sauce, 5oz.",$9.50,$8.95,Angry Goat,https://www.hotsauce.com/angry-goat-pepper-co-black-bison-hot-sauce/
"Angry Goat Pepper Co. Dark Swizzle Hot Sauce, 5oz.",$9.00,$8.49,Angry Goat,https://www.hotsauce.com/angry-goat-pepper-co-dark-swizzle-hot-sauce/
"Angry Goat Pepper Co. Goat Rider Hot Sauce, 5oz.",$10.50,$9.95,Angry Goat,https://www.hotsauce.com/Angry-Goat-Pepper-Co-Goat-Rider-Hot-Sauce/
"Angry Goat Pepper Co. Pink Elephant Hot Sauce, 5oz.",$9.00,$8.49,Angry Goat,https://www.hotsauce.com/angry-goat-pepper-co-pink-elephant-hot-sauce/
"Angry Goat Pepper Co. Purple Hippo Hot Sauce, 5oz.",$9.50,$8.95,Angry Goat,https://www.hotsauce.com/angry-goat-pepper-co-purple-hippo-hot-sauce/
"Angry Goat Pepper Co. Red Armadillo Hot Sauce, 5oz.",$9.00,$8.49,Angry Goat,https://www.hotsauce.com/angry-goat-pepper-co-red-armadillo-hot-sauce/
"Angry Goat Pepper Co. Sacrifice Hot Sauce, 5oz.",$9.00,$8.49,Angry Goat,https://www.hotsauce.com/angry-goat-pepper-co-sacrifice-hot-sauce/
"Angry Goat Pepper Co. Sweaty Beaver Hot Sauce, 5oz.",$9.50,$8.95,Angry Goat,https://www.hotsauce.com/Angry-Goat-Pepper-Co-Sweaty-Beaver-Hot-Sauce/
"Angry Goat Pepper Co. Yellow Flamingo Hot Sauce, 5oz.",$9.00,$8.49,Angry Goat,https://www.hotsauce.com/angry-goat-pepper-co-yellow-flamingo-hot-sauce/
"Arizona Gunslinger Smokin Hot Habanero Pepper Sauce, 5oz.",$5.50,$4.95,Arizona Gunslinger,https://www.hotsauce.com/Arizona-Gunslinger-Smokin-Hot-Habanero-Pepper-Sauce/
"Ass Gas Hot Sauce, 5oz.",$6.50,$5.95,FireWorks,https://www.hotsauce.com/ass-gas-hot-sauce/
"Ass In Hell Hot Sauce, 5oz.",$10.50,$9.95,Ass In The Tub,https://www.hotsauce.com/ass-in-hell-hot-sauce/
"Ass In The Tub Hot Sauce, 5oz.",$5.50,$4.95,Ass In The Tub,https://www.hotsauce.com/ass-in-the-tub-hot-sauce/
"Ass In The Tub Hot Sauces Gift Pack, 3/5oz.",$23.00,$19.95,Ass In The Tub,https://www.hotsauce.com/Ass-In-The-Tub-Hot-Sauces-Gift-Pack/
"Ass Kickin Ass Blaster Original Chili, 1lb.",$8.50,$7.95,Ass Kickin,https://www.hotsauce.com/ass-kickin-ass-blaster-chili/
"Ass Kickin Beer Bread with Habanero Pepper, 1lb.",$8.50,$7.95,Ass Kickin,https://www.hotsauce.com/ass-kickin-beer-bread/
"Ass Kickin Cajun Hot Sauce, 5oz.",$6.50,$5.95,Ass Kickin,https://www.hotsauce.com/ass-kickin-cajun-hot-sauce/
"Ass Kickin Chicken Wing Sauce, 13oz.",$8.00,$7.49,Ass Kickin,https://www.hotsauce.com/ass-kickin-chicken-wing-sauce/
"Ass Kickin Corn Bread with Habanero Pepper, 1lb.",$8.50,$7.95,Ass Kickin,https://www.hotsauce.com/ass-kickin-corn-bread/
"Ass Kickin Dumb Ass Hot Sauce, 5oz.",$9.00,$8.49,Ass Kickin,https://www.hotsauce.com/ass-kickin-dumb-ass-hot-sauce/
"Ass Kickin Extreme Hot Sauces 3 Pack, 3/5oz.",$34.50,$29.85,Ass Kickin,https://www.hotsauce.com/Ass-Kickin-Extreme-Hot-Sauces-3-Pack/
"Ass Kickin Fire Roasted Green Chile and Tequila Salsa, 13oz.",$7.50,$6.95,Ass Kickin,https://www.hotsauce.com/ass-kickin-fire-roasted-green-chile-and-tequila-salsa/
"Ass Kickin Hot Habanero Popcorn, 3.5oz.",$3.00,$2.49,Ass Kickin,https://www.hotsauce.com/ass-kickin-hot-habanero-popcorn/
"Ass Kickin Hot Sauces Variety 4 Pack, 4/5oz.",$26.00,$23.80,Ass Kickin,https://www.hotsauce.com/Ass-Kickin-Hot-Sauces-Variety-4-Pack/
"Ass Kickin Hottest Hot Sauces 3 Pack, 3/5oz.",$29.00,$26.39,Ass Kickin,https://www.hotsauce.com/ass-kickin-hottest-hot-sauces-3-pack/
"Ass Kickin Jack Ass Complete Hot Sauce Set, 7/5oz.",$53.00,$49.27,Ass Kickin,https://www.hotsauce.com/ass-kickin-jack-ass-complete-hot-sauce-set/
"Ass Kickin Ketchup with Habanero, 12oz.",$8.00,$7.49,Ass Kickin,https://www.hotsauce.com/ass-kickin-ketchup/
"Ass Kickin Mini Hot Sauce 4-Pack , 4/.75oz.",$7.00,$6.49,Ass Kickin,https://www.hotsauce.com/ass-kickin-mini-hot-sauce-4-pack/
"Ass Kickin My Favorite Ass 4 Pack, 4/5oz.",$36.00,$33.96,Ass Kickin,https://www.hotsauce.com/ass-kickin-my-favorite-ass-4-pack/
"Ass Kickin Nuts Gift Set, 4/12oz.",$38.00,$36.34,Ass Kickin,https://www.hotsauce.com/ass-kickin-nuts-gift-set/
"Ass Kickin Original Habanero and Pinto Bean Salsa, 13oz.",$7.50,$6.95,Ass Kickin,https://www.hotsauce.com/ass-kickin-original-habanero-and-pinto-bean-salsa/
"Ass Kickin Original Hot Sauce, 5oz.",$6.50,$5.95,Ass Kickin,https://www.hotsauce.com/ass-kickin-original-hot-sauce/
"Ass Kickin Pain in the Ass Hot Sauce, 5oz.",$9.00,$8.49,Ass Kickin,https://www.hotsauce.com/ass-kickin-pain-in-the-ass-hot-sauce/
"Ass Kickin Peanuts w/ Habanero Pepper, 12oz.",$10.00,$8.95,Ass Kickin,https://www.hotsauce.com/ass-kickin-peanuts-habanero-pepper/
"Ass Kickin Roasted Garlic Habanero Hot Sauce, 5oz.",$6.50,$5.95,Ass Kickin,https://www.hotsauce.com/ass-kickin-roasted-garlic-hot-sauce/
"Ass Kickin Smart Ass Hot Sauce, 5oz.",$9.00,$8.49,Ass Kickin,https://www.hotsauce.com/ass-kickin-smart-ass-hot-sauce/
"Ass Kickin Snack Mix with Habanero Pepper, 10oz.",$10.00,$8.95,Ass Kickin,https://www.hotsauce.com/ass-kickin-snack-mix-habanero-pepper/
"Ass Kickin Sriracha Hot Sauce, 18oz.",$7.00,$6.49,Ass Kickin,https://www.hotsauce.com/ass-kickin-sriracha-hot-sauce/
"Ass Kickin Steak Sauce with Habanero, 10oz.",$8.00,$7.49,Ass Kickin,https://www.hotsauce.com/ass-kickin-steak-sauce/
"Ass Kickin Wasabi Horseradish Hot Sauce, 5oz.",$6.50,$5.95,Ass Kickin,https://www.hotsauce.com/ass-kickin-wasabi-horseradish-hot-sauce/
"Assplosion Hot Sauce, 5oz.",$5.50,$4.95,HotSauce,https://www.hotsauce.com/assplosion-hot-sauce/
"Backdraft Fire Hot Sauce, 5oz.",$6.50,$5.95,HotSauce,https://www.hotsauce.com/backdraft-fire-hot-sauce/
"Backfire Peppa Sauce, A Real Butt Burner!, 5oz.",$6.50,$5.95,FireWorks,https://www.hotsauce.com/backfire-peppa-sauce-a-real-butt-burner/
"Bad to the Bone Hot Sauce, 5oz.",$5.50,$4.95,FireWorks,https://www.hotsauce.com/bad-to-the-bone-hot-sauce/
"Bayou Blow Torch Hot Sauce, 5oz.",$7.50,$6.95,Bayou Sauces,https://www.hotsauce.com/bayou-blow-torch-hot-sauce/
"Bayou Fireballs Hot Sauce, 5oz.",$7.50,$6.95,Bayou Sauces,https://www.hotsauce.com/bayou-fireballs-hot-sauce/
"Bayou Love Potion Number 9 Louisiana Peppa Sauce, 5oz.",$7.50,$6.95,Bayou Sauces,https://www.hotsauce.com/bayou-love-potion-number-9-louisiana-peppa-sauce/
"Bayou Pecker Power Hot Sauce, 5oz.",$7.50,$6.95,Bayou Sauces,https://www.hotsauce.com/bayou-pecker-power-hot-sauce/
"Bee Sting ""Thai Sting"" Sweet Chili Sauce, 5oz.",$6.50,$5.95,Bee Sting,https://www.hotsauce.com/bee-sting-thai-sting-sweet-chili-sauce/
"Bee Sting Honey & Habanero Hot Sauce, 5oz.",$6.50,$5.95,Bee Sting,https://www.hotsauce.com/bee-sting-honey-habanero-hot-sauce/
"Best of Blueberry Hot Sauces Gift Set, 3/5oz.",$30.00,$27.39,HotSauce,https://www.hotsauce.com/best-of-blueberry-hot-sauces-gift-set/
"Best of Fatalii Hot Sauces Gift Set, 3/5oz.",$28.50,$25.85,CaJohns,https://www.hotsauce.com/Best-Of-Fatalii-Hot-Sauces/
"Betty Hops Pale Ale Chipotle Hot Sauce, 5oz.",$7.50,$6.95,HotSauce,https://www.hotsauce.com/betty-hops-pale-ale-chipotle-hot-sauce/
"Big Johnson's Twice Burnin Hot Sauce, 5oz.",$4.50,$3.95,HotSauce,https://www.hotsauce.com/big-johnsons-twice-burnin-hot-sauce/
"Biker Box Hot Sauce Gift Set, 4/5oz.",$23.00,$18.95,HotSauce,https://www.hotsauce.com/biker-box-hot-sauce-gift-set/
"Blair's After Death with Liquid Fire Hot Sauce, 5oz.",$13.00,$11.95,Blairs Sauces,https://www.hotsauce.com/blairs-after-death-with-liquid-fire-hot-sauce/
"Blair's Golden Death Sauce with Chipotle, 5oz.",$9.50,$8.95,Blairs Sauces,https://www.hotsauce.com/blairs-golden-death-sauce-with-chipotle/
"Blair's Original Death Sauce with Chipotle, 5oz.",$12.00,$10.95,Blairs Sauces,https://www.hotsauce.com/blairs-original-death-sauce-with-chipotle/
"Blair's Pure Death Naga (Ghost) Jolokia Hot Sauce, 5oz.",$10.50,$9.95,Blairs Sauces,https://www.hotsauce.com/blairs-pure-death-naga-ghost-jolokia-hot-sauce/
"Blair's Q Heat Chipotle Slam Exotic Hot Sauce, 8.44oz.",$11.00,$9.95,Blairs Sauces,https://www.hotsauce.com/blairs-q-heat-chipotle-slam-exotic-hot-sauce/
Blair's Q Heat Exotic Hot Sauce Gourmet Sampler 4 Pack / 2oz.,$17.00,$15.95,Blairs Sauces,https://www.hotsauce.com/blairs-q-heat-exotic-hot-sauce-gourmet-sampler-4-pack/
"Blair's Q Heat Habanero Mango Exotic Hot Sauce, 8.44oz.",$10.50,$9.95,Blairs Sauces,https://www.hotsauce.com/blairs-q-heat-habanero-mango-exotic-hot-sauce/
"Blair's Salsa De La Muerte con Chipotle, 5oz.",$8.50,$7.95,Blairs Sauces,https://www.hotsauce.com/blairs-salsa-de-la-muerte-con-chipotle/
"Blind Betty's Blind In The Rind Hot Sauce, 5oz.",$6.50,$5.95,Blind Bettys,https://www.hotsauce.com/blind-bettys-blind-in-the-rind-hot-sauce/
"Blind Betty's Original Recipe Hot Sauce, 5oz.",$7.00,$6.49,Blind Bettys,https://www.hotsauce.com/blind-bettys-original-recipe-hot-sauce/
"Blind Betty's Pineapple Pizzazz Hot Sauce, 5oz.",$7.00,$6.49,Blind Bettys,https://www.hotsauce.com/blind-bettys-pineapple-pizzazz-hot-sauce/
"Blowout Habanero Serious Hot Sauce, 5oz.",$6.50,$5.95,FireWorks,https://www.hotsauce.com/blowout-habanero-hot-sauce/
"Body Heat XXX Hot, 5oz.",$6.50,$5.95,FireWorks,https://www.hotsauce.com/body-heat-xxx-hot-sauce/
"Bone Suckin Hiccuppin Hot Habanero Hot Sauce, 5oz.",$7.50,$6.95,Bone Suckin BBQ,https://www.hotsauce.com/bone-suckin-habanero-sauce-hiccuppin-hot/
"Bone Suckin HOT Barbecue Sauce, 16oz.",$8.00,$7.49,Bone Suckin BBQ,https://www.hotsauce.com/bone-suckin-bbq-sauce-hot/
"Bone Suckin HOT Seasoning & Rub, 6.2oz.",$7.50,$6.95,Bone Suckin BBQ,https://www.hotsauce.com/bone-suckin-sauce-rib-rub-hot-seasoning-rub/
"Bone Suckin HOT Thicker Style Barbecue Sauce, 16oz.",$8.00,$7.49,Bone Suckin BBQ,https://www.hotsauce.com/bone-suckin-hot-and-thick-barbecue-sauce/
"Bone Suckin Thicker Style Barbecue Sauce, 16oz.",$8.00,$7.49,Bone Suckin BBQ,https://www.hotsauce.com/bone-suckin-thick-barbecue-sauce/
"Bone Suckin Yaki Teriyaki Sauce, 13.25oz.",$8.00,$7.49,Bone Suckin BBQ,https://www.hotsauce.com/bone-suckin-teriyaki-barbecue-sauce/
"Bourbon Q Gold Reserve Roasted Garlic and Chipotle Kentucky Bourbon BBQ, 12.7oz.",$8.50,$7.95,Kentucky Bourbon Q,https://www.hotsauce.com/Bourbon-Q-Gold-Reserve-Roasted-Garlic-And-Chipotle-Kentucky-Bourbon-BBQ/
"Boyle's Irish Scream Hot Sauce, 5oz.",$7.50,$6.95,HotSauce,https://www.hotsauce.com/boyles-irish-scream-hot-sauce/
"Brand New Asshole Hot Sauce, 5oz.",$5.50,$4.95,HotSauce,https://www.hotsauce.com/brand-new-asshole-hot-sauce/
"Bravado Spice Co Ghost Pepper Blueberry Hot Sauce, 5oz.",$9.00,$7.95,Bravado Spice Co,https://www.hotsauce.com/bravado-spice-co-ghost-pepper-blueberry-hot-sauce/
"Bravado Spice Co. Crimson Pack, 2/5oz., 1/2.7oz.",$30.00,$25.85,Bravado Spice Co,https://www.hotsauce.com/bravado-spice-co-crimson-pack/
"Bravado Spice Co. Hot Sauces 4 Pack, 4/5oz.",$36.00,$31.80,Bravado Spice Co,https://www.hotsauce.com/bravado-spice-co-hot-sauces-4-pack/
"Bravado Spice Co. Hot Sauces Complete Set, 5/5oz, 1/3oz, 1/2.7oz.",$67.50,$57.65,Bravado Spice Co,https://www.hotsauce.com/bravado-spice-co-hot-sauces-complete-set/
"Bravado Spice Co. Pineapple & Habanero Hot Sauce, 5oz.",$9.00,$7.95,Bravado Spice Co,https://www.hotsauce.com/bravado-spice-co-pineapple-habanero-hot-sauce/
"Bravado Spice Co. Seasoning Set, 1/3oz., 1/2.7oz.",$19.50,$15.90,Bravado Spice Co,https://www.hotsauce.com/bravado-spice-co-seasoning-set/
"Bravado Spice Co. Serrano and Basil Hot Sauce, 5oz.",$9.00,$8.49,Bravado Spice Co,https://www.hotsauce.com/bravado-spice-co-serrano-and-basil-hot-sauce/
"Brenda's Bootie Burner Hot Sauce, 5oz.",$6.50,$5.95,HotSauce,https://www.hotsauce.com/brendas-bootie-burner-hot-sauce/
"Buhba's Butt Blaster X-Hot Sauce, 5.7oz.",$8.50,$7.95,HotSauce,https://www.hotsauce.com/buhbas-butt-blaster-x-hot-sauce/
"Bull Snort Smokin' Toncils Hot Sauce, 5oz.",$6.50,$5.95,Bull Snort,https://www.hotsauce.com/bull-snort-smokin-toncils-hot-sauce/
"Bull Snort Texas Sweat Hot Sauce, 5oz.",$6.50,$5.95,Bull Snort,https://www.hotsauce.com/bull-snort-texas-sweat-hot-sauce/
"Bull Snort Texas Tongue Torch Three Pepper Hot Sauce, 5oz.",$6.50,$5.95,Bull Snort,https://www.hotsauce.com/bull-snort-texas-tongue-torch-three-pepper-hot-sauce/
"Bumblefoot's The Sauce, 5oz.",$7.50,$6.49,Bumblefoot's,https://www.hotsauce.com/Bumblefoots-The-Sauce/
"Burns & McCoy Gold 79 Premium Hot Sauce, 5oz.",$10.00,$7.95,Burns & McCoy,https://www.hotsauce.com/Burns-McCoy-Gold-79-Premium-Hot-Sauce/
"Busha Browne's Pukka Hot Sauce, 5oz.",$7.50,$6.95,Busha Brownes,https://www.hotsauce.com/busha-brownes-pukka-hot-sauce/
"Busha Browne's Spicy Jerk Sauce, 5oz.",$7.50,$6.95,Busha Brownes,https://www.hotsauce.com/busha-brownes-spicy-jerk-sauce/
"Butt Pucker XX Hot Sauce, 5.7oz.",$9.50,$8.95,Professor Payne,https://www.hotsauce.com/butt-pucker-xx-hot-sauce/
"Butt Twister Butt Blazin Fire Sauce, 5oz.",$7.50,$6.95,CaJohns,https://www.hotsauce.com/butt-twister-butt-blazin-fire-sauce/
"Buttplug Relief Extra Hot Sauce, 5oz.",$6.50,$5.95,Tahiti Joes,https://www.hotsauce.com/buttplug-relief-extra-hot-sauce/
"Caboom! Ballistic Hot Sauce with Bullet Keychain, 5oz.",$12.00,$10.49,CaJohns,https://www.hotsauce.com/Caboom-Ballistic-Hot-Sauce-With-Bullet-Keychain/
"Caboom! High Velocity Hot Sauce with Bullet Keychain, 5oz.",$10.50,$9.95,CaJohns,https://www.hotsauce.com/Caboom-High-Velocity-Hot-Sauce-With-Bullet-Keychain/
"Caboom! Tracer Hot Sauce with Bullet Keychain, 5oz.",$11.00,$10.49,CaJohns,https://www.hotsauce.com/Caboom-Tracer-Hot-Sauce-With-Bullet-Keychain/
"CaJohn's Black Bean and Corn Ghost Chile Gourmet Salsa, 16oz.",$8.50,$7.95,CaJohns,https://www.hotsauce.com/cajohns-black-bean-and-corn-ghost-chile-gourmet-salsa/
"CaJohn's Black Cherry Vanilla Hot Sauce, 5oz.",$10.00,$8.49,CaJohns,https://www.hotsauce.com/cajohns-black-cherry-vanilla-hot-sauce/
"CaJohn's Black Garlic Chipotle Hot Sauce, 5oz.",$10.00,$8.95,CaJohns,https://www.hotsauce.com/Cajohns-Black-Garlic-Chipotle-Hot-Sauce/
"CaJohn's Black Garlic Ghost Pepper Hot Sauce, 5oz.",$11.00,$9.95,CaJohns,https://www.hotsauce.com/Cajohns-Black-Garlic-Ghost-Pepper-Hot-Sauce/
"CaJohn's Black Garlic Hot Sauce, 5oz.",$10.00,$8.95,CaJohns,https://www.hotsauce.com/CaJohns-Black-Garlic-Hot-Sauce/
"CaJohn's Black Garlic Hot Sauces 3 Pack, 3/5oz.",$31.00,$27.85,CaJohns,https://www.hotsauce.com/Cajohns-Black-Garlic-Hot-Sauces-3-Pack/
"CaJohn's Bourbon Infused Hot Sauce, 5oz.",$9.00,$8.49,CaJohns,https://www.hotsauce.com/cajohns-bourbon-infused-hot-sauce/
"CaJohn's Bourbon Street Fiery BBQ Sauce, 16oz.",$9.00,$7.95,CaJohns,https://www.hotsauce.com/Cajohns-Bourbon-Street-Fiery-BBQ-Sauce/
"CaJohn's Classic Small Batch Habanero Pepper Sauce, 5oz.",$8.00,$7.49,CaJohns,https://www.hotsauce.com/cajohns-classic-small-batch-habanero-pepper-sauce/
"CaJohn's Elixir of Purira Chiles, 5oz.",$8.50,$7.95,CaJohns,https://www.hotsauce.com/cajohns-elixir-of-purira-chiles/
"CaJohn's Fiery BBQ Sauce, 16oz.",$9.00,$7.95,CaJohns,https://www.hotsauce.com/Cajohns-Fiery-Bbq-Sauce/
"CaJohn's FireHouse Hot Sauce, 5oz.",$7.50,$6.95,CaJohns,https://www.hotsauce.com/cajohns-firehouse-hot-sauce/
"CaJohn's Hot Picante Sauce Gourmet Salsa, 16oz.",$8.50,$7.95,CaJohns,https://www.hotsauce.com/cajohns-hot-picante-sauce-gourmet-salsa/
"CaJohn's NOLA Hot Sauce, 5oz.",$8.00,$7.49,CaJohns,https://www.hotsauce.com/Cajohns-Nola-Hot-Sauce/
"CaJohn's Oaxacan Habanero Hot Sauce, 5oz.",$8.50,$7.49,CaJohns,https://www.hotsauce.com/cajohns-oaxacan-habanero-hot-sauce/
"CaJohn's Quetzalcoatl Ghost Chile Hot Sauce, 5oz.",$9.50,$8.49,CaJohns,https://www.hotsauce.com/Cajohns-Quetzalcoatl-Ghost-Chile-Hot-Sauce/
"CaJohn's Salsa Verde Habanero Gourmet Salsa, 16oz.",$8.50,$7.95,CaJohns,https://www.hotsauce.com/cajohns-salsa-verde-habanero-gourmet-salsa/
"CaJohn's Small Batch Ghost Garlic Pepper Sauce, 5oz.",$8.50,$7.95,CaJohns,https://www.hotsauce.com/cajohns-small-batch-ghost-garlic-pepper-sauce/
"CaJohn's Small Batch Habanero Garlic Pepper Sauce, 5oz.",$8.00,$7.49,CaJohns,https://www.hotsauce.com/cajohns-small-batch-habanero-garlic-pepper-sauce/
"CaJohn's Small Batch Trinidad Scorpion Garlic Pepper Sauce, 5oz.",$8.50,$7.95,CaJohns,https://www.hotsauce.com/cajohns-small-batch-trinidad-scorpion-garlic-pepper-sauce/
"CaJohn's The Reaper BBQ Sauce, 16oz.",$10.50,$9.95,CaJohns,https://www.hotsauce.com/cajohns-the-reaper-bbq-sauce/
"CaJohn's XHot Picante Sauce Gourmet Salsa, 16oz.",$9.00,$7.95,CaJohns,https://www.hotsauce.com/cajohns-xhot-picante-sauce-gourmet-salsa/
"Cheap Thrill Garlic Habanero Hot Sauce, 5oz.",$3.50,$2.95,Cheap Thrill,https://www.hotsauce.com/cheap-thrill-garlic-habanero-hot-sauce/
"Cheech 3 Pack Hot Sauce Gift Set, 3/5oz.",$19.00,$16.95,Cheech Sauces,https://www.hotsauce.com/cheech-3-pack-hot-sauce-gift-set/
"Chef Fartenburn's Gourmet Hot Sauce, 5oz.",$5.50,$4.95,HotSauce,https://www.hotsauce.com/chef-fartenburns-gourmet-hot-sauce/
"Chile Dawg Hot Pepper Sauce, 5oz.",$5.50,$4.95,FireWorks,https://www.hotsauce.com/chile-dawg-hot-pepper-sauce/
"Chilehead's Garlic Habanero Hot Sauce, 5oz.",$6.50,$5.95,Hot Sauce Fanatics,https://www.hotsauce.com/chileheads-garlic-habanero-hot-sauce/
"Chilehead's Habanero Hot Sauce, 5oz.",$6.50,$5.95,Hot Sauce Fanatics,https://www.hotsauce.com/chileheads-habanero-hot-sauce/
"Chopper Chile Habanero Hot Sauce, 5oz.",$6.50,$5.95,HotSauce,https://www.hotsauce.com/chopper-chile-habanero-hot-sauce/
"Collegiate Hot Sauce - Iowa Hawkeyes, 5oz.",$7.50,$6.95,NCAA,https://www.hotsauce.com/Collegiate-Hot-Sauce-Iowa-Hawkeyes/
"Collegiate Hot Sauce - Kansas Jayhawks, 5oz.",$7.50,$6.95,NCAA,https://www.hotsauce.com/collegiate-hot-sauce-kansas-jayhawks/
"Collegiate Hot Sauce - Mississippi State Bulldogs, 5oz.",$7.50,$6.95,NCAA,https://www.hotsauce.com/Collegiate-Hot-Sauce-Mississippi-State-Bulldogs/
"Collegiate Hot Sauce - Purdue Boilermakers, 5oz.",$7.50,$6.95,NCAA,https://www.hotsauce.com/Collegiate-Hot-Sauce-Purdue-Boilermakers/
"Colon Cleaner (Professor Phardtpounders), 5.7oz.",$9.50,$8.95,HotSauce,https://www.hotsauce.com/Colon-Cleaner-Professor-Phardtpounders/
"Crapper Jon's Ultra Hot Sauce, 5oz.",$7.50,$6.95,HotSauce,https://www.hotsauce.com/crapper-jons-ultra-hot-sauce/
"Crazy Jerry's Brain Damage Mind Blowin Hot Sauce, 5oz.",$9.00,$7.95,Crazy Jerrys,https://www.hotsauce.com/crazy-jerrys-brain-damage-mind-blowin-hot-sauce/
"Crazy Jerry's Lizard Eyes Habanero Stuffed Olives, 5oz.",$8.50,$7.95,Crazy Jerrys,https://www.hotsauce.com/crazy-jerrys-lizard-eyes-habanero-stuffed-olives/
"Crazy Jerry's Mustard Gas Hot Sauce, 4oz.",$10.00,$8.95,Crazy Jerrys,https://www.hotsauce.com/crazy-jerrys-mustard-gas-hot-sauce/
"Cutino Habanero Hot Sauce, 4oz.",$12.00,$10.95,Cutino,https://www.hotsauce.com/Cutino-Habanero-Hot-Sauce/
"Cutino Hot Sauce Complete Gift Set, 5/4oz.",$72.00,$54.75,Cutino,https://www.hotsauce.com/Cutino-Hot-Sauce-Complete-Gift-Set/
"Cutino Jalapeno Hot Sauce, 4oz.",$12.00,$10.95,Cutino,https://www.hotsauce.com/Cutino-Jalapeno-Hot-Sauce/
"Cutino Miso Hot Sauce, 4oz.",$12.00,$10.95,Cutino,https://www.hotsauce.com/Cutino-Miso-Hot-Sauce/
"Cutino Verde Hot Sauce, 4oz.",$12.00,$10.95,Cutino,https://www.hotsauce.com/Cutino-Verde-Hot-Sauce/
"Da Bomb Beyond Insanity Hot Sauce, 4oz.",$17.00,$14.95,Da Bomb,https://www.hotsauce.com/da-bomb-beyond-insanity-hot-sauce/
"Da Bomb Green Habanero Salsa Verde, 15.5oz.",$8.50,$7.95,Da Bomb,https://www.hotsauce.com/da-bomb-green-habanero-salsa-verde/
"Danny Cash's Cajun Cayenne Salvation Sauce (w/mini bible), 5oz.",$8.50,$7.95,Danny Cash,https://www.hotsauce.com/danny-cashs-cajun-cayenne-salvation-hot-sauce-mini-bible/
"Danny Cash's Dirt Rider Garlic Ghost Chile Hot Sauce, 5oz.",$9.50,$8.95,Danny Cash,https://www.hotsauce.com/Danny-Cashs-Dirt-Rider-Garlic-Ghost-Chile-Hot-Sauce/
"Danny Cash's Garlic Serrano Salvation Sauce (w/mini bible), 5oz.",$8.50,$7.95,Danny Cash,https://www.hotsauce.com/danny-cashs-garlic-serrano-salvation-hot-sauce-mini-bible/
"Danny Cash's Red Habanero Salvation Sauce (w/mini bible), 5oz.",$8.50,$7.95,Danny Cash,https://www.hotsauce.com/danny-cashs-red-habanero-salvation-sauce-mini-bible/
"Danny Cash's Salvation Caribbean Lime Hot Sauce, 5oz.",$8.50,$7.95,Danny Cash,https://www.hotsauce.com/danny-cashs-salvation-caribbean-lime-hot-sauce/
"Danny Cash's Salvation Chipotle Hot Sauce, 5oz.",$8.50,$7.95,Danny Cash,https://www.hotsauce.com/danny-cashs-salvation-chipotle-hot-sauce/
"Danny Cash's Salvation Mango Pineapple Hot Sauce, 5oz.",$8.50,$7.95,Danny Cash,https://www.hotsauce.com/danny-cashs-salvation-mango-pineapple-hot-sauce/
"Dave's (Chile Today) Chipotle Powder Medium, 1oz.",$8.50,$6.95,Daves Gourmet,https://www.hotsauce.com/daves-chile-today-chipotle-powder-medium/
"Dave's Gourmet Crazy Caribbean Hot Sauce, 5oz.",$7.00,$5.95,Daves Gourmet,https://www.hotsauce.com/daves-gourmet-crazy-caribbean-hot-sauce/
"Dave's Gourmet Hurtin' Habanero, 5oz.",$7.50,$6.95,Daves Gourmet,https://www.hotsauce.com/daves-gourmet-hurtin-habanero/
"Dave's Gourmet Insanity Spicy 6 Pack, 6/5oz.",$45.00,$35.29,Daves Gourmet,https://www.hotsauce.com/daves-gourmet-insanity-spicy-6-pack/
"Dave's Gourmet Roasted Garlic, 5oz.",$7.50,$6.95,Daves Gourmet,https://www.hotsauce.com/daves-gourmet-roasted-garlic/
"Dave's Gourmet Roasted Red Pepper & Chipotle, 5oz.",$7.00,$5.95,Daves Gourmet,https://www.hotsauce.com/daves-gourmet-roasted-red-pepper-chipotle/
"Dave's Gourmet Scotch Bonnet Hot Sauce, 5oz.",$7.50,$6.95,Daves Gourmet,https://www.hotsauce.com/daves-gourmet-scotch-bonnet-hot-sauce/
"Dave's Gourmet Temporary Insanity, 5oz.",$8.50,$7.95,Daves Gourmet,https://www.hotsauce.com/daves-gourmet-temporary-insanity/
"Day Of The Dead w/ Skeleton Keychain, 5oz.",$8.50,$7.95,Captain Thoms,https://www.hotsauce.com/day-of-the-dead-skeleton-keychain/
"Daytona Bike Week Hot Sauce, 5oz.",$5.50,$4.95,HotSauce,https://www.hotsauce.com/daytona-bike-week-hot-sauce-2014/
"Deathwish Habanero Hot Sauce, 5oz.",$7.00,$6.49,Deathwish Sauces,https://www.hotsauce.com/deathwish-habanero-hot-sauce/
"Delicious Suffering Hot Sauce, 5oz.",$7.00,$6.49,HotSauce,https://www.hotsauce.com/delicious-suffering-hot-sauce/
"Devil's Biker Sauce Bitch Hot Sauces Gift Set, 3/5oz.",$19.00,$17.39,HotSauce,https://www.hotsauce.com/Devils-Biker-Sauce-Bitch-Hot-Sauces-Gift-Set/
"Devil's Bitch XXX Rated Hot Sauce, 5oz.",$5.50,$4.95,HotSauce,https://www.hotsauce.com/devils-bitch-xxx-rated-hot-sauce/
"Dirty Dick's Hot Pepper Sauce With a Tropical Twist, 5oz.",$8.50,$7.49,Dirty Dicks,https://www.hotsauce.com/dirty-dicks-hot-pepper-sauce-with-tropical-twist/
"Dr. Assburn's Fire Roasted Habanero Pepper Sauce, 5.7oz.",$9.50,$8.95,HotSauce,https://www.hotsauce.com/dr-assburns-fire-roasted-habanero-pepper-sauce/
"El Yucateco Black Label Reserve Chile Habanero 3 Pack, 3/4oz.",$16.50,$14.85,El Yucateco,https://www.hotsauce.com/el-yucateco-black-label-reserve-chile-habanero-3-pack/
"El Yucateco Black Label Reserve Chile Habanero, 4oz.",$5.50,$4.95,El Yucateco,https://www.hotsauce.com/El-Yucateco-Black-Label-Reserve-Chile-Habanero/
"El Yucateco Complete Gift Set, 4/4oz., 2/5oz.",$27.00,$25.70,El Yucateco,https://www.hotsauce.com/el-yucateco-complete-gift-set-4-4oz-2-5oz/
"El Yucateco Complete Gift Set, 5/4oz.,2/5oz.",$32.00,$30.65,El Yucateco,https://www.hotsauce.com/el-yucateco-complete-gift-set/
"El Yucateco Green Chile Habanero 4 Pack, 4/4oz.",$20.00,$15.80,El Yucateco,https://www.hotsauce.com/el-yucateco-green-chile-habanero-4-pack/
"El Yucateco Salsa Picante de Chile Habanero Green, 4oz.",$5.00,$3.95,El Yucateco,https://www.hotsauce.com/el-yucateco-salsa-picante-de-chile-habanero-green/
"El Yucateco Salsa Picante de Chile Habanero Green, 8oz.",$6.50,$5.95,El Yucateco,https://www.hotsauce.com/el-yucateco-salsa-picante-de-chile-habanero-green-8oz/
"Fanny Fart Hot Sauce, 5oz.",$6.50,$5.95,CaJohns,https://www.hotsauce.com/Fanny-Fart-Hot-Sauce/
"Fat Cat Bacon Flavored Sriracha Sauce, 12oz.",$8.50,$7.95,Fat Cat,https://www.hotsauce.com/fat-cat-bacon-flavored-sriracha-sauce/
"Fat Cat Caribbean Curry Hot Sauce, 5oz.",$6.50,$5.95,Fat Cat,https://www.hotsauce.com/fat-cat-caribbean-curry-hot-sauce/
"Fat Cat Cat in Heat Hot Sauce, 5oz.",$6.50,$5.95,Fat Cat,https://www.hotsauce.com/fat-cat-cat-in-heat-hot-sauce/
"Fat Cat Mexican-Style Habanero Hot Sauce, 5oz.",$6.50,$5.95,Fat Cat,https://www.hotsauce.com/fat-cat-mexican-style-habanero-hot-sauce/
"Fat Cat Siamese Sriracha Sauce, 12oz.",$8.50,$7.95,Fat Cat,https://www.hotsauce.com/fat-cat-siamese-sriracha-sauce/
"Fat Cat Strawberry Serrano Hot Sauce, 5oz.",$6.50,$5.95,Fat Cat,https://www.hotsauce.com/fat-cat-strawberry-serrano-hot-sauce/
"Fiery Fart XXX Rated Hot Sauce, 5oz.",$5.50,$4.95,HotSauce,https://www.hotsauce.com/fiery-fart-xxx-rated-hot-sauce/
"Final Fear Hot Sauce, 5oz.",$6.50,$5.95,FireWorks,https://www.hotsauce.com/final-fear-hot-sauce/
"Fire and Spice All Natural Hot Sauce, 7oz.",$8.50,$7.95,Original Juan,https://www.hotsauce.com/fire-and-spice-all-natural-hot-sauce/
