Name,Price,Price witout Tax,Brand,Link
"Alice Cooper Poison Reaper Hot Sauce, 5oz.",$13.00,$12.00,Alice Cooper,https://www.hotsauce.com/Alice-Cooper-Poison-Reaper-Hot-Sauce/
"Anchor Bar Suicidal Buffalo Wing Sauce, 13.6oz.",$6.50,$5.95,Anchor Bar,https://www.hotsauce.com/Anchor-Bar-Suicidal-Buffalo-Wing-Sauce/
"Angry Cock Hot Sauce, 5oz.",$15.00,$12.95,CaJohns,https://www.hotsauce.com/Angry-Cock-Hot-Sauce/
"Angry Goat Pepper Co. Demon Reaper Hot Sauce, 5oz.",$9.50,$8.95,Angry Goat,https://www.hotsauce.com/Angry-Goat-Pepper-Co-Demon-Reaper-Hot-Sauce/
"Angry Goat Pepper Co. Hot Cock Hot Sauce, 5oz.",$9.50,$8.95,Angry Goat,https://www.hotsauce.com/Angry-Goat-Pepper-Co-Hot-Cock-Hot-Sauce/
"Arizona Gunslinger Mega Diablo Extra Hot Pepper Sauce, 5oz.",$7.50,$6.95,Arizona Gunslinger,https://www.hotsauce.com/Arizona-Gunslinger-Mega-Diablo-Extra-Hot-Pepper-Sauce/
"Ass Blaster Collector's Hot Sauce w/ Wooden Outhouse, 5oz.",$17.50,$14.95,Ass Kickin,https://www.hotsauce.com/ass-blaster-collectors-hot-sauce-wooden-outhouse/
"Ass Blaster Hot Sauce, 5oz.",$10.00,$8.95,Ass Kickin,https://www.hotsauce.com/ass-blaster-hot-sauce/
"Ass In Antarctica Hot Sauce, 5oz.",$7.50,$6.95,Ass In The Tub,https://www.hotsauce.com/ass-in-antarctica-hot-sauce/
"Ass In Space Hot Sauce, 5oz.",$6.50,$5.95,Ass In The Tub,https://www.hotsauce.com/Ass-In-Space-Hot-Sauce/
"Ass In The Tub Ghost Pepper Sauce, 5oz.",$9.50,$8.95,Ass In The Tub,https://www.hotsauce.com/ass-in-the-tub-ghost-pepper-sauce/
"Ass In The Tub Hot Sauces Complete Gift Set, 7/5oz.",$60.50,$55.65,Ass In The Tub,https://www.hotsauce.com/ass-in-the-tub-hot-sauces-complete-gift-set/
"Ass In The Tub Hot Sauces Original Gift Set, 5/5oz.",$41.00,$37.75,Ass In The Tub,https://www.hotsauce.com/ass-in-the-tub-hot-sauces-5-pack-gift-set/
"Ass in the Tub Special Reserve Armageddon Hot Sauce, 5oz.",$11.00,$9.95,Ass In The Tub,https://www.hotsauce.com/ass-in-the-tub-special-reserve-armageddon-hot-sauce/
"Ass Kickin Ghost Pepper Hot Sauce, 5oz.",$12.50,$9.95,Ass Kickin,https://www.hotsauce.com/ass-kickin-ghost-pepper-hot-sauce/
"Ass Kickin Hot Salt 9 Pack, 9/1.1oz.",$31.50,$26.95,Ass Kickin,https://www.hotsauce.com/ass-kickin-hot-salt-9-pack/
"Ass Reaper Hot Sauce with Skull Cap and Cape, 5oz.",$11.00,$9.95,HotSauce,https://www.hotsauce.com/ass-reaper-hot-sauce-skull-cap-cape/
"Best of Naga Jolokia (Ghost) Gift Set, 4/5oz.",$38.50,$34.80,HotSauce,https://www.hotsauce.com/best-of-naga-jolokia-ghost-gift-set/
"Best of Red Savina Hot Sauces Gift Set, 3/5oz.",$25.50,$21.85,HotSauce,https://www.hotsauce.com/Best-Of-Red-Savina-Hot-Sauces-Gift-Set/
"Black Mamba Extreme Venomous Hot Sauce, 2oz.",$16.00,$12.95,CaJohns,https://www.hotsauce.com/black-mamba-extreme-venomous-hot-sauce/
"Blair's Beyond Death Hot Sauce, 5oz.",$18.00,$15.95,Blairs Sauces,https://www.hotsauce.com/blairs-beyond-death-hot-sauce/
"Blair's Sudden Death Sauce with Ginseng, 5oz.",$22.00,$18.95,Blairs Sauces,https://www.hotsauce.com/blairs-sudden-death-sauce-with-ginseng/
"Bravado Spice Co. Aka Miso Ghost Reaper Hot Sauce, 5oz.",$14.00,$11.95,Bravado Spice Co,https://www.hotsauce.com/Bravado-Spice-Co-Aka-Miso-Ghost-Reaper-Hot-Sauce/
"Bravado Spice Co. Ancho Masala Scorpion Reaper Hot Sauce, 5oz.",$14.00,$12.49,Bravado Spice Co,https://www.hotsauce.com/Bravado-Cpice-Co-Ancho-Masala-Scorpion-Reaper-Hot-Sauce/
"Bravado Spice Co. Black Garlic Carolina Reaper Hot Sauce, 5oz.",$14.00,$12.49,Bravado Spice Co,https://www.hotsauce.com/Bravado-Spice-Co-Black-Garlic-Carolina-Reaper-Hot-Sauce/
"Bravado Spice Co. Crimson Reserve Hot Sauce, 5oz.",$14.00,$12.00,Bravado Spice Co,https://www.hotsauce.com/bravado-spice-co-crimson-reserve-hot-sauce/
"Bravado Spice Co. Garlic and Arbol Moruga Scorpion Hot Sauce, 5oz.",$10.50,$9.95,Bravado Spice Co,https://www.hotsauce.com/Bravado-Spice-Co-Garlic-Arbol-Moruga-Scorpion-Hot-Sauce/
"Bumblefoot's Bumblef**ked Hot Sauce, 5oz.",$7.50,$12.49,Bumblefoot's,https://www.hotsauce.com/Bumblefoots-Bumblef-ked-Hot-Sauce/
"Bumblefoot's Bumblicious! Hot Sauce, 5oz.",$13.50,$9.95,Bumblefoot's,https://www.hotsauce.com/Bumblefoots-Bumblicious-Hot-Sauce/
Name,Price,Price witout Tax,Brand,Link
"Burns & McCoy Excubiarium Salsa Verde Hot Sauce, 5oz.",$13.50,$11.95,Burns & McCoy,https://www.hotsauce.com/Burns-McCoy-Excubiarium-Salsa-Verde-Hot-Sauce/
"Burns & McCoy Exhorresco 7 Pot Primo Hot Sauce, 5oz.",$14.00,$12.95,Burns & McCoy,https://www.hotsauce.com/Burns-McCoy-Exhorresco-7-Pot-Primo-Hot-Sauce/
"Burns & McCoy Exitium Pineapple Ginger Hot Sauce, 5oz.",$14.00,$12.95,Burns & McCoy,https://www.hotsauce.com/Burns-McCoy-Exitium-Pineapple-Ginger-Hot-Sauce/
"CaBoom! Gourmet Hot Sauce, 5oz.",$7.50,$6.95,CaJohns,https://www.hotsauce.com/caboom-gourmet-hot-sauce/
"CaJohn's Calavera Hot Sauce, 5oz.",$15.00,$12.95,CaJohns,https://www.hotsauce.com/calavera-hot-sauce/
"CaJohn's Cerberus Hot Sauce, 5oz.",$15.00,$13.95,CaJohns,https://www.hotsauce.com/Cajohns-Cerberus-Hot-Sauce/
"CaJohn's Chipotle Hot Sauce, 5oz.",$8.50,$7.95,CaJohns,https://www.hotsauce.com/Cajohns-Chipotle-Hot-Sauce/
"CaJohn's Classic Small Batch Carolina Reaper Pepper Sauce, 5oz.",$8.50,$7.95,CaJohns,https://www.hotsauce.com/cajohns-classic-small-batch-carolina-reaper-pepper-sauce/
"CaJohn's Classic Small Batch Ghost Chile Pepper Sauce, 5oz.",$8.50,$7.95,CaJohns,https://www.hotsauce.com/cajohns-classic-small-batch-ghost-chile-pepper-sauce/
"CaJohn's Classic Small Batch Trinidad Scorpion Pepper Sauce, 5oz.",$8.50,$7.95,CaJohns,https://www.hotsauce.com/cajohns-classic-small-batch-trinidad-scorpion-pepper-sauce/
"CaJohn's El Chupacabra Hot Sauce, 5oz.",$14.50,$12.95,CaJohns,https://www.hotsauce.com/cajohns-el-chupacabra-hot-sauce/
"CaJohn's Jolokia 10 Puree, 2oz.",$9.00,$8.49,CaJohns,https://www.hotsauce.com/cajohns-jolokia-10-puree/
"CaJohn's Killer Chipotle, 5oz.",$8.50,$7.95,CaJohns,https://www.hotsauce.com/cajohns-killer-chipotle/
"CaJohn's La Parca Reaper Hot Sauce, 5oz.",$10.50,$9.95,CaJohns,https://www.hotsauce.com/cajohns-la-parca-reaper-hot-sauce/
"CaJohn's La Segadora Reaper Hot Sauce, 5oz.",$11.50,$9.95,CaJohns,https://www.hotsauce.com/cajohns-la-segadora-reaper-hot-sauce/
"CaJohn's Lethal Ingestion Bhut Jolokia Hot Sauce, 2oz.",$19.50,$16.95,CaJohns,https://www.hotsauce.com/cajohns-lethal-ingestion-bhut-jolokia-hot-sauce/
"CaJohn's Lethal, Mamba & Mongoose Gift Set, 2/2oz, 1/5oz.",$49.50,$42.85,CaJohns,https://www.hotsauce.com/cajohns-lethal-mamba-mongoose-gift-set/
"CaJohn's Memento Mori Hot Sauce, 5oz.",$15.00,$12.95,CaJohns,https://www.hotsauce.com/Cajohns-Memento-Mori-Hot-Sauce/
"CaJohn's Reaper Gift Set, 1/2oz, 1/5oz, 1/16oz.",$40.00,$35.40,CaJohns,https://www.hotsauce.com/cajohns-reaper-gift-set/
"CaJohn's Reaper Super Hot Salsa, 16oz.",$11.00,$9.50,CaJohns,https://www.hotsauce.com/cajohns-reaper-super-hot-salsa/
"CaJohn's Scorpion Pepper Gift Set, 1/2oz, 1/5oz, 2/16oz.",$46.00,$42.34,CaJohns,https://www.hotsauce.com/cajohns-scorpion-pepper-gift-set/
"CaJohn's Trinidad Scorpion BBQ Sauce, 16oz.",$10.50,$9.49,CaJohns,https://www.hotsauce.com/cajohns-trinidad-scorpion-bbq-sauce/
"CaJohn's Trinidad Scorpion Salsa, 16oz.",$11.00,$9.95,CaJohns,https://www.hotsauce.com/cajohns-trinidad-scorpion-salsa/
"Challenge Chocolate Habanero Pepper Chili Plant - 500,000 SHU",$6.50,$5.95,Magic Plant Farms,https://www.hotsauce.com/challenge-chocolate-habanero-pepper-chili-plant/
"Challenge Peruvian White Habanero Pepper Plant - 350,000 SHU",$6.50,$5.95,Magic Plant Farms,https://www.hotsauce.com/challenge-peruvian-white-habanero-pepper-plant/
"Challenge Red Scotch Bonnet Pepper Plant - 350,000 SHU",$6.50,$5.95,Magic Plant Farms,https://www.hotsauce.com/challenge-red-scotch-bonnet-pepper-plant/
"Challenge Yellow Fatalii Pepper Plant - 300,000 SHU",$6.50,$5.95,Magic Plant Farms,https://www.hotsauce.com/challenge-yellow-fatalii-pepper-plant/
"Colon Blow Red Habanero Enima, 5oz.",$8.50,$7.95,HotSauce,https://www.hotsauce.com/colon-blow-red-habanero-enima/
"Da Bomb Ghost Pepper Hot Sauce, 4oz.",$19.50,$14.95,Da Bomb,https://www.hotsauce.com/da-bomb-ghost-pepper-hot-sauce/
Name,Price,Price witout Tax,Brand,Link
"Da Bomb Ground Zero Hot Sauce, 4oz.",$21.50,$17.95,Da Bomb,https://www.hotsauce.com/da-bomb-ground-zero-hot-sauce/
"Da Bomb Jolokia Ghost Snacks Gift Set, 8oz, 4oz, 15.5oz.",$39.00,$32.85,Da Bomb,https://www.hotsauce.com/da-bomb-jolokia-ghost-snacks-gift-set/
"Da Bomb Scorpion Garlic Salsa, 15.5oz.",$10.00,$8.49,Da Bomb,https://www.hotsauce.com/da-bomb-scorpion-garlic-salsa/
"Danny Cash's Ghost Rider Hot Sauce, 5oz.",$10.50,$9.49,Danny Cash,https://www.hotsauce.com/danny-cashs-ghost-rider-hot-sauce/
"Danny Cash's Salvation Sauce Holy Ghost! (w/mini bible), 5oz.",$11.00,$9.95,Danny Cash,https://www.hotsauce.com/danny-cashs-salvation-sauce-holy-ghost-mini-bible/
"Dave's Four Pack Super Hot in Wooden Crate, 4/5oz.",$46.00,$41.95,Daves Gourmet,https://www.hotsauce.com/daves-four-pack-super-hot-in-wooden-crate/
"Dave's Gourmet Insanity Hot Sauce, 5oz.",$9.00,$8.49,Daves Gourmet,https://www.hotsauce.com/daves-gourmet-insanity-hot-sauce/
"Dave's Gourmet Insanity Sauce Hot Sauce Gallon, 128oz.",$140.00,$125.95,Daves Gourmet,https://www.hotsauce.com/daves-gourmet-insanity-sauce-hot-sauce-gallon/
"Dave's Gourmet Insanity Spicy Three Pack, 3/5oz.",$22.50,$19.85,Daves Gourmet,https://www.hotsauce.com/daves-gourmet-insanity-spicy-three-pack/
"Dave's Gourmet Total Insanity, 5oz.",$9.00,$8.49,Daves Gourmet,https://www.hotsauce.com/daves-gourmet-total-insanity/
"Dave's Ultimate Insanity Sauce Gallon, 128oz.",$170.00,$139.95,Daves Gourmet,https://www.hotsauce.com/daves-ultimate-insanity-sauce-gallon/
"Don't Fuck With Me I'm Hot XXX Extract Hot Sauce, 5oz.",$8.50,$7.95,Hot Sauce Fanatics,https://www.hotsauce.com/dont-fuck-with-me-im-hot-xxx-extract-hot-sauce/
"El Yucateco XXXtra Hot Chile Habanero, 4oz.",$5.00,$3.95,El Yucateco,https://www.hotsauce.com/el-yucateco-xxxtra-hot-chile-habanero/
"Elijah's Extreme Complete Gift Set, 3/5oz, 1/8oz.",$39.50,$36.80,ELijahs Xtreme,https://www.hotsauce.com/elijahs-extreme-complete-gift-set/
"ELijah's Xtreme Ghost Pepper Sauce, 5oz.",$8.50,$7.95,ELijahs Xtreme,https://www.hotsauce.com/elijahs-xtreme-ghost-pepper-sauce/
"ELijah's Xtreme Reaper Sauce, 5oz.",$11.00,$9.95,ELijahs Xtreme,https://www.hotsauce.com/elijahs-xtreme-reaper-sauce/
"Elijah's Xtreme Regret Scorpion Reaper Hot Sauce, 5oz.",$11.00,$9.95,ELijahs Xtreme,https://www.hotsauce.com/Elijahs-Xtreme-Regret-Scorpion-Reaper-Hot-Sauce/
"Endorphin Rush Beyond Hot Sauce, 5oz.",$7.00,$6.49,HotSauce,https://www.hotsauce.com/endorphin-rush-beyond-hot-sauce/
"Fat Cat Chairman Meow's Revenge Hot Sauce, 5oz.",$7.00,$5.95,Fat Cat,https://www.hotsauce.com/fat-cat-chairman-meows-revenge-hot-sauce/
"Fatalii Fire Hot Sauce, 5oz.",$8.50,$7.95,CaJohns,https://www.hotsauce.com/fatalii-fire-hot-sauce/
"Fear Hot Sauce w/ Bhut Jolokia Pepper, 5oz.",$11.00,$9.95,HotSauce,https://www.hotsauce.com/fear-hot-sauce-bhut-jolokia-pepper/
"Frostbite and Magma Hot Sauces Gift Set, 2/5oz.",$20.00,$18.90,CaJohns,https://www.hotsauce.com/frostbite-and-magma-hot-sauces-gift-set/
"Fuckin' Hot Sauces Gift Box, 4/5oz.",$31.50,$27.95,HotSauce,https://www.hotsauce.com/fuckin-hot-sauces-gift-box/
"Ghost Dust Pure Ground Naga Jolokia Powder, 1oz",$24.50,$19.95,HotSauce,https://www.hotsauce.com/ghost-dust-pure-ground-naga-jolokia-powder/
"Green Ghost Hot Sauce, 5oz.",$9.50,$8.49,HotSauce,https://www.hotsauce.com/green-ghost-hot-sauce/
"Habanero Punch T.K.O. Hot Sauce, 5oz.",$8.50,$7.95,HotSauce,https://www.hotsauce.com/habanero-punch-t-k-o-hot-sauce/
"Happy Beaver Hot Sauce, 5oz.",$12.00,$9.95,CaJohns,https://www.hotsauce.com/happy-beaver-hot-sauce/
"Heartbreaking Dawns 1498 Apricot & Scorpion Hot Sauce, 5oz.",$8.00,$7.49,Heartbreaking Dawns,https://www.hotsauce.com/heartbreaking-dawns-1498-apricot-scorpion-hot-sauce/
"Heartbreaking Dawns 1498 Cauterizer Trinidad Scorpion Hot Sauce, 5oz.",$11.00,$9.95,Heartbreaking Dawns,https://www.hotsauce.com/heartbreaking-dawns-1498-cauterizer-trinidad-scorpion/
Name,Price,Price witout Tax,Brand,Link
"Heartbreaking Dawns 1841 Ghost Pepper Hot Sauce, 5oz.",$8.00,$7.49,Heartbreaking Dawns,https://www.hotsauce.com/Heartbreaking-Dawns-1841-Ghost-Pepper-Sauce/
"Heartbreaking Dawns Hottest 3 Pack, 3/5oz.",$33.00,$29.85,Heartbreaking Dawns,https://www.hotsauce.com/Heartbreaking-Dawns-Hottest-3-Pack/
"Heartbreaking Dawns REAPERCUSSION 7 Pod Primo Hot Sauce, 5oz.",$10.50,$9.95,Heartbreaking Dawns,https://www.hotsauce.com/heartbreaking-dawns-reapercussion/
"Hellfire ChiliMasters and The Elixir Gift Set, 2/6.8oz.",$24.00,$18.90,Hellfire Hot Sauce,https://www.hotsauce.com/hellfire-chilimasters-and-the-elixir-gift-set/
"Hellfire Chilimasters Reserve Hot Sauce, 6.8oz.",$10.00,$8.95,Hellfire Hot Sauce,https://www.hotsauce.com/hellfire-chilimasters-reserve-hot-sauce/
"Hellfire Devil's Gold Hot Sauce, 5oz.",$11.00,$9.95,Hellfire Hot Sauce,https://www.hotsauce.com/hellfire-devils-gold-hot-sauce/
"Hellfire Evil Bastard Hot Sauce, 5oz.",$14.00,$11.95,Hellfire Hot Sauce,https://www.hotsauce.com/hellfire-evil-bastard-hot-sauce/
"Hellfire Extreme Complete Hot Sauces Gift Set, 12/5oz",$154.50,$138.48,Hellfire Hot Sauce,https://www.hotsauce.com/hellfire-extreme-complete-hot-sauces-gift-set/
"Hellfire Fear This! Reaper Hot Sauce, 5oz.",$16.00,$14.95,Hellfire Hot Sauce,https://www.hotsauce.com/hellfire-fear-this-reaper-hot-sauce/
"Hellfire Fiery Fool Hot Sauce, 5oz.",$16.00,$13.95,Hellfire Hot Sauce,https://www.hotsauce.com/hellfire-fiery-fool-hot-sauce/
"Hellfire Firearrhea Hot Sauce, 5oz.",$17.00,$14.95,Hellfire Hot Sauce,https://www.hotsauce.com/Hellfire-Firearrhea-Hot-Sauce/
"Hellfire Golden Queens Hot Sauces Set, 2/5oz.",$22.00,$19.90,Hellfire Hot Sauce,https://www.hotsauce.com/Hellfire-Golden-Queens-Hot-Sauces-Set/
"Hellfire Hellboy Annung un Rama Hot Sauce, 5oz.",$13.00,$11.95,Hellfire Hot Sauce,https://www.hotsauce.com/Hellfire-Hellboy-Annung-Un-Rama-Hot-Sauce/
"Hellfire Hellboy Extreme Hot Sauce, 5oz.",$18.00,$16.95,Hellfire Hot Sauce,https://www.hotsauce.com/Hellfire-Hellboy-Extreme-Hot-Sauce/
"Hellfire HellBoy Hot Sauces Gift Set, 4/5oz.",$67.00,$61.80,Hellfire Hot Sauce,https://www.hotsauce.com/Hellfire-HellBoy-Hot-Sauces-Gift-Set/
"Hellfire Hellboy Legendary AF Hot Sauce, 5oz.",$17.00,$15.95,Hellfire Hot Sauce,https://www.hotsauce.com/Hellfire-Hellboy-Legendary-AF-Hot-Sauce/
"Hellfire Hot Sauces Sauceress's Private Reserve, 5oz.",$11.00,$9.95,Hellfire Hot Sauce,https://www.hotsauce.com/hellfire-hot-sauces-sauceresss-private-reserve/
"Hellfire Hottest Hot Sauces Gift Set, 4/5oz.",$53.50,$50.80,Hellfire Hot Sauce,https://www.hotsauce.com/hellfire-hottest-hot-sauces-gift-set/
"Hellfire Milder Hot Sauces Gift Set, 4/5oz.",$40.00,$37.80,Hellfire Hot Sauce,https://www.hotsauce.com/hellfire-milder-hot-sauces-gift-set/
"Hellfire Pure Hell Hot Sauce, 5oz.",$11.00,$9.95,Hellfire Hot Sauce,https://www.hotsauce.com/hellfire-pure-hell-hot-sauce/
"Hellfire Ritual Hot Sauce, 5oz.",$12.00,$10.49,Hellfire Hot Sauce,https://www.hotsauce.com/Hellfire-Ritual-Hot-Sauce/
"Hellfire The Elixir Hot Sauce, 6.8oz.",$11.00,$9.95,Hellfire Hot Sauce,https://www.hotsauce.com/hellfire-the-elixir-hot-sauce/
"Hellhound Ghost Pepper Sauce, 5.7oz.",$15.00,$11.95,HotSauce,https://www.hotsauce.com/hellhound-ghost-pepper-sauce/
"High River Sauces Rogue Hot Sauce, 5.4oz.",$11.00,$9.95,High River Sauces,https://www.hotsauce.com/high-river-sauces-rogue-hot-sauce/
"High River Sauces Thunder Juice Tequila Infused Hot Sauce, 5oz.",$11.50,$10.95,High River Sauces,https://www.hotsauce.com/High-River-Sauces-Thunder-Juice-Tequila-Infused-Hot-Sauce/
"Holy Jolokia Hot Sauce - 1 Million SHU, 5oz.",$10.50,$9.49,HotSauce,https://www.hotsauce.com/holy-jolokia-hot-sauce-1-million-shu/
"Hottest Fuckin' Sauce Mini Hot Sauce, 1.5oz.",$4.00,$3.49,Hottest FN,https://www.hotsauce.com/hottest-fuckin-sauce-mini-hot-sauce/
"Hottest Purees Gift Set, 3/2oz.",$53.00,$36.39,CaJohns,https://www.hotsauce.com/hottest-purees-gift-set/
"Iguana En Fuego Ultra Hot Pepper Sauce, 5oz.",$6.50,$5.95,Iguana Sauces,https://www.hotsauce.com/iguana-en-fuego-ultra-hot-pepper-sauce/
Name,Price,Price witout Tax,Brand,Link
"Karma Sauce Funken Hot Yellow Moruga Edition Sauce, 5oz.",$11.00,$9.95,Karma,https://www.hotsauce.com/karma-sauce-funken-hot-sauce/
"Karma Sauce Ghost Island Hot Sauce, 5oz.",$11.00,$9.95,Karma,https://www.hotsauce.com/karma-sauce-ghost-island-hot-sauce/
"Krakatoa! Pure Red Savina Mash Hot Sauce, 5oz.",$8.50,$7.95,CaJohns,https://www.hotsauce.com/krakatoa-pure-red-savina-mash-hot-sauce/
"Liquid Stoopid Hot Sauce, 5oz.",$8.00,$7.49,CaJohns,https://www.hotsauce.com/liquid-stoopid-hot-sauce/
"Magic Plant Farms Ghost Pepper Mash Puree, 9oz.",$11.00,$9.95,Magic Plant Farms,https://www.hotsauce.com/magic-plant-farms-ghost-pepper-mash/
"Magic Plant Farms Scorpion Pepper Mash Puree, 9oz.",$11.00,$9.95,Magic Plant Farms,https://www.hotsauce.com/magic-plant-farms-scorpion-pepper-mash-puree/
"Magma, An Eruption Of Disastrous Proportions, 5oz.",$10.50,$9.95,CaJohns,https://www.hotsauce.com/magma-an-eruption-of-disastrous-proportions/
"Matouk's Trinidad Scorpion Pepper Sauce, 10oz.",$13.50,$11.95,Matouks,https://www.hotsauce.com/matouks-trinidad-scorpion-pepper-sauce/
"Melinda's (NEW) Scorpion Pepper Sauce, 5oz.",$10.00,$7.95,Melinda's,https://www.hotsauce.com/Melindas-Scorpion-Pepper-Sauce/
"Melinda's Habanero Variety 4 Pack, 4/5oz.",$23.80,$9.00,Melinda's,https://www.hotsauce.com/melindas-habanero-variety-4-pack/
"Melinda's Naga Jolokia Hot Sauce, 5oz.",$6.95,$7.50,Melinda's,https://www.hotsauce.com/melindas-naga-jolokia-hot-sauce/
"Melinda's NEW GHOST Pepper Steak Sauce, 12oz.",$6.95,$6.50,Melinda's,https://www.hotsauce.com/Melindas-New-Ghost-Pepper-Steak-Sauce/
"Melinda's Red Savina Hot Sauce, 5oz.",$5.95,$6.50,Melinda's,https://www.hotsauce.com/melindas-red-savina-hot-sauce/
"Melinda's XXXXtra Reserve, 5oz.",$5.95,$7.95,Melinda's,https://www.hotsauce.com/Melindas-Xxxxtra-Reserve/
"Moruga Madness Hot Sauce (Trinidad MORUGA), 5oz.",$10.00,$11.50,CaJohns,https://www.hotsauce.com/moruga-madness-hot-sauce-trinidad-moruga/
"Moruga Scorpion Chili Sriracha Dust, 2 oz.",$8.95,$9.95,HotSauce,https://www.hotsauce.com/moruga-scorpion-chili-sriracha-dust/
"Naga Jolokia 10 Hot Sauce, 5oz.",$8.50,$9.50,CaJohns,https://www.hotsauce.com/naga-jolokia-10-hot-sauce/
"Nagasoreass Naga Jolokia Hot Sauce, 5oz.",$8.95,$30.00,CaJohns,https://www.hotsauce.com/nagasoreass-naga-jolokia-hot-sauce/
"No Survivors Hot Sauce Gift Box, 4/5oz.",$25.95,$9.50,HotSauce,https://www.hotsauce.com/no-survivors-hot-sauce-gift-box/
"Nuckin Futs Hot Sauce, 5oz.",$8.95,$13.00,HotSauce,https://www.hotsauce.com/nuckin-futs-hot-sauce/
"PAIN 100% Hot Sauce, 7oz.",$10.75,$20.50,Original Juan,https://www.hotsauce.com/pain-100-hot-sauce/
"Pain is Good Ghost-Ujang Micro Batch Hot Sauce, 4oz.",$15.95,$20.50,Pain Is Good,https://www.hotsauce.com/pain-is-good-ghost-ujang-hot-sauce/
"Pain Is Good Moruga-Masala Micro Batch Hot Sauce, 3.5oz.",$15.95,$20.50,Pain Is Good,https://www.hotsauce.com/pain-is-good-moruga-masala-hot-sauce/
"Pain is Good REAPER-ACHA Micro Batch Hot Sauce, 3.5oz.",$15.95,$9.95,Pain Is Good,https://www.hotsauce.com/pain-is-good-reaper-acha-hot-sauce-3/
"Primo's Peppers Primonition Hot Sauce, 5oz.",$11.00,$9.95,Primo's Peppers,https://www.hotsauce.com/Primos-Peppers-Primonition-Hot-Sauce/
"Primo's Peppers Swampadelic Hotter Than the Devil's Pecker Hot Sauce, 5oz.",$11.00,$9.95,Primo's Peppers,https://www.hotsauce.com/Primos-Peppers-Swampadelic-Hotter-Than-The-Devils-Pecker-Hot-Sauce/
"Primo's Peppers Swampadelic Mind Bending Swamp Heat Hot Sauce , 5oz.",$11.00,$12.00,Primo's Peppers,https://www.hotsauce.com/Primos-Peppers-Swampadelic-Mind-Bending-Swamp-Heat-Hot-Sauce/
"Pucker Butt Smokin Ed's Habanero Blend Hot Sauce, 5oz.",$10.49,$23.00,Pucker Butt,https://www.hotsauce.com/pucker-butt-smokin-eds-habanero-blend-hot-sauce/
"Pucker Butt The Reaper Hot Sauce, 5oz.",$19.95,$14.00,Pucker Butt,https://www.hotsauce.com/pucker-butt-the-reaper-hot-sauce/
Name,Price,Price witout Tax,Brand,Link
"Pure Cap Extract, 2oz.",$38.00,$29.95,HotSauce,https://www.hotsauce.com/pure-cap-extract/
"Pure Poison Hot Sauce, 5oz.",$8.50,$7.95,HotSauce,https://www.hotsauce.com/pure-poison-hot-sauce/
"Reaper Hot Sauce, 5oz.",$11.50,$9.95,HotSauce,https://www.hotsauce.com/reaper-hot-sauce/
"Red Ghost Hot Sauce, 5oz.",$9.00,$8.49,HotSauce,https://www.hotsauce.com/red-ghost-hot-sauce/
"Ring of Fire XX-Hot Habanero Hot Sauce, 12.5oz.",$10.50,$9.95,Ring Of Fire,https://www.hotsauce.com/ring-of-fire-xx-hot-habanero-hot-sauce/
"Salsa Stoopid, 16oz.",$11.00,$9.95,CaJohns,https://www.hotsauce.com/salsa-stoopid/
"Sancto Scorpio Hot Sauce (Trinidad MORUGA), 5oz.",$11.00,$9.95,CaJohns,https://www.hotsauce.com/sancto-scorpio-hot-sauce-trinidad-moruga/
"Satan's Blood Chile Extract, 1.35oz.",$27.00,$19.95,HotSauce,https://www.hotsauce.com/satans-blood-chile-extract/
"Satan's Ghost Pepper Sauce, 5.7oz.",$14.50,$10.95,HotSauce,https://www.hotsauce.com/satans-ghost-pepper-sauce/
"Satan's Rage Pepper Hot Sauce, 5.7oz.",$13.00,$10.95,HotSauce,https://www.hotsauce.com/satans-rage-pepper-hot-sauce/
"Scorpion Extreme Hot Sauce (Original), 5oz.",$8.50,$7.95,HotSauce,https://www.hotsauce.com/scorpion-extreme-hot-sauce-original/
"Scorpion Extreme Hot Sauce, 6.5oz.",$9.50,$8.95,HotSauce,https://www.hotsauce.com/scorpion-extreme-hot-sauce/
"Scorpion Hot Sauce w/Real Scorpion Meat, 5oz.",$9.50,$8.95,HotSauce,https://www.hotsauce.com/scorpion-hot-sauce-w-real-scorpion-meat/
"Scotch Bonnet Chili Sriracha Dust, 2 oz.",$8.50,$7.95,HotSauce,https://www.hotsauce.com/scotch-bonnet-chili-sriracha-dust/
"Smack My Ass and Call Me Sally, The Slap Heard Around The World, 5oz.",$10.00,$8.95,Tijuana Flats,https://www.hotsauce.com/smack-my-ass-the-slap-heard-round-the-world-hot-sauce/
"Submission Hot Sauce, 5oz.",$11.00,$9.95,HotSauce,https://www.hotsauce.com/submission-hot-sauce/
"Sucklebusters Ghost Pepper Chili Kits, 2oz.",$7.00,$5.95,SuckleBusters,https://www.hotsauce.com/sucklebusters-ghost-pepper-chili-kits/
"Sucklebusters Texas Gunpowder Ghost Chile Powder, 2.5oz.",$20.50,$18.95,SuckleBusters,https://www.hotsauce.com/sucklebusters-texas-gunpowder-ghost-chile-powder/
"The Beast Hot Sauce, Hottest This Side Of Hell, 5oz.",$7.50,$6.95,HotSauce,https://www.hotsauce.com/the-beast-hot-sauce-hottest-this-side-of-hell/
"The Ghost Hot Sauce w/ Bhut Jolokia Pepper, 5oz.",$11.00,$9.95,HotSauce,https://www.hotsauce.com/the-ghost-hot-sauce-bhut-jolokia-pepper/
"The Hottest Fuckin' Hot Sauce, 5oz.",$10.00,$8.95,Hottest FN,https://www.hotsauce.com/the-hottest-fuckin-hot-sauce/
"Torchbearer All Natural Zombie Apocalypse Hot Sauce, 5oz.",$22.50,$21.95,Torchbearer,https://www.hotsauce.com/torchbearer-all-natural-zombie-apocalypse-hot-sauce/
"Toxic Waste Extract Hot Sauce, 5oz.",$9.50,$7.95,HotSauce,https://www.hotsauce.com/toxic-waste-extract-hot-sauce/
"Trinidad Scorpion Chili Sriracha Dust, 2 oz.",$8.50,$7.95,HotSauce,https://www.hotsauce.com/trinidad-scorpion-chili-sriracha-dust/
"Venom Xtreme Hot Sauce, 5.7oz.",$8.00,$6.95,HotSauce,https://www.hotsauce.com/venom-xtreme-hot-sauce/
"Vicious Viper Hot Sauce, 5oz.",$10.50,$9.49,CaJohns,https://www.hotsauce.com/vicious-viper-hot-sauce/
"Widow, No Survivors Hot Sauce, 5oz.",$9.00,$7.95,HotSauce,https://www.hotsauce.com/widow-no-survivors-hot-sauce/
