name,priceNormal,priceWithoutax,branch,link
"CaJohn's (Special Edition) Barrel Aged Bourbon Vanilla Cayenne Chipotle Apple Pie Sauce, 12.7oz.",$30.00,$24.95,CaJohns,https://www.hotsauce.com/Cajohns-Barrel-Aged-Bourbon-Vanilla-Cayenne-Chipotle-Apple-Pie-Sauce/
"Fiesta Very Berry Chipotle Sauce, 12.5oz.",$10.00,$8.95,Original Juan,https://www.hotsauce.com/fiesta-three-berry-chipotle-sauce/
"Georgia Peach Vidalia Onion Hot Sauce with Red Velvet Top, 5oz.",$7.50,$6.95,HotSauce,https://www.hotsauce.com/georgia-peach-vidalia-onion-hot-sauce-red-velvet-top/
"Tahiti Joe's Maui Pepper Apples Ass Hot Sauce, 5oz.",$6.50,$5.95,Maui Pepper,https://www.hotsauce.com/tahiti-joes-maui-pepper-apples-ass-hot-sauce/
"Tahiti Joe's Maui Pepper Mango Meltdown Medium Heat, 5oz.",$6.50,$5.95,Maui Pepper,https://www.hotsauce.com/tahiti-joes-maui-pepper-mango-meltdown-medium-heat/
