name,priceNormal,priceWithoutax,branch,link
"Bone Suckin HOT Seasoning & Rub, 6.2oz.",$7.50,$6.95,Bone Suckin BBQ,https://www.hotsauce.com/bone-suckin-sauce-rib-rub-hot-seasoning-rub/
"Bone Suckin Seasoning & Rub, 5.8oz.",$7.50,$6.95,Bone Suckin BBQ,https://www.hotsauce.com/bone-suckin-sauce-rib-rub/
"Bone Suckin Yaki Teriyaki Sauce, 13.25oz.",$8.00,$7.49,Bone Suckin BBQ,https://www.hotsauce.com/bone-suckin-teriyaki-barbecue-sauce/
"Crazy Jerry's Seafood and Everything Else Sauce, 12oz.",$8.50,$7.95,Crazy Jerrys,https://www.hotsauce.com/Crazy-Jerrys-Seafood-And-Everything-Else-Sauce/
"Historic Lynchburg Tennessee Whiskey Jack in the Bean Sauce, 16oz.",$8.50,$7.95,Tennessee Whiskey,https://www.hotsauce.com/historic-lynchburg-tennessee-whiskey-jack-in-the-bean-sauce/
"Historic Lynchburg Tennessee Whiskey Swineapple Rib Glaze and Dippin' Sauce, 16oz.",$8.50,$7.95,Tennessee Whiskey,https://www.hotsauce.com/historic-lynchburg-tennessee-whiskey-swineapple-rib-glaze-and-dippin-sauce/
"Historic Lynchburg Tennessee Whiskey, Diabetic Friendly, Hot Gourmet Deli and Grillin Sauce, 16oz.",$7.50,$6.95,Tennessee Whiskey,https://www.hotsauce.com/historic-lynchburg-tennessee-whiskey-diabetic-friendly-hot-gourmet-deli-grillin-sauce/
"Historic Lynchburg Tennessee Whiskey, Diabetic Friendly, Mild Gourmet Deli & Grillin Sauce, 16oz.",$7.50,$6.95,Tennessee Whiskey,https://www.hotsauce.com/historic-lynchburg-tennessee-whiskey-diabetic-friendly-mild-gourmet-deli-grillin-sauce/
"Ingleby Farms Mesquite BBQ Pepper Sauce, 11.5oz.",$7.50,$6.95,HotSauce,https://www.hotsauce.com/ingleby-farms-mesquite-bbq-pepper-sauce/
"JohnBoy and Billy's Hot & Spicy Grillin' Sauce, 19oz.",$7.50,$6.95,JohnBoy & Billys,https://www.hotsauce.com/johnboy-and-billys-hot-spicy-grillin-sauce/
"JohnBoy and Billy's Original Grillin' Sauce, 19oz.",$7.50,$6.95,JohnBoy & Billys,https://www.hotsauce.com/johnboy-and-billys-original-grillin-sauce/
"Lime Time Grilling Sauce, 12oz.",$8.00,$7.49,HotSauce,https://www.hotsauce.com/lime-time-grilling-sauce/
"Marie Sharp's Exotic Steak Hot Sauce, 11.5oz.",$8.00,$6.95,Marie Sharps,https://www.hotsauce.com/marie-sharps-exotic-hot-sauce/
"Ole Ray's Blackberry Wine BBQ and Cooking Sauce, 13.5oz.",$8.00,$7.49,Ole Rays Sauces,https://www.hotsauce.com/ole-rays-blackberry-wine-bbq-and-cooking-sauce/
"Ole Ray's Classic Gold BBQ and Cooking Sauce, 12oz.",$8.00,$7.49,Ole Rays Sauces,https://www.hotsauce.com/ole-rays-classic-gold-bbq-and-cooking-sauce/
"Ole Ray's Red Delicious Apple Bourbon BBQ and Cooking Sauce, 12oz.",$8.00,$7.49,Ole Rays Sauces,https://www.hotsauce.com/ole-rays-red-delicious-apple-bourbon-bbq-and-cooking-sauce/
"Peach N' Pepper Grilling Sauce, 12oz.",$7.50,$6.95,HotSauce,https://www.hotsauce.com/peach-n-pepper-grilling-sauce/
"Ring of Fire Asian Chile Marinade, 12.5oz.",$11.00,$9.95,Ring Of Fire,https://www.hotsauce.com/ring-of-fire-asian-chile-marinade/
"Stubb's Beef Marinade, 12oz.",$6.50,$5.95,Stubbs,https://www.hotsauce.com/stubbs-beef-marinade/
"Stubb's Chicken Marinade, 12oz.",$7.00,$6.49,Stubbs,https://www.hotsauce.com/stubbs-chicken-marinade/
"Stubb's Dr. Pepper Anytime Sauce, 12oz.",$7.00,$6.49,Stubbs,https://www.hotsauce.com/stubbs-dr-pepper-anytime-sauce/
"Stubb's Green Chile Anytime Marinade Sauce, 12oz.",$7.00,$6.49,Stubbs,https://www.hotsauce.com/stubbs-green-chile-marinade/
"Stubb's Hickory Liquid Smoke, 5oz.",$3.50,$2.95,Stubbs,https://www.hotsauce.com/stubbs-hickory-liquid-smoke/
"Stubb's Mesquite Liquid Smoke, 5oz.",$4.50,$3.95,Stubbs,https://www.hotsauce.com/stubbs-mesquite-liquid-smoke/
"Stubb's Moppin' Sauce Bar-B-Q Baste, 12oz.",$7.00,$6.49,Stubbs,https://www.hotsauce.com/stubbs-moppin-sauce/
"Stubb's Original Marinade Sauces Gift Set, 4/12oz.",$26.00,$24.88,Stubbs,https://www.hotsauce.com/stubbs-original-marinade-sauces-gift-set/
"Stubb's Pork Marinade, 12oz.",$6.50,$5.95,Stubbs,https://www.hotsauce.com/stubbs-pork-marinade/
"The Shizzle Original Recipe Jerk Marinade, 14oz.",$9.50,$8.95,The Shizzle,https://www.hotsauce.com/the-shizzle-original-recipe-jerk-marinade/
"The Shizzle Voodoo Hot! Jerk Marinade, 14oz.",$10.00,$8.95,The Shizzle,https://www.hotsauce.com/the-shizzle-voodoo-hot-jerk-marinade/
"Tobago Keys Coral Ridge Seafood Sauce, 12oz.",$7.50,$6.95,Trinidad Sauces,https://www.hotsauce.com/tobago-keys-coral-ridge-seafood-sauce/
"Tobago Keys Peruvian Gold Grilling Sauce, 12oz.",$7.00,$6.49,Trinidad Sauces,https://www.hotsauce.com/tobago-keys-peruvian-gold-grilling-sauce/
"WalkersWood Spicy Jamaican Jerk Marinade, 17oz.",$11.00,$9.95,WalkersWood,https://www.hotsauce.com/walkerswood-spicy-jamaican-jerk-marinade/
