name,priceNormal,priceWithoutax,branch,link
"A Taste Of THAI Garlic Chili Sriracha Hot Sauce, 7oz.",$6.50,$5.95,HotSauce,https://www.hotsauce.com/A-Taste-Of-Thai-Garlic-Hot-Sauce/
"Bone Suckin Chicken Seasoning & Rub, 5.8oz.",$7.50,$6.95,Bone Suckin BBQ,https://www.hotsauce.com/bone-suckin-sauce-poultry-seasoning-rub/
"Bone Suckin Garlic & Honey Wing Sauce, 12.25oz.",$8.00,$7.49,Bone Suckin BBQ,https://www.hotsauce.com/bone-suckin-garlic-honey-wing-sauce/
"Bone Suckin HOT Barbecue Sauce, 16oz.",$8.00,$7.49,Bone Suckin BBQ,https://www.hotsauce.com/bone-suckin-bbq-sauce-hot/
"Bone Suckin HOT Seasoning & Rub, 6.2oz.",$7.50,$6.95,Bone Suckin BBQ,https://www.hotsauce.com/bone-suckin-sauce-rib-rub-hot-seasoning-rub/
"Bone Suckin HOT Thicker Style Barbecue Sauce, 16oz.",$8.00,$7.49,Bone Suckin BBQ,https://www.hotsauce.com/bone-suckin-hot-and-thick-barbecue-sauce/
"Bone Suckin Original Barbecue Sauce, 16oz.",$8.00,$7.49,Bone Suckin BBQ,https://www.hotsauce.com/bone-suckin-bbq-sauce-original/
"Bone Suckin Seafood Seasoning & Rub, 5.8oz.",$7.50,$6.95,Bone Suckin BBQ,https://www.hotsauce.com/bone-suckin-seafood-seasoning-and-rub/
"Bone Suckin Seasoning & Rub, 5.8oz.",$7.50,$6.95,Bone Suckin BBQ,https://www.hotsauce.com/bone-suckin-sauce-rib-rub/
"Bone Suckin Steak Seasoning & Rub, 5.8oz.",$7.50,$6.95,Bone Suckin BBQ,https://www.hotsauce.com/bone-suckin-steak-seasoning-and-rub/
"Bone Suckin Sweet Spicy Mustard, 12oz.",$8.00,$7.49,Bone Suckin BBQ,https://www.hotsauce.com/bone-suckin-sweet-hot-mustard/
"Bone Suckin Thicker Style Barbecue Sauce, 16oz.",$8.00,$7.49,Bone Suckin BBQ,https://www.hotsauce.com/bone-suckin-thick-barbecue-sauce/
"Bone Suckin Yaki Teriyaki Sauce, 13.25oz.",$8.00,$7.49,Bone Suckin BBQ,https://www.hotsauce.com/bone-suckin-teriyaki-barbecue-sauce/
"Dave's Gourmet Creamy Garlic Red Pepper Hot Sauce, 8oz.",$9.50,$8.95,Daves Gourmet,https://www.hotsauce.com/daves-gourmet-creamy-garlic-red-pepper-hot-sauce/
"Dave's Gourmet Creamy Ginger Citrus Hot Sauce, 8oz.",$9.50,$8.95,Daves Gourmet,https://www.hotsauce.com/daves-gourmet-creamy-ginger-citrus-hot-sauce/
"Dave's Gourmet Creamy Roasted Jalapeno Hot Sauce, 8oz.",$9.50,$8.95,Daves Gourmet,https://www.hotsauce.com/daves-gourmet-creamy-roasted-jalapeno-hot-sauce/
"Melinda's Chipotle Habanero Hot Sauce, 5oz.",$6.50,$5.95,Melinda's,https://www.hotsauce.com/melindas-chipotle-habanero-hot-sauce/
"Melinda's Garlic Habanero Hot Sauce, 5oz.",$6.50,$5.95,Melinda's,https://www.hotsauce.com/melindas-garlic-habanero-hot-sauce/
"Melinda's Hot Habanero Pepper Sauce, 5oz.",$6.50,$5.95,Melinda's,https://www.hotsauce.com/melindas-hot-habanero-pepper-sauce/
"Melinda's Jalapeno Pepper Sauce, 5oz.",$6.50,$5.95,Melinda's,https://www.hotsauce.com/melindas-jalapeno-pepper-sauce/
"Melinda's Mango Habanero Sauce, 5oz.",$6.50,$5.95,Melinda's,https://www.hotsauce.com/melindas-mango-habanero-sauce/
"Melinda's NEW Creamy Style Buffalo Wing Sauce, 12oz.",$7.50,$6.95,Melinda's,https://www.hotsauce.com/Melindas-New-Creamy-Style-Buffalo-Wing-Sauce/
"Melinda's NEW Creamy Style Ghost Pepper Wing Sauce, 12oz.",$7.50,$6.95,Melinda's,https://www.hotsauce.com/Melindas-Creamy-Style-Ghost-Pepper-Wing-Sauce/
"Melinda's NEW Creamy Style Habanero Wing Sauce, 12oz.",$7.50,$6.95,Melinda's,https://www.hotsauce.com/Melindas-Creamy-Style-Habanero-Wing-Sauce/
"Melinda's NEW Creamy Style Sriracha Wing Sauce, 12oz.",$7.50,$6.95,Melinda's,https://www.hotsauce.com/Melindas-Creamy-Style-Sriracha-Wing-Sauce/
"Melinda's NEW GHOST Pepper Steak Sauce, 12oz.",$7.50,$6.95,Melinda's,https://www.hotsauce.com/Melindas-New-Ghost-Pepper-Steak-Sauce/
"Melinda's NEW Jalapeno Green Hot Sauce, 12oz.",$7.50,$6.95,Melinda's,https://www.hotsauce.com/Melindas-Jalapeno-Green-Hot-Sauce/
"Melinda's NEW Peri Peri Garlic Hot Sauce, 12oz.",$7.50,$6.95,Melinda's,https://www.hotsauce.com/Melindas-Peri-Peri-Garlic-Hot-Sauce/
"Melinda's NEW Peri Peri Hot Sauce, 12oz.",$7.50,$6.95,Melinda's,https://www.hotsauce.com/Melindas-Peri-Peri-Hot-Sauce/
"Melinda's NEW Sriracha Hot Sauce, 12oz.",$7.50,$6.95,Melinda's,https://www.hotsauce.com/Melindas-Sriracha-Hot-Sauce/
"Melinda's NEW Thai Sweet Chili Sauce, 12oz.",$7.50,$6.95,Melinda's,https://www.hotsauce.com/Melindas-Thai-Sweet-Chili-Sauce/
"Melinda's NEWEST Creamy Style Wing Sauces Gift Set, 4/12oz.",$30.00,$27.80,Melinda's,https://www.hotsauce.com/Melindas-Newest-Creamy-Style-Wing-Sauces-Gift-Set/
"Melinda's NEWEST Hot Sauces Gift Set, 5/12oz.",$37.50,$34.75,Melinda's,https://www.hotsauce.com/Melindas-Newest-Hot-Sauces-Gift-Set/
"Pucker Butt I Dare You Stupit, 5oz.",$15.00,$12.95,Pucker Butt,https://www.hotsauce.com/pucker-butt-i-dare-you-stupit/
"Pucker Butt Peach Habanero Hot Sauce, 5oz.",$12.50,$9.95,Pucker Butt,https://www.hotsauce.com/pucker-butt-peach-habanero-hot-sauce/
"Pucker Butt Purgatory, 5oz.",$13.50,$12.95,Pucker Butt,https://www.hotsauce.com/pucker-butt-purgatory/
"Pucker Butt Shoot That's Hot, 5oz.",$11.00,$9.95,Pucker Butt,https://www.hotsauce.com/pucker-butt-shoot-thats-hot/
"Pucker Butt Smokin Ed's Habanero Blend Hot Sauce, 5oz.",$12.00,$10.49,Pucker Butt,https://www.hotsauce.com/pucker-butt-smokin-eds-habanero-blend-hot-sauce/
"Pucker Butt Voodoo Prince Death Mamba, 5oz.",$14.00,$10.95,Pucker Butt,https://www.hotsauce.com/pucker-butt-voodoo-prince-death-mamba/
"Queen Of Farts Hot Sauce, 5oz.",$7.00,$5.95,CaJohns,https://www.hotsauce.com/queen-of-farts-hot-sauce/
