Name,Price,Price witout Tax,Brand,Link
"Angry Cock Hot Sauce, 5oz.",$15.00,$12.95,CaJohns,https://www.hotsauce.com/Angry-Cock-Hot-Sauce/
"Angry Goat Pepper Co. Black Bison Hot Sauce, 5oz.",$9.50,$8.95,Angry Goat,https://www.hotsauce.com/angry-goat-pepper-co-black-bison-hot-sauce/
"Angry Goat Pepper Co. Dark Swizzle Hot Sauce, 5oz.",$9.00,$8.49,Angry Goat,https://www.hotsauce.com/angry-goat-pepper-co-dark-swizzle-hot-sauce/
"Angry Goat Pepper Co. Goat Rider Hot Sauce, 5oz.",$10.50,$9.95,Angry Goat,https://www.hotsauce.com/Angry-Goat-Pepper-Co-Goat-Rider-Hot-Sauce/
"Angry Goat Pepper Co. Hot Cock Hot Sauce, 5oz.",$9.50,$8.95,Angry Goat,https://www.hotsauce.com/Angry-Goat-Pepper-Co-Hot-Cock-Hot-Sauce/
"Angry Goat Pepper Co. Pink Elephant Hot Sauce, 5oz.",$9.00,$8.49,Angry Goat,https://www.hotsauce.com/angry-goat-pepper-co-pink-elephant-hot-sauce/
"Angry Goat Pepper Co. Sacrifice Hot Sauce, 5oz.",$9.00,$8.49,Angry Goat,https://www.hotsauce.com/angry-goat-pepper-co-sacrifice-hot-sauce/
"Angry Goat Pepper Co. Sweaty Beaver Hot Sauce, 5oz.",$9.50,$8.95,Angry Goat,https://www.hotsauce.com/Angry-Goat-Pepper-Co-Sweaty-Beaver-Hot-Sauce/
"Ass In The Tub Ghost Pepper Sauce, 5oz.",$9.50,$8.95,Ass In The Tub,https://www.hotsauce.com/ass-in-the-tub-ghost-pepper-sauce/
"Ass Kickin Extreme Hot Sauces 3 Pack, 3/5oz.",$34.50,$29.85,Ass Kickin,https://www.hotsauce.com/Ass-Kickin-Extreme-Hot-Sauces-3-Pack/
"Ass Kickin Ghost Pepper Hot Sauce, 5oz.",$12.50,$9.95,Ass Kickin,https://www.hotsauce.com/ass-kickin-ghost-pepper-hot-sauce/
"Ass Kickin Hot Salt 9 Pack, 9/1.1oz.",$31.50,$26.95,Ass Kickin,https://www.hotsauce.com/ass-kickin-hot-salt-9-pack/
"Best of Naga Jolokia (Ghost) Gift Set, 4/5oz.",$38.50,$34.80,HotSauce,https://www.hotsauce.com/best-of-naga-jolokia-ghost-gift-set/
"Blair's (New) Ultra Death Hot Sauce, 5oz.",$25.00,$19.95,Blairs Sauces,https://www.hotsauce.com/blairs-ultra-death-hot-sauce/
"Blair's Pure Death Naga (Ghost) Jolokia Hot Sauce, 5oz.",$10.50,$9.95,Blairs Sauces,https://www.hotsauce.com/blairs-pure-death-naga-ghost-jolokia-hot-sauce/
"Bravado Spice Co Ghost Pepper Blueberry Hot Sauce, 5oz.",$9.00,$7.95,Bravado Spice Co,https://www.hotsauce.com/bravado-spice-co-ghost-pepper-blueberry-hot-sauce/
"Bravado Spice Co. Aka Miso Ghost Reaper Hot Sauce, 5oz.",$14.00,$11.95,Bravado Spice Co,https://www.hotsauce.com/Bravado-Spice-Co-Aka-Miso-Ghost-Reaper-Hot-Sauce/
"Bravado Spice Co. Ancho Masala Scorpion Reaper Hot Sauce, 5oz.",$14.00,$12.49,Bravado Spice Co,https://www.hotsauce.com/Bravado-Cpice-Co-Ancho-Masala-Scorpion-Reaper-Hot-Sauce/
"Burns & McCoy Excubiarium Salsa Verde Hot Sauce, 5oz.",$13.50,$11.95,Burns & McCoy,https://www.hotsauce.com/Burns-McCoy-Excubiarium-Salsa-Verde-Hot-Sauce/
"Burns & McCoy Exitium Pineapple Ginger Hot Sauce, 5oz.",$14.00,$12.95,Burns & McCoy,https://www.hotsauce.com/Burns-McCoy-Exitium-Pineapple-Ginger-Hot-Sauce/
"CaJohn's Black Garlic Ghost Pepper Hot Sauce, 5oz.",$11.00,$9.95,CaJohns,https://www.hotsauce.com/Cajohns-Black-Garlic-Ghost-Pepper-Hot-Sauce/
"CaJohn's Black Garlic Hot Sauces 3 Pack, 3/5oz.",$31.00,$27.85,CaJohns,https://www.hotsauce.com/Cajohns-Black-Garlic-Hot-Sauces-3-Pack/
"CaJohn's Calavera Hot Sauce, 5oz.",$15.00,$12.95,CaJohns,https://www.hotsauce.com/calavera-hot-sauce/
"CaJohn's Classic Small Batch Ghost Chile Pepper Sauce, 5oz.",$8.50,$7.95,CaJohns,https://www.hotsauce.com/cajohns-classic-small-batch-ghost-chile-pepper-sauce/
"CaJohn's El Chupacabra Hot Sauce, 5oz.",$14.50,$12.95,CaJohns,https://www.hotsauce.com/cajohns-el-chupacabra-hot-sauce/
"CaJohn's Hottest Salsa's Gift Set, 3/16oz.",$33.00,$29.40,CaJohns,https://www.hotsauce.com/cajohns-hottest-salsas-gift-set/
"CaJohn's Jolokia 10 Puree, 2oz.",$9.00,$8.49,CaJohns,https://www.hotsauce.com/cajohns-jolokia-10-puree/
"CaJohn's La Segadora Reaper Hot Sauce, 5oz.",$11.50,$9.95,CaJohns,https://www.hotsauce.com/cajohns-la-segadora-reaper-hot-sauce/
"CaJohn's Lethal Ingestion Bhut Jolokia Hot Sauce, 2oz.",$19.50,$16.95,CaJohns,https://www.hotsauce.com/cajohns-lethal-ingestion-bhut-jolokia-hot-sauce/
Name,Price,Price witout Tax,Brand,Link
"CaJohn's Quetzalcoatl Ghost Chile Hot Sauce, 5oz.",$9.50,$8.49,CaJohns,https://www.hotsauce.com/Cajohns-Quetzalcoatl-Ghost-Chile-Hot-Sauce/
"CaJohn's Reaper Sling Blade Hot Sauce, 5oz.",$13.00,$10.95,CaJohns,https://www.hotsauce.com/cajohns-reaper-sling-blade-hot-sauce/
"CaJohn's Small Batch Ghost Garlic Pepper Sauce, 5oz.",$8.50,$7.95,CaJohns,https://www.hotsauce.com/cajohns-small-batch-ghost-garlic-pepper-sauce/
"Challenge Ghost Chili Magic Plant - 1,000,000 SHU",$6.50,$5.95,Magic Plant Farms,https://www.hotsauce.com/challenge-ghost-chili-magic-plant/
"Challenge Peach Ghost Chili Pepper Plant - 1,000,000 SHU",$6.50,$5.95,Magic Plant Farms,https://www.hotsauce.com/challenge-peach-ghost-chili-pepper-plant/
"Cutino Chipotle Hot Sauce, 4oz.",$12.00,$10.95,Cutino,https://www.hotsauce.com/Cutino-Chipotle-Hot-Sauce/
"Cutino Miso Hot Sauce, 4oz.",$12.00,$10.95,Cutino,https://www.hotsauce.com/Cutino-Miso-Hot-Sauce/
"Cutino Verde Hot Sauce, 4oz.",$12.00,$10.95,Cutino,https://www.hotsauce.com/Cutino-Verde-Hot-Sauce/
"Da Bomb Beyond Insanity and Torchbearer Garlic Reaper Hot Sauce Bundle, 5oz, 4oz.",$34.50,$31.90,Torchbearer,https://www.hotsauce.com/Da-Bomb-Beyond-Insanity-And-Torchbearer-Garlic-Reaper-Hot-Sauce-Bundle/
"Da Bomb Ghost Pepper Hot Sauce, 4oz.",$19.50,$14.95,Da Bomb,https://www.hotsauce.com/da-bomb-ghost-pepper-hot-sauce/
"Da Bomb Ghost Pepper Salsa, 15.5oz.",$9.50,$8.95,Da Bomb,https://www.hotsauce.com/da-bomb-ghost-pepper-salsa/
"Da Bomb Jolokia Ghost Snacks Gift Set, 8oz, 4oz, 15.5oz.",$39.00,$32.85,Da Bomb,https://www.hotsauce.com/da-bomb-jolokia-ghost-snacks-gift-set/
"Da Bomb Ultimate Sauce & Extracts Gift Set, 3/4oz., 1/2 oz.",$122.50,$101.80,Da Bomb,https://www.hotsauce.com/da-bomb-ultimate-sauce-extracts-gift-set/
"Danny Cash's Dirt Rider Garlic Ghost Chile Hot Sauce, 5oz.",$9.50,$8.95,Danny Cash,https://www.hotsauce.com/Danny-Cashs-Dirt-Rider-Garlic-Ghost-Chile-Hot-Sauce/
"Danny Cash's Ghost Rider Hot Sauce, 5oz.",$10.50,$9.49,Danny Cash,https://www.hotsauce.com/danny-cashs-ghost-rider-hot-sauce/
"Danny Cash's Salvation Sauce Holy Ghost! (w/mini bible), 5oz.",$11.00,$9.95,Danny Cash,https://www.hotsauce.com/danny-cashs-salvation-sauce-holy-ghost-mini-bible/
"Dave's (NEW) Ghost Pepper Naga Jolokia Hot Sauce, (Gallon) 128oz.",$150.00,$129.95,Daves Gourmet,https://www.hotsauce.com/daves-ghost-pepper-naga-jolokia-hot-sauce-gallon/
"Dave's (NEW) Ghost Pepper Naga Jolokia Hot Sauce, 5oz.",$10.50,$9.95,Daves Gourmet,https://www.hotsauce.com/daves-ghost-pepper-naga-jolokia-hot-sauce/
"ELijah's Xtreme Ghost Pepper Sauce, 5oz.",$8.50,$7.95,ELijahs Xtreme,https://www.hotsauce.com/elijahs-xtreme-ghost-pepper-sauce/
"Fat Cat Cat in Heat Hot Sauce, 5oz.",$6.50,$5.95,Fat Cat,https://www.hotsauce.com/fat-cat-cat-in-heat-hot-sauce/
"Fat Cat Surprisingly Mild Guajillo Ghost Hot Sauce, 5oz.",$6.50,$5.95,Fat Cat,https://www.hotsauce.com/fat-cat-surprisingly-mild-guajillo-ghost-hot-sauce/
"Fear Hot Sauce w/ Bhut Jolokia Pepper, 5oz.",$11.00,$9.95,HotSauce,https://www.hotsauce.com/fear-hot-sauce-bhut-jolokia-pepper/
"Ghost Dust Pure Ground Naga Jolokia Powder, 1oz",$24.50,$19.95,HotSauce,https://www.hotsauce.com/ghost-dust-pure-ground-naga-jolokia-powder/
"Ghost Scream Chili Garlic Jam, 10.5oz.",$12.00,$9.95,Ghost Scream,https://www.hotsauce.com/ghost-scream-chili-garlic-jam/
"Ghost Scream Chili Garlic Paste, 9oz.",$14.00,$11.95,Ghost Scream,https://www.hotsauce.com/ghost-scream-chili-garlic-paste/
"Ghost Scream Hot Sauce Gift Set, 5oz, 9oz, 10oz.",$32.00,$29.85,Ghost Scream,https://www.hotsauce.com/ghost-scream-hot-sauce-gift-set/
"Ghost Scream Hot Sauce, 5oz.",$8.50,$7.95,Ghost Scream,https://www.hotsauce.com/ghost-scream-hot-sauce/
"Green Ghost Hot Sauce, 5oz.",$9.50,$8.49,HotSauce,https://www.hotsauce.com/green-ghost-hot-sauce/
"Happy Beaver Hot Sauce, 5oz.",$12.00,$9.95,CaJohns,https://www.hotsauce.com/happy-beaver-hot-sauce/
Name,Price,Price witout Tax,Brand,Link
"Heartbreaking Dawns 1498 Cauterizer Trinidad Scorpion Hot Sauce, 5oz.",$11.00,$9.95,Heartbreaking Dawns,https://www.hotsauce.com/heartbreaking-dawns-1498-cauterizer-trinidad-scorpion/
"Heartbreaking Dawns 1841 Ghost Pepper Hot Sauce, 5oz.",$8.00,$7.49,Heartbreaking Dawns,https://www.hotsauce.com/Heartbreaking-Dawns-1841-Ghost-Pepper-Sauce/
"Heartbreaking Dawns The Green Verde Hot Sauce, 5oz.",$7.50,$6.95,Heartbreaking Dawns,https://www.hotsauce.com/heartbreaking-dawns-the-green-verde-hot-sauce/
"Hellfire Blueberry Hell Hot Sauce, 5oz.",$10.50,$9.95,Hellfire Hot Sauce,https://www.hotsauce.com/hellfire-blueberry-hell-hot-sauce/
"Hellfire Devil's Gold Hot Sauce, 5oz.",$11.00,$9.95,Hellfire Hot Sauce,https://www.hotsauce.com/hellfire-devils-gold-hot-sauce/
"Hellfire Evil Bastard Hot Sauce, 5oz.",$14.00,$11.95,Hellfire Hot Sauce,https://www.hotsauce.com/hellfire-evil-bastard-hot-sauce/
"Hellfire Fiery Fool Hot Sauce, 5oz.",$16.00,$13.95,Hellfire Hot Sauce,https://www.hotsauce.com/hellfire-fiery-fool-hot-sauce/
"Hellfire Firearrhea Hot Sauce, 5oz.",$17.00,$14.95,Hellfire Hot Sauce,https://www.hotsauce.com/Hellfire-Firearrhea-Hot-Sauce/
"Hellfire Hellboy Annung un Rama Hot Sauce, 5oz.",$13.00,$11.95,Hellfire Hot Sauce,https://www.hotsauce.com/Hellfire-Hellboy-Annung-Un-Rama-Hot-Sauce/
"Hellfire Hellboy Extreme Hot Sauce, 5oz.",$18.00,$16.95,Hellfire Hot Sauce,https://www.hotsauce.com/Hellfire-Hellboy-Extreme-Hot-Sauce/
"Hellfire Hellboy Legendary AF Hot Sauce, 5oz.",$17.00,$15.95,Hellfire Hot Sauce,https://www.hotsauce.com/Hellfire-Hellboy-Legendary-AF-Hot-Sauce/
"Hellfire Pure Hell Hot Sauce, 5oz.",$11.00,$9.95,Hellfire Hot Sauce,https://www.hotsauce.com/hellfire-pure-hell-hot-sauce/
"Hellhound Ghost Pepper Sauce, 5.7oz.",$15.00,$11.95,HotSauce,https://www.hotsauce.com/hellhound-ghost-pepper-sauce/
"High River Sauces Rogue Hot Sauce, 5.4oz.",$11.00,$9.95,High River Sauces,https://www.hotsauce.com/high-river-sauces-rogue-hot-sauce/
"Holy Jolokia Hot Sauce - 1 Million SHU, 5oz.",$10.50,$9.49,HotSauce,https://www.hotsauce.com/holy-jolokia-hot-sauce-1-million-shu/
"Karma Sauce Extreme Karma Hot Sauce, 5oz.",$13.00,$12.49,Karma,https://www.hotsauce.com/karma-sauce-extreme-karma-hot-sauce/
"Karma Sauce Ghost Island Hot Sauce, 5oz.",$11.00,$9.95,Karma,https://www.hotsauce.com/karma-sauce-ghost-island-hot-sauce/
"Karma Sauce The Goblin Hot Sauce, 5oz.",$10.50,$9.95,Karma,https://www.hotsauce.com/karma-sauce-the-goblin-hot-sauce/
"Kentucky Straight Bourbon Ghost Pepper Hot Sauce, 5oz.",$8.00,$7.49,Kentucky Straight,https://www.hotsauce.com/kentucky-straight-bourbon-ghost-pepper-hot-sauce/
"Kentucky Straight Bourbon Hot Sauce Gift Box, 4/5oz.",$29.00,$26.95,Kentucky Straight,https://www.hotsauce.com/kentucky-straight-bourbon-hot-sauce-gift-box/
"Magic Plant Farms Ghost Pepper Mash Puree, 9oz.",$11.00,$9.95,Magic Plant Farms,https://www.hotsauce.com/magic-plant-farms-ghost-pepper-mash/
"Melinda's Ketchup Complete Gift Set, 5/14oz.",$38.50,$35.83,Melinda's,https://www.hotsauce.com/Melindas-Ketchup-Complete-Gift-Set/
"Melinda's Naga Jolokia Hot Sauce, 5oz.",$9.00,$6.95,Melinda's,https://www.hotsauce.com/melindas-naga-jolokia-hot-sauce/
"Melinda's Naga Jolokia Ketchup, 14oz.",$8.00,$7.49,Melinda's,https://www.hotsauce.com/melindas-naga-jolokia-ketchup/
"Melinda's NEW Creamy Style Ghost Pepper Wing Sauce, 12oz.",$7.50,$6.95,Melinda's,https://www.hotsauce.com/Melindas-Creamy-Style-Ghost-Pepper-Wing-Sauce/
"Melinda's NEW GHOST Pepper Steak Sauce, 12oz.",$7.50,$6.95,Melinda's,https://www.hotsauce.com/Melindas-New-Ghost-Pepper-Steak-Sauce/
"Mongoose Extreme Venomous Hot Sauce, 5oz.",$16.00,$12.95,CaJohns,https://www.hotsauce.com/Mongoose-Extreme-Venomous-Hot-Sauce/
"Naga Jolokia 10 BBQ Sauce, 16oz.",$11.00,$9.95,CaJohns,https://www.hotsauce.com/naga-jolokia-10-bbq-sauce/
"Naga Jolokia 10 Hot Sauce, 5oz.",$11.50,$9.95,CaJohns,https://www.hotsauce.com/naga-jolokia-10-hot-sauce/
Name,Price,Price witout Tax,Brand,Link
"Naga Jolokia 10 Rub, 6oz.",$10.50,$8.95,CaJohns,https://www.hotsauce.com/naga-jolokia-10-rub/
"Naga Jolokia 10 Salsa, 16oz.",$11.00,$9.95,CaJohns,https://www.hotsauce.com/naga-jolokia-10-salsa/
"Naga Jolokia 10 Spice, 2oz.",$9.50,$8.49,CaJohns,https://www.hotsauce.com/naga-jolokia-10-spice/
"Naga Jolokia 10 Wing Sauce, 12oz.",$11.00,$9.95,CaJohns,https://www.hotsauce.com/naga-jolokia-10-wing-sauce/
"Nagasoreass Naga Jolokia Hot Sauce, 5oz.",$9.50,$8.95,CaJohns,https://www.hotsauce.com/nagasoreass-naga-jolokia-hot-sauce/
"Pain is Good Ghost-Ujang Micro Batch Hot Sauce, 4oz.",$20.50,$15.95,Pain Is Good,https://www.hotsauce.com/pain-is-good-ghost-ujang-hot-sauce/
"Pain Is Good Ujang, Masala and Acha Gift Set, 2/3.5oz, 1/4oz.",$61.50,$47.85,Pain Is Good,https://www.hotsauce.com/pain-is-good-ujang-masala-and-acha-gift-set/
"Pure Bhut Jolokia Ghost Chili Powder, .5oz.",$6.50,$5.95,HotSauce,https://www.hotsauce.com/pure-bhut-jolokia-ghost-chili-powder/
"Red Ghost Blistering Heat Ghost Wing Sauce, 12oz.",$7.50,$6.95,HotSauce,https://www.hotsauce.com/red-ghost-blistering-heat-ghost-wing-sauce/
"Red Ghost Buffalo Garlic Ghost Wing Sauce, 12oz.",$7.50,$6.95,HotSauce,https://www.hotsauce.com/red-ghost-buffalo-garlic-ghost-wing-sauce/
"Red Ghost Honey BBQ Ghost Wing Sauce, 12oz.",$7.50,$6.95,HotSauce,https://www.hotsauce.com/red-ghost-honey-bbq-ghost-wing-sauce/
"Red Ghost Hot Sauce, 5oz.",$9.00,$8.49,HotSauce,https://www.hotsauce.com/red-ghost-hot-sauce/
"Satan's Ghost Pepper Sauce, 5.7oz.",$14.50,$10.95,HotSauce,https://www.hotsauce.com/satans-ghost-pepper-sauce/
"Satan's Rage Pepper Hot Sauce, 5.7oz.",$13.00,$10.95,HotSauce,https://www.hotsauce.com/satans-rage-pepper-hot-sauce/
"Sauce Bae Hotter Habanero Hot Sauce, 5oz.",$8.00,$7.49,SoCal,https://www.hotsauce.com/Sauce-Bae-Hotter-Habanero-Hot-Sauce/
"SoCal Hot Red Hot Sauce, 5oz.",$9.50,$7.95,Spicy Shark,https://www.hotsauce.com/socal-hot-red-hot-sauce/
"Spicy Shark Tiger Shark Ghost Pepper Hot Sauce, 5oz.",$11.00,$9.95,Spontaneous Combust,https://www.hotsauce.com/Spicy-Shark-Tiger-Shark-Ghost-Pepper-Hot-Sauce/
"Spontaneous Combustion Ghost Pepper Microwave Popcorn, 3.5oz.",$3.00,$2.49,SuckleBusters,https://www.hotsauce.com/spontaneous-combustion-ghost-pepper-microwave-popcorn/
"Sucklebusters Ghost Pepper Chili Kits, 2oz.",$7.00,$5.95,SuckleBusters,https://www.hotsauce.com/sucklebusters-ghost-pepper-chili-kits/
"Sucklebusters Texas Gunpowder Ghost Chile Powder, 2.5oz.",$20.50,$18.95,SuckleBusters,https://www.hotsauce.com/sucklebusters-texas-gunpowder-ghost-chile-powder/
"Sucklebusters Texas Heat Ghost Pepper Sauce, 5oz.",$6.50,$5.95,Tahiti Joes,https://www.hotsauce.com/sucklebusters-texas-heat-ghost-pepper-sauce/
"Tahiti Joe's Onionator XXX Ghost Pepper Hot Sauce, 5oz.",$7.50,$6.95,Torchbearer,https://www.hotsauce.com/tahiti-joes-onionator-xxx-ghost-pepper-hot-sauce/
"The Evil Reaper Bastards Hot Sauce Set, 2/5oz.",$34.00,$27.35,HotSauce,https://www.hotsauce.com/The-Evil-Reaper-Bastards-Hot-Sauce-Set/
"The Ghost Hot Sauce w/ Bhut Jolokia Pepper, 5oz.",$11.00,$9.95,Torchbearer,https://www.hotsauce.com/the-ghost-hot-sauce-bhut-jolokia-pepper/
"Torchbearer All Natural Zombie Apocalypse Hot Sauce, 5oz.",$22.50,$21.95,Torchbearer,https://www.hotsauce.com/torchbearer-all-natural-zombie-apocalypse-hot-sauce/
"Torchbearer Hottest Sauces Zombie Reaper Gift Set, 4/5oz.",$88.50,$77.80,Torchbearer,https://www.hotsauce.com/Torchbearer-Hottest-Sauces-Zombie-Reaper-Gift-Set/
"Torchbearer Son of Zombie Wing Sauce, 5oz.",$13.00,$10.95,Torchbearer,https://www.hotsauce.com/Torchbearer-Son-Of-Zombie-Wing-Sauce/
"Torchbearer The Rapture Deadly Hot Sauce, 5oz.",$22.50,$19.95,Torchbearer,https://www.hotsauce.com/torchbearer-the-rapture-deadly-hot-sauce/
"Torchbearer Ultimate Annihilation Sauce, 5oz.",$22.50,$17.95,HotSauce,https://www.hotsauce.com/torchbearer-ultimate-annihilation-sauce/
