Name,Price,Price witout Tax,Brand,Link
"Ring Of Fire Xtra-Hot Habanero Hot Sauce, 12.5oz.",$11.00,$9.95,Ring Of Fire,https://www.hotsauce.com/ring-of-fire-xtra-hot-habanero-hot-sauce/
"Ring of Fire XX-Hot Habanero Hot Sauce, 12.5oz.",$10.50,$9.95,Ring Of Fire,https://www.hotsauce.com/ring-of-fire-xx-hot-habanero-hot-sauce/
"Serrano Lime Hot Sauce, 5oz.",$7.50,$6.95,CaJohns,https://www.hotsauce.com/serrano-lime-hot-sauce/
"Simply Chili Select Puree Gift Set, 7/5oz.",$59.50,$55.65,CaJohns,https://www.hotsauce.com/simply-chili-select-puree-gift-set/
"Tears of Joy Texas Cactus Hot Sauce, 5oz.",$8.50,$7.49,HotSauce,https://www.hotsauce.com/tears-of-joy-texas-cactus-hot-sauce/
