Name,Price,Price witout Tax,Brand,Link
"17th Street Barbecue Sauce Hog Warsh, 18oz.",$8.00,$7.49,17th Street Barbecue,https://www.hotsauce.com/17th-Street-Barbecue-Sauce-Hog-Warsh/
"17th Street Barbecue Sauce Little Kick, 18oz.",$8.00,$7.49,17th Street Barbecue,https://www.hotsauce.com/17th-Street-Barbecue-Sauce-Little-Kick/
"17th Street Barbecue Sauce Mike's Original, 18oz.",$8.00,$7.49,17th Street Barbecue,https://www.hotsauce.com/17th-Street-Barbecue-Sauce-Mikes-Original/
"Alice Cooper Welcome To My Nightmare Mild Hot Sauce, 5oz.",$9.00,$7.49,Alice Cooper,https://www.hotsauce.com/Alice-Cooper-Welcome-To-My-Nightmare-Mild-Hot-Sauce/
"American Style BBQ Pork Barbecue Sauce, 19oz.",$8.00,$5.95,American Style BBQ,https://www.hotsauce.com/american-style-bbq-pork-barbecue-sauce/
"Analize This XXX Garlic Hot Sauce, 5oz.",$8.00,$8.95,Tahiti Joes,https://www.hotsauce.com/analize-this-xxx-garlic-hot-sauce/
"Angry Goat Pepper Co. Demon Reaper Hot Sauce, 5oz.",$6.50,$9.95,Angry Goat,https://www.hotsauce.com/Angry-Goat-Pepper-Co-Demon-Reaper-Hot-Sauce/
"Angry Goat Pepper Co. Goat Rider Hot Sauce, 5oz.",$9.50,$8.95,Angry Goat,https://www.hotsauce.com/Angry-Goat-Pepper-Co-Goat-Rider-Hot-Sauce/
"Angry Goat Pepper Co. Hot Cock Hot Sauce, 5oz.",$10.50,$8.49,Angry Goat,https://www.hotsauce.com/Angry-Goat-Pepper-Co-Hot-Cock-Hot-Sauce/
"Angry Goat Pepper Co. Pink Elephant Hot Sauce, 5oz.",$9.50,$8.95,Angry Goat,https://www.hotsauce.com/angry-goat-pepper-co-pink-elephant-hot-sauce/
"Angry Goat Pepper Co. Purple Hippo Hot Sauce, 5oz.",$9.00,$8.49,Angry Goat,https://www.hotsauce.com/angry-goat-pepper-co-purple-hippo-hot-sauce/
"Angry Goat Pepper Co. Red Armadillo Hot Sauce, 5oz.",$9.50,$8.49,Angry Goat,https://www.hotsauce.com/angry-goat-pepper-co-red-armadillo-hot-sauce/
"Angry Goat Pepper Co. Sacrifice Hot Sauce, 5oz.",$9.00,$8.49,Angry Goat,https://www.hotsauce.com/angry-goat-pepper-co-sacrifice-hot-sauce/
"Angry Goat Pepper Co. Yellow Flamingo Hot Sauce, 5oz.",$9.00,$11.95,Angry Goat,https://www.hotsauce.com/angry-goat-pepper-co-yellow-flamingo-hot-sauce/
"Ass Kickin Beef Jerky, 4oz.",$9.00,$5.95,Ass Kickin,https://www.hotsauce.com/Ass-Kickin-Beef-Jerky/
"Bee Sting Pineapple Guava Pepper Sauce, 5oz.",$15.00,$7.49,Bee Sting,https://www.hotsauce.com/bee-sting-pineapple-guava-pepper-sauce/
"Belligerent Blaze Habanero Gourmet Hot Sauce, 5oz.",$6.50,$6.49,CaJohns,https://www.hotsauce.com/belligerent-blaze-habanero-gourmet-hot-sauce/
"Blind Betty's Original Recipe Hot Sauce, 5oz.",$8.00,$6.49,Blind Bettys,https://www.hotsauce.com/blind-bettys-original-recipe-hot-sauce/
"Blind Betty's Pineapple Pizzazz Hot Sauce, 5oz.",$7.00,$7.49,Blind Bettys,https://www.hotsauce.com/blind-bettys-pineapple-pizzazz-hot-sauce/
"Bone Suckin Garlic & Honey Wing Sauce, 12.25oz.",$7.00,$6.95,Bone Suckin BBQ,https://www.hotsauce.com/bone-suckin-garlic-honey-wing-sauce/
"Bone Suckin Hiccuppin Hot Habanero Hot Sauce, 5oz.",$8.00,$6.95,Bone Suckin BBQ,https://www.hotsauce.com/bone-suckin-habanero-sauce-hiccuppin-hot/
"Bone Suckin Honey & Habanero Wing Sauce, 12.25oz.",$7.50,$7.49,Bone Suckin BBQ,https://www.hotsauce.com/bone-suckin-honey-habanero-wing-sauce/
"Bone Suckin HOT Barbecue Sauce, 16oz.",$7.50,$7.49,Bone Suckin BBQ,https://www.hotsauce.com/bone-suckin-bbq-sauce-hot/
"Bone Suckin HOT Thicker Style Barbecue Sauce, 16oz.",$8.00,$7.49,Bone Suckin BBQ,https://www.hotsauce.com/bone-suckin-hot-and-thick-barbecue-sauce/
"Bone Suckin Original Barbecue Sauce, 16oz.",$8.00,$7.49,Bone Suckin BBQ,https://www.hotsauce.com/bone-suckin-bbq-sauce-original/
"Bone Suckin Thicker Style Barbecue Sauce, 16oz.",$8.00,$7.95,Bone Suckin BBQ,https://www.hotsauce.com/bone-suckin-thick-barbecue-sauce/
"Bourbon Q Distiller's Choice BBQ Sauce, 12.7oz.",$8.00,$7.95,Kentucky Bourbon Q,https://www.hotsauce.com/BourbonQ-Distillers-Choice-BBQ-Sauce/
"Bravado Spice Co. Jalapeno & Green Apple Hot Sauce, 5oz.",$8.50,$7.95,Bravado Spice Co,https://www.hotsauce.com/bravado-spice-co-jalapeno-green-apple-hot-sauce/
"Bravado Spice Co. Pineapple & Habanero Hot Sauce, 5oz.",$9.00,$6.95,Bravado Spice Co,https://www.hotsauce.com/bravado-spice-co-pineapple-habanero-hot-sauce/
"Brother Bru-Bru's Mild African Chili Pepper Sauce, 5oz.",$7.50,$6.95,Brother Bru Brus,https://www.hotsauce.com/brother-bru-brus-mild-african-chili-pepper-sauce/
"Buhba's Butt Blaster X-Hot Sauce, 5.7oz.",$8.50,$7.95,HotSauce,https://www.hotsauce.com/buhbas-butt-blaster-x-hot-sauce/
"Burns & McCoy Exhorresco 7 Pot Primo Hot Sauce, 5oz.",$14.00,$12.95,Burns & McCoy,https://www.hotsauce.com/Burns-McCoy-Exhorresco-7-Pot-Primo-Hot-Sauce/
"Butt Twister Butt Blazin Fire Sauce, 5oz.",$7.50,$6.95,CaJohns,https://www.hotsauce.com/butt-twister-butt-blazin-fire-sauce/
"CaJohn's (Special Edition) Barrel Aged Bourbon Vanilla Cayenne Chipotle Apple Pie Sauce, 12.7oz.",$30.00,$24.95,CaJohns,https://www.hotsauce.com/Cajohns-Barrel-Aged-Bourbon-Vanilla-Cayenne-Chipotle-Apple-Pie-Sauce/
"CaJohn's Apple Smoked Spiced Rum Ancho Barbeque Sauce, 16oz.",$8.50,$7.95,CaJohns,https://www.hotsauce.com/cajohns-apple-smoked-spiced-rum-ancho-barbeque-sauce/
"CaJohn's Applewood Smoked Bourbon Chipotle Barbecue Sauce, 16oz.",$8.50,$7.95,CaJohns,https://www.hotsauce.com/cajohns-applewood-smoked-bourbon-chipotle-barbecue-sauce/
"CaJohn's Black Garlic Chipotle Hot Sauce, 5oz.",$10.00,$8.95,CaJohns,https://www.hotsauce.com/Cajohns-Black-Garlic-Chipotle-Hot-Sauce/
"CaJohn's Black Garlic Ghost Pepper Hot Sauce, 5oz.",$11.00,$9.95,CaJohns,https://www.hotsauce.com/Cajohns-Black-Garlic-Ghost-Pepper-Hot-Sauce/
"CaJohn's Black Garlic Hot Sauce, 5oz.",$10.00,$8.95,CaJohns,https://www.hotsauce.com/CaJohns-Black-Garlic-Hot-Sauce/
"CaJohn's Black Garlic Hot Sauces 3 Pack, 3/5oz.",$31.00,$27.85,CaJohns,https://www.hotsauce.com/Cajohns-Black-Garlic-Hot-Sauces-3-Pack/
"CaJohn's Bourbon Infused Hot Sauce, 5oz.",$9.00,$8.49,CaJohns,https://www.hotsauce.com/cajohns-bourbon-infused-hot-sauce/
"CaJohn's Gourmet Pineapple Salsa, 16oz.",$9.00,$7.95,CaJohns,https://www.hotsauce.com/cajohns-gourmet-pineapple-salsa/
"CaJohn's Leviathan Hot Sauce, 5oz.",$15.00,$12.95,CaJohns,https://www.hotsauce.com/cajohns-leviathan-hot-sauce/
"CaJohn's Reaper Sling Blade Hot Sauce, 5oz.",$13.00,$10.95,CaJohns,https://www.hotsauce.com/cajohns-reaper-sling-blade-hot-sauce/
"CaJohn's Select Salsa Apple Pie Flavor, 16oz.",$9.00,$8.49,CaJohns,https://www.hotsauce.com/cajohns-select-salsa-apple-pie-flavor/
"CamelToe Chipotle Mango Hot Sauce, 5oz.",$6.50,$5.95,HotSauce,https://www.hotsauce.com/cameltoe-chipotle-mango-hot-sauce/
"Cholula Chipotle Hot Sauce, 5oz.",$5.50,$4.95,Cholula,https://www.hotsauce.com/cholula-chipotle-hot-sauce/
"Crazy Jerry's Dude Ranch Durty Black Bean Dip, 16oz.",$8.00,$7.49,Crazy Jerrys,https://www.hotsauce.com/crazy-jerrys-dude-ranch-durty-black-bean-dip/
"Crazy Jerry's Margarita Butt Burner Hot Salsa, 16.5oz.",$9.00,$7.95,Crazy Jerrys,https://www.hotsauce.com/crazy-jerrys-margarita-butt-burner-hot-salsa/
"Crazy Jerry's Margarita No Sweat Mild Salsa, 16.5oz.",$9.00,$7.95,Crazy Jerrys,https://www.hotsauce.com/crazy-jerrys-margarita-no-sweat-mild-salsa/
"Crazy Jerry's Spicy Dude Ranch Durty Black Bean Dip, 16oz.",$6.50,$5.95,Crazy Jerrys,https://www.hotsauce.com/crazy-jerrys-spicy-dude-ranch-durty-black-bean-dip/
"Da Bomb Ghost Pepper Salsa, 15.5oz.",$9.50,$8.95,Da Bomb,https://www.hotsauce.com/da-bomb-ghost-pepper-salsa/
"Da Bomb Ground Zero Hot Sauce, 4oz.",$21.50,$17.95,Da Bomb,https://www.hotsauce.com/da-bomb-ground-zero-hot-sauce/
"Da Bomb Scorpion Garlic Salsa, 15.5oz.",$10.00,$8.49,Da Bomb,https://www.hotsauce.com/da-bomb-scorpion-garlic-salsa/
"Danny Cash's Salvation Mango Pineapple Hot Sauce, 5oz.",$8.50,$7.95,Danny Cash,https://www.hotsauce.com/danny-cashs-salvation-mango-pineapple-hot-sauce/
"Dirty Dick's Caribbean Dreams Hot Pepper Sauce, 5oz.",$8.50,$7.95,Dirty Dicks,https://www.hotsauce.com/Dirty-Dicks-Caribbean-Dreams-Hot-Pepper-Sauce/
"Don't Fuck With Me I'm Hot XXX Extract Hot Sauce, 5oz.",$8.50,$7.95,Hot Sauce Fanatics,https://www.hotsauce.com/dont-fuck-with-me-im-hot-xxx-extract-hot-sauce/
"Elijah's Xtreme Regret Scorpion Reaper Hot Sauce, 5oz.",$11.00,$9.95,ELijahs Xtreme,https://www.hotsauce.com/Elijahs-Xtreme-Regret-Scorpion-Reaper-Hot-Sauce/
"Fat Cat Papaya Pequin Passion Hot Sauce, 5oz.",$6.50,$5.95,Fat Cat,https://www.hotsauce.com/Fat-Cat-Papaya-Pequin-Passion-Hot-Sauce/
"Fat Cat Purry-Purry Hot Sauce, 5oz.",$6.50,$5.95,Fat Cat,https://www.hotsauce.com/fat-cat-purry-purry-hot-sauce/
"Fat Cat Strawberry Serrano Hot Sauce, 5oz.",$6.50,$5.95,Fat Cat,https://www.hotsauce.com/fat-cat-strawberry-serrano-hot-sauce/
"Fiesta Very Berry Chipotle Sauce, 12.5oz.",$10.00,$8.95,Original Juan,https://www.hotsauce.com/fiesta-three-berry-chipotle-sauce/
"Fighting Cock Kentucky Bourbon Hot Sauce, 3.4oz.",$7.00,$4.95,Pappy's BBQ,https://www.hotsauce.com/Fighting-Cock-Kentucky-Bourbon-Hot-Sauce/
"Fuckin' Hot Sauces Gift Box, 4/5oz.",$31.50,$27.95,HotSauce,https://www.hotsauce.com/fuckin-hot-sauces-gift-box/
"Funky Monkey Banana Rum Pepper Sauce, 5.7oz.",$8.50,$7.95,HotSauce,https://www.hotsauce.com/funky-monkey-banana-rum-pepper-sauce/
"Heartbreaking Dawns (NEW) FERVOR Reaper Chile Hot Sauce, 5oz.",$11.00,$9.95,Heartbreaking Dawns,https://www.hotsauce.com/Heartbreaking-Dawns-Fervor-Reaper-Chile-Hot-Sauce/
"Heartbreaking Dawns 1841 Ghost Pepper Hot Sauce, 5oz.",$8.00,$7.49,Heartbreaking Dawns,https://www.hotsauce.com/Heartbreaking-Dawns-1841-Ghost-Pepper-Sauce/
"Heartbreaking Dawns REAPERCUSSION 7 Pod Primo Hot Sauce, 5oz.",$10.50,$9.95,Heartbreaking Dawns,https://www.hotsauce.com/heartbreaking-dawns-reapercussion/
"Heartbreaking Dawns Riff Lord Red Jalapeno Bread & Butter Sauce, 5oz.",$7.50,$6.95,Heartbreaking Dawns,https://www.hotsauce.com/heartbreaking-dawns-riff-lord-red-jalapeno-bread-butter-sauce/
"Heartbreaking Dawns Skylarking Anytime Hot Sauce, 5oz.",$7.50,$6.95,Heartbreaking Dawns,https://www.hotsauce.com/Heartbreaking-Dawns-Skylarking-Anytime-Sauce/
"Hellfire Gourmet Red Hot Sauce, 5oz.",$9.00,$7.95,Hellfire Hot Sauce,https://www.hotsauce.com/hellfire-gourmet-red-hot-sauce/
"Hellfire Lucifer's Last Blast Hot Sauce, 5oz.",$17.00,$15.49,Hellfire Hot Sauce,https://www.hotsauce.com/Hellfire-Lucifers-Last-Blast-Hot-Sauce/
"High River Sauces Grapes of Wrath Hot Sauce, 5.4oz.",$10.00,$9.49,High River Sauces,https://www.hotsauce.com/high-river-sauces-grapes-of-wrath-hot-sauce/
"High River Sauces Rattler BBQ Sauce, 12oz.",$8.00,$7.49,High River Sauces,https://www.hotsauce.com/high-river-sauces-rattler-bbq-sauce/
"High River Sauces Rogue Hot Sauce, 5.4oz.",$11.00,$9.95,High River Sauces,https://www.hotsauce.com/high-river-sauces-rogue-hot-sauce/
"High River Sauces Tears of the Sun Hot Sauce, 5.4oz.",$7.50,$6.95,High River Sauces,https://www.hotsauce.com/high-river-sauces-tears-of-the-sun-hot-sauce/
"High River Sauces Tears of the Sun Private Reserve Hot Sauce, 5oz.",$12.00,$9.95,High River Sauces,https://www.hotsauce.com/High-River-Sauces-Tears-Of-The-Sun-Private-Reserve-Hot-Sauce/
"High River Sauces Thunder Juice Tequila Infused Hot Sauce, 5oz.",$11.50,$10.95,High River Sauces,https://www.hotsauce.com/High-River-Sauces-Thunder-Juice-Tequila-Infused-Hot-Sauce/
"Historic Lynchburg Tennessee Whiskey Apple Cinnamon BBQ, 16oz",$8.50,$7.95,Tennessee Whiskey,https://www.hotsauce.com/historic-lynchburg-tennessee-whiskey-apple-cinnamon-bbq/
"Historic Lynchburg Tennessee Whiskey Jack Daniel's 100 Proof Hot & Spicy BBQ, 16oz.",$8.50,$7.95,Tennessee Whiskey,https://www.hotsauce.com/historic-lynchburg-tennessee-whiskey-jack-daniels-100-proof-hot-spicy-bbq/
"Historic Lynchburg Tennessee Whiskey Jack in the Bean Sauce, 16oz.",$8.50,$7.95,Tennessee Whiskey,https://www.hotsauce.com/historic-lynchburg-tennessee-whiskey-jack-in-the-bean-sauce/
"Historic Lynchburg Tennessee Whiskey Spiced Curry Ketchup, 15oz.",$7.50,$6.95,Tennessee Whiskey,https://www.hotsauce.com/historic-lynchburg-tennessee-whiskey-spiced-curry-ketchup/
"Historic Lynchburg Tennessee Whiskey Swineapple Rib Glaze and Dippin' Sauce, 16oz.",$8.50,$7.95,Tennessee Whiskey,https://www.hotsauce.com/historic-lynchburg-tennessee-whiskey-swineapple-rib-glaze-and-dippin-sauce/
"Historic Lynchburg Tennessee Whiskey, Diabetic Friendly, Hot Gourmet Deli and Grillin Sauce, 16oz.",$7.50,$6.95,Tennessee Whiskey,https://www.hotsauce.com/historic-lynchburg-tennessee-whiskey-diabetic-friendly-hot-gourmet-deli-grillin-sauce/
"Historic Lynchburg Tennessee Whiskey, Diabetic Friendly, Mild Gourmet Deli & Grillin Sauce, 16oz.",$7.50,$6.95,Tennessee Whiskey,https://www.hotsauce.com/historic-lynchburg-tennessee-whiskey-diabetic-friendly-mild-gourmet-deli-grillin-sauce/
"I Like Pig Butts Tangy BBQ Sauce, 19oz.",$8.00,$7.49,Hot Sauce Fanatics,https://www.hotsauce.com/i-like-pig-butts-tangy-bbq-sauce/
"Iguana Bloody Mary Mix, 25.7oz.",$9.00,$8.49,Iguana Sauces,https://www.hotsauce.com/iguana-bloody-mary-mix/
"Karma Sauce Ashes-2-Ashes Hot Sauce, 5oz.",$13.00,$11.95,Karma,https://www.hotsauce.com/karma-sauce-ashes-2-ashes-hot-sauce/
"Karma Sauce Bad Karma Hot Sauce, 5oz.",$9.00,$8.49,Karma,https://www.hotsauce.com/karma-sauce-bad-karma-hot-sauce/
"Karma Sauce Curry Karma Hot Sauce, 5oz.",$8.50,$7.95,Karma,https://www.hotsauce.com/karma-sauce-curry-karma-hot-sauce/
"Karma Sauce Extreme Karma Hot Sauce, 5oz.",$13.00,$12.49,Karma,https://www.hotsauce.com/karma-sauce-extreme-karma-hot-sauce/
"Karma Sauce Funken Hot Yellow Moruga Edition Sauce, 5oz.",$11.00,$9.95,Karma,https://www.hotsauce.com/karma-sauce-funken-hot-sauce/
"Karma Sauce Ghost Island Hot Sauce, 5oz.",$11.00,$9.95,Karma,https://www.hotsauce.com/karma-sauce-ghost-island-hot-sauce/
"Karma Sauce Good Karma Hot Sauce, 5oz.",$8.50,$7.95,Karma,https://www.hotsauce.com/karma-sauce-good-karma-hot-sauce/
"Karma Sauce Red Habanero Cherry Bomb Hot Sauce, 5oz.",$9.50,$8.95,Karma,https://www.hotsauce.com/karma-sauce-cherry-bomb-hot-sauce/
"Karma Sauce Smokey Karma Hot Sauce, 5oz.",$8.50,$7.95,Karma,https://www.hotsauce.com/karma-sauce-smokey-karma-hot-sauce/
"Karma Sauce The Goblin Hot Sauce, 5oz.",$10.50,$9.95,Karma,https://www.hotsauce.com/karma-sauce-the-goblin-hot-sauce/
"Kentucky Straight Bacon Bourbon Barbecue Sauce, 14.5oz.",$7.50,$6.95,Kentucky Straight,https://www.hotsauce.com/kentucky-straight-bacon-bourbon-barbecue-sauce/
"Key West Key Lime Hot Sauce, 5oz.",$7.50,$6.95,Key West Key Lime,https://www.hotsauce.com/key-west-key-lime-hot-sauce/
"Larceny Kentucky Bourbon BBQ Sauce, 12.7oz.",$8.00,$7.49,Pappy's BBQ,https://www.hotsauce.com/Larceny-Kentucky-Bourbon-BBQ-Sauce/
"Larceny Kentucky Bourbon Hot Sauce, 3.4oz.",$5.50,$4.95,Pappy's BBQ,https://www.hotsauce.com/Larceny-Kentucky-Bourbon-Hot-Sauce/
"Moruga Scorpion Chili Sriracha Dust, 2 oz.",$8.50,$7.95,HotSauce,https://www.hotsauce.com/moruga-scorpion-chili-sriracha-dust/
"Mountain Man Roasted Corn, Garlic & Chipotle Sauce, 5oz.",$8.00,$6.95,Mountain Man,https://www.hotsauce.com/mountain-man-roasted-corn-garlic-chipotle-sauce/
"No Shit This Is Hot! Hot Sauce, 5oz.",$6.50,$5.95,HotSauce,https://www.hotsauce.com/no-shit-this-is-hot-hot-sauce/
"Ole Ray's Apple Cinnamon BBQ Sauce, 16oz.",$8.00,$7.49,Ole Rays Sauces,https://www.hotsauce.com/ole-rays-apple-cinnamon-bbq-sauce/
"Ole Ray's Blackberry Wine BBQ and Cooking Sauce, 13.5oz.",$8.00,$7.49,Ole Rays Sauces,https://www.hotsauce.com/ole-rays-blackberry-wine-bbq-and-cooking-sauce/
"Ole Ray's Classic Gold BBQ and Cooking Sauce, 12oz.",$8.00,$7.49,Ole Rays Sauces,https://www.hotsauce.com/ole-rays-classic-gold-bbq-and-cooking-sauce/
"Ole Ray's Kentucky Gold Bourbon BBQ Sauce, 16oz.",$8.00,$7.49,Ole Rays Sauces,https://www.hotsauce.com/ole-rays-kentucky-gold-bourbon-bbq-sauce/
"Ole Ray's Kentucky Red Bourbon BBQ Sauce, 16oz.",$8.00,$7.49,Ole Rays Sauces,https://www.hotsauce.com/ole-rays-kentucky-red-bourbon-bbq-sauce/
"Ole Ray's Peach-A-Licious Barbecue Sauce, 16oz.",$8.00,$7.49,Ole Rays Sauces,https://www.hotsauce.com/ole-rays-peach-a-licious-barbecue-sauce/
"Ole Ray's Pork-A-Licious Barbecue BBQ Sauce, 16oz.",$8.00,$7.49,Ole Rays Sauces,https://www.hotsauce.com/ole-rays-pork-a-licious-barbecue-bbq-sauce/
"Ole Ray's Red Delicious Apple Bourbon BBQ and Cooking Sauce, 12oz.",$8.00,$7.49,Ole Rays Sauces,https://www.hotsauce.com/ole-rays-red-delicious-apple-bourbon-bbq-and-cooking-sauce/
"Organic Harvest Jalapeno Pepper Sauce, 5oz.",$6.00,$4.95,Organic Harvest,https://www.hotsauce.com/organic-harvest-jalapeno-pepper-sauce/
"Pain is Good #37 Honey Habanero Screamin' Wing Sauce, 13.5oz.",$10.50,$9.95,Pain Is Good,https://www.hotsauce.com/pain-is-good-37-honey-habanero-screamin-wing-sauce/
"Pain is Good Batch #114 Salsa, 15.5oz.",$7.50,$6.95,Pain Is Good,https://www.hotsauce.com/pain-is-good-batch-114-salsa/
"Pappy's Chicks Dig Me Mango Chipotle Grilling Sauce, 12.7oz.",$7.50,$6.95,Pappy's BBQ,https://www.hotsauce.com/chicks-dig-me-mango-chipotle-grilling-sauce/
"PETA BBQ Sauce, 19oz.",$7.50,$6.95,PETA Sauces,https://www.hotsauce.com/peta-bbq-sauce/
"Primo's Peppers Swampadelic Hotter Than the Devil's Pecker Hot Sauce, 5oz.",$11.00,$9.95,Primo's Peppers,https://www.hotsauce.com/Primos-Peppers-Swampadelic-Hotter-Than-The-Devils-Pecker-Hot-Sauce/
"Primo's Peppers Swampadelic Mind Bending Swamp Heat Hot Sauce , 5oz.",$11.00,$9.95,Primo's Peppers,https://www.hotsauce.com/Primos-Peppers-Swampadelic-Mind-Bending-Swamp-Heat-Hot-Sauce/
"Queen Of Farts Hot Sauce, 5oz.",$7.00,$5.95,CaJohns,https://www.hotsauce.com/queen-of-farts-hot-sauce/
"Rectum Ripper XXX 1/2 Mustard & Ginger, 5oz.",$6.50,$5.95,Tahiti Joes,https://www.hotsauce.com/rectum-ripper-xxx-mustard-ginger/
"Red Ghost Honey BBQ Ghost Wing Sauce, 12oz.",$7.50,$6.95,HotSauce,https://www.hotsauce.com/red-ghost-honey-bbq-ghost-wing-sauce/
"Scorpion Extreme Hot Sauce (Original), 5oz.",$8.50,$7.95,HotSauce,https://www.hotsauce.com/scorpion-extreme-hot-sauce-original/
"Scotch Bonnet Chili Sriracha Dust, 2 oz.",$8.50,$7.95,HotSauce,https://www.hotsauce.com/scotch-bonnet-chili-sriracha-dust/
"Serrano Lime Hot Sauce, 5oz.",$7.50,$6.95,CaJohns,https://www.hotsauce.com/serrano-lime-hot-sauce/
"Sphincter Shrinker XXX Hot Sauce, 5.7oz.",$9.50,$8.95,Professor Payne,https://www.hotsauce.com/sphincter-shrinker-xxx-hot-sauce/
"Spicy Shark Caribbean Reef Shark Scotch Bonnet Hot Sauce, 5oz.",$11.00,$9.95,Spicy Shark,https://www.hotsauce.com/Spicy-Shark-Caribbean-Reef-Shark-Scotch-Bonnet-Hot-Sauce/
"Spicy Shark Megaladon Carolina Reaper Hot Sauce, 5oz.",$11.00,$9.95,Spicy Shark,https://www.hotsauce.com/Spicy-Shark-Megaladon-Carolina-Reaper-Hot-Sauce/
"Spicy Shark Original Habanero Hot Sauce, 5oz.",$11.00,$9.95,Spicy Shark,https://www.hotsauce.com/Spicy-Shark-Original-Habanero-Hot-Sauce/
"Spicy Shark Thresher Shark Chipotle Hot Sauce, 5oz.",$11.00,$9.95,Spicy Shark,https://www.hotsauce.com/Spicy-Shark-Thresher-Shark-Chipotle-Hot-Sauce/
"Spicy Shark Tiger Shark Ghost Pepper Hot Sauce, 5oz.",$11.00,$9.95,Spicy Shark,https://www.hotsauce.com/Spicy-Shark-Tiger-Shark-Ghost-Pepper-Hot-Sauce/
"Sriracha Chili Dust, 2oz.",$7.50,$6.95,HotSauce,https://www.hotsauce.com/sriracha-chili-dust/
"Stubb's Beef Marinade, 12oz.",$6.50,$5.95,Stubbs,https://www.hotsauce.com/stubbs-beef-marinade/
"Stubb's Chicken Marinade, 12oz.",$7.00,$6.49,Stubbs,https://www.hotsauce.com/stubbs-chicken-marinade/
"Stubb's Dr. Pepper Anytime Sauce, 12oz.",$7.00,$6.49,Stubbs,https://www.hotsauce.com/stubbs-dr-pepper-anytime-sauce/
"Stubb's Dr. Pepper Legendary Bar-B-Q Sauce, 18oz.",$7.00,$6.49,Stubbs,https://www.hotsauce.com/stubbs-dr-pepper-bbq-sauce/
"Stubb's Green Chile Anytime Marinade Sauce, 12oz.",$7.00,$6.49,Stubbs,https://www.hotsauce.com/stubbs-green-chile-marinade/
"Stubb's Sweet Heat Legendary Bar-B-Q Sauce, 18oz.",$7.50,$6.95,Stubbs,https://www.hotsauce.com/stubbs-sweet-heat-bbq-sauce/
"Stubb's Sweet Honey N Spice Legendary Bar-B-Q Sauce, 18oz.",$6.50,$5.95,Stubbs,https://www.hotsauce.com/Stubbs-Sweet-Honey-N-Spice-Bar-B-Q-Sauce/
"Tabasco Raspberry Chipotle Hot Sauce, 5oz.",$11.00,$8.95,Tabasco,https://www.hotsauce.com/tabasco-raspberry-chipotle-hot-sauce/
"Tahiti Joe's Killer Garlic XXX Pepper Sauce, 5oz.",$6.50,$5.95,Tahiti Joes,https://www.hotsauce.com/tahiti-joes-killer-garlic-xxx-pepper-sauce/
"Tahiti Joe's Maui Pepper Apples Ass Hot Sauce, 5oz.",$6.50,$5.95,Maui Pepper,https://www.hotsauce.com/tahiti-joes-maui-pepper-apples-ass-hot-sauce/
"Tahiti Joe's Maui Pepper Chipotle Raspberry Mango Hot Sauce, 5oz.",$6.50,$5.95,Maui Pepper,https://www.hotsauce.com/tahiti-joes-maui-pepper-chipotle-raspberry-mango-hot-sauce/
"Tahiti Joe's Maui Pepper Mango Meltdown Medium Heat, 5oz.",$6.50,$5.95,Maui Pepper,https://www.hotsauce.com/tahiti-joes-maui-pepper-mango-meltdown-medium-heat/
"Tahiti Joe's Maui Pepper Mango Meltdown X-Treme Heat, 5oz.",$6.50,$5.95,Maui Pepper,https://www.hotsauce.com/tahiti-joes-maui-pepper-mango-meltdown-x-treme-heat/
"Tahiti Joe's Maui Pepper Strawberry Meltdown Hot Sauce, 5oz.",$6.50,$5.95,Maui Pepper,https://www.hotsauce.com/tahiti-joes-maui-pepper-strawberry-meltdown-hot-sauce/
"Tahiti Joe's Maui Pepper Sunset Salsa Pineapple - Hot, 12oz.",$6.50,$5.95,Maui Pepper,https://www.hotsauce.com/tahiti-joes-maui-pepper-hot-sunset-pineapple-salsa/
"Tahiti Joe's Maui Pepper Sunset Salsa Pineapple - Medium, 12oz.",$6.50,$5.95,Maui Pepper,https://www.hotsauce.com/tahiti-joes-maui-pepper-medium-sunset-pineapple-salsa/
"Tahiti Joe's Onionator XXX Ghost Pepper Hot Sauce, 5oz.",$7.50,$6.95,Tahiti Joes,https://www.hotsauce.com/tahiti-joes-onionator-xxx-ghost-pepper-hot-sauce/
"Tamarindo Bay Steak Sauce, 10oz.",$8.50,$7.95,Half Moon Bay,https://www.hotsauce.com/tamarindo-bay-steak-sauce/
"Tears of Joy Texas Cactus Hot Sauce, 5oz.",$8.50,$7.49,HotSauce,https://www.hotsauce.com/tears-of-joy-texas-cactus-hot-sauce/
"Thai Monkey Hot Sauce, 5oz.",$7.50,$6.95,Captain Thoms,https://www.hotsauce.com/thai-monkey-hot-sauce/
"The Shizzle Original Recipe Jerk Marinade, 14oz.",$9.50,$8.95,The Shizzle,https://www.hotsauce.com/the-shizzle-original-recipe-jerk-marinade/
"The Shizzle Voodoo Hot! Jerk Marinade, 14oz.",$10.00,$8.95,The Shizzle,https://www.hotsauce.com/the-shizzle-voodoo-hot-jerk-marinade/
"Tiki Bar Hotter Hot Sauce, 5oz.",$8.00,$7.49,CaJohns,https://www.hotsauce.com/tiki-bar-hotter-hot-sauce/
"Tobago Keys Peruvian Gold Grilling Sauce, 12oz.",$7.00,$6.49,Trinidad Sauces,https://www.hotsauce.com/tobago-keys-peruvian-gold-grilling-sauce/
"Trinidad Scorpion Chili Sriracha Dust, 2 oz.",$8.50,$7.95,HotSauce,https://www.hotsauce.com/trinidad-scorpion-chili-sriracha-dust/
"Vicious Viper Hot Sauce, 5oz.",$10.50,$9.49,CaJohns,https://www.hotsauce.com/vicious-viper-hot-sauce/
"West African Voodoo Juice, 5oz.",$8.50,$7.95,Captain Thoms,https://www.hotsauce.com/west-african-voodoo-juice/
"White Zombie Hot Sauce, 5oz.",$8.50,$7.95,Captain Thoms,https://www.hotsauce.com/white-zombie-hot-sauce/
"Wimp Retardant X-Hot Hot Sauce, 5.7oz.",$8.50,$7.95,Professor Payne,https://www.hotsauce.com/wimp-retardant-x-hot-hot-sauce/
