name,priceNormal,priceWithoutax,branch,link
"A Little Nukey Hot Sauce, 5oz.",$6.50,$5.95,FireWorks,https://www.hotsauce.com/a-little-nukey-hot-sauce/
"Angry Goat Pepper Co. Hippy Dippy Green Hot Sauce, 5oz.",$9.00,$8.49,Angry Goat,https://www.hotsauce.com/angry-goat-pepper-co-hippy-dippy-green-hot-sauce/
"Ass Kickin Fire Roasted Green Chile and Tequila Salsa, 13oz.",$7.50,$6.95,Ass Kickin,https://www.hotsauce.com/ass-kickin-fire-roasted-green-chile-and-tequila-salsa/
"Ass Kickin Original Habanero and Pinto Bean Salsa, 13oz.",$7.50,$6.95,Ass Kickin,https://www.hotsauce.com/ass-kickin-original-habanero-and-pinto-bean-salsa/
"Biker Bitch Hot n Wild Hot Sauce, 5oz.",$6.50,$5.95,Tahiti Joes,https://www.hotsauce.com/biker-bitch-hot-n-wild-hot-sauce/
"Bite Me! Lime/Cilantro Hot Sauce, 5oz.",$7.00,$6.49,HotSauce,https://www.hotsauce.com/bite-me-lime-cilantro-hot-sauce/
"Blair's After Death with Liquid Fire Hot Sauce, 5oz.",$13.00,$11.95,Blairs Sauces,https://www.hotsauce.com/blairs-after-death-with-liquid-fire-hot-sauce/
"Blair's Beyond Death Hot Sauce, 5oz.",$18.00,$15.95,Blairs Sauces,https://www.hotsauce.com/blairs-beyond-death-hot-sauce/
"Blair's Q Heat Chipotle Slam Exotic Hot Sauce, 8.44oz.",$11.00,$9.95,Blairs Sauces,https://www.hotsauce.com/blairs-q-heat-chipotle-slam-exotic-hot-sauce/
"Blair's Q Heat Jalapeno Tequila Exotic Hot Sauce, 8.44oz.",$11.00,$9.95,Blairs Sauces,https://www.hotsauce.com/blairs-q-heat-jalapeno-tequila-exotic-hot-sauce/
"Blair's Q Heat Wasabi Green Tea Exotic Hot Sauce, 8.44oz.",$8.50,$7.95,Blairs Sauces,https://www.hotsauce.com/blairs-q-heat-wasabi-green-tea-exotic-hot-sauce/
"Blair's Salsa De La Muerte con Chipotle, 5oz.",$8.50,$7.95,Blairs Sauces,https://www.hotsauce.com/blairs-salsa-de-la-muerte-con-chipotle/
"Bravado Spice Co. Creamy Herb and Jalapeno Hot Sauce, 5oz.",$9.00,$7.95,Bravado Spice Co,https://www.hotsauce.com/Bravado-Spice-Co-Creamy-Herb-And-Jalapeno-Hot-Sauce/
"Burns & McCoy Excubiarium Salsa Verde Hot Sauce, 5oz.",$13.50,$11.95,Burns & McCoy,https://www.hotsauce.com/Burns-McCoy-Excubiarium-Salsa-Verde-Hot-Sauce/
"Burns & McCoy Reaper Verde Hot Sauce, 5oz.",$10.00,$7.95,Burns & McCoy,https://www.hotsauce.com/Burns-McCoy-Verde-Hot-Sauce/
"CamelToe Chipotle Mango Hot Sauce, 5oz.",$6.50,$5.95,HotSauce,https://www.hotsauce.com/cameltoe-chipotle-mango-hot-sauce/
"Caribbean Condiment Pirates Blend Garlapeno Sauce, 10oz.",$8.50,$7.95,Half Moon Bay,https://www.hotsauce.com/caribbean-condiment-pirates-blend-garlapeno-sauce/
"Crazy Jerry's Margarita Butt Burner Hot Salsa, 16.5oz.",$9.00,$7.95,Crazy Jerrys,https://www.hotsauce.com/crazy-jerrys-margarita-butt-burner-hot-salsa/
"Crazy Jerry's Margarita No Sweat Mild Salsa, 16.5oz.",$9.00,$7.95,Crazy Jerrys,https://www.hotsauce.com/crazy-jerrys-margarita-no-sweat-mild-salsa/
"Dave's Gourmet Creamy Hot Sauce Gift Pack, 3/8oz.",$28.50,$26.85,Daves Gourmet,https://www.hotsauce.com/daves-gourmet-creamy-hot-sauce-gift-pack/
"Dave's Gourmet Creamy Roasted Jalapeno Hot Sauce, 8oz.",$9.50,$8.95,Daves Gourmet,https://www.hotsauce.com/daves-gourmet-creamy-roasted-jalapeno-hot-sauce/
"Dave's Gourmet Hurtin' Jalapeno, 5oz.",$7.50,$6.95,Daves Gourmet,https://www.hotsauce.com/daves-gourmet-hurtin-jalapeno/
"Deathwish Cayenne Hot Sauce, 5oz.",$7.00,$6.49,Deathwish Sauces,https://www.hotsauce.com/deathwish-cayenne-hot-sauce/
"Deathwish Red Jalapeno Hot Sauce, 5oz.",$7.00,$6.49,Deathwish Sauces,https://www.hotsauce.com/deathwish-red-jalapeno-hot-sauce/
"Fat Cat Cat in Heat Hot Sauce, 5oz.",$6.50,$5.95,Fat Cat,https://www.hotsauce.com/fat-cat-cat-in-heat-hot-sauce/
"Fat Cat Chairman Meow's Revenge Hot Sauce, 5oz.",$7.00,$5.95,Fat Cat,https://www.hotsauce.com/fat-cat-chairman-meows-revenge-hot-sauce/
"Heartbeat Hot Sauces 4 Pack, 4/6oz.",$54.00,$47.80,Heartbeat Hot Sauces,https://www.hotsauce.com/Heartbeat-Hot-Sauces-4-Pack/
"Heartbeat Jalapeno Hot Sauce, 6oz.",$13.50,$11.95,Heartbeat Hot Sauces,https://www.hotsauce.com/Heartbeat-Jalapeno-Hot-Sauce/
"Heartbreaking Dawns Skylarking Anytime Hot Sauce, 5oz.",$7.50,$6.95,Heartbreaking Dawns,https://www.hotsauce.com/Heartbreaking-Dawns-Skylarking-Anytime-Sauce/
"Heartbreaking Dawns The Green Verde Hot Sauce, 5oz.",$7.50,$6.95,Heartbreaking Dawns,https://www.hotsauce.com/heartbreaking-dawns-the-green-verde-hot-sauce/
"Hellfire Fear This! Reaper Hot Sauce, 5oz.",$16.00,$14.95,Hellfire Hot Sauce,https://www.hotsauce.com/hellfire-fear-this-reaper-hot-sauce/
"Hellfire Gourmet Red Hot Sauce, 5oz.",$9.00,$7.95,Hellfire Hot Sauce,https://www.hotsauce.com/hellfire-gourmet-red-hot-sauce/
"Hellfire Lucifer's Last Blast Hot Sauce, 5oz.",$17.00,$15.49,Hellfire Hot Sauce,https://www.hotsauce.com/Hellfire-Lucifers-Last-Blast-Hot-Sauce/
"Hemorrhoid Helper Burns Both Ways Hot Sauce, 5oz.",$7.50,$6.95,FireWorks,https://www.hotsauce.com/hemorrhoid-helper-burns-both-ways-hot-sauce/
"High River Sauces Cheeba Gold Barbados Style Scotch Bonnet Pepper Sauce, 5oz.",$7.50,$6.95,High River Sauces,https://www.hotsauce.com/high-river-sauces-cheeba-gold-barbados-style-scotch-bonnet-pepper-sauce/
"High River Sauces Green Manalishi Verde Hot Sauce, 5oz.",$8.00,$7.49,High River Sauces,https://www.hotsauce.com/High-River-Sauces-Green-Manalishi-Verde-Hot-Sauce/
"Howler Monkey Amarillo Hot Sauce, 5oz.",$6.50,$5.95,Howler Monkey,https://www.hotsauce.com/howler-monkey-amarillo-hot-sauce/
"Howler Monkey Verde Hot Sauce, 5oz.",$6.50,$5.95,Howler Monkey,https://www.hotsauce.com/howler-monkey-verde-hot-sauce/
"Lime Time Grilling Sauce, 12oz.",$8.00,$7.49,HotSauce,https://www.hotsauce.com/lime-time-grilling-sauce/
"Mad Cat Hot Sauce, Not For PussyCats!, 5oz.",$7.50,$6.95,FireWorks,https://www.hotsauce.com/mad-cat-hot-sauce-not-for-pussycats/
"Marie Sharp's Sweet Habanero Pepper Sauce, 5oz.",$5.50,$4.95,Marie Sharps,https://www.hotsauce.com/marie-sharps-sweet-habanero-pepper-sauce/
"Melinda's NEW Jalapeno Green Hot Sauce, 12oz.",$7.50,$6.95,Melinda's,https://www.hotsauce.com/Melindas-Jalapeno-Green-Hot-Sauce/
"Melinda's NEWEST Creamy Style Wing Sauces Gift Set, 4/12oz.",$30.00,$27.80,Melinda's,https://www.hotsauce.com/Melindas-Newest-Creamy-Style-Wing-Sauces-Gift-Set/
"Melinda's NEWEST Hot Sauces Gift Set, 5/12oz.",$37.50,$34.75,Melinda's,https://www.hotsauce.com/Melindas-Newest-Hot-Sauces-Gift-Set/
"Pain is Good Harissa Hot Sauce, 7oz.",$13.00,$10.49,Pain Is Good,https://www.hotsauce.com/Pain-Is-Good-Harissa-Hot-Sauce/
"Peach 'N Pepper Gourmet Salsa, 16oz.",$8.00,$7.49,HotSauce,https://www.hotsauce.com/peach-n-pepper-gourmet-salsa/
"Pittsburgh Sucks! Hot Sauce, 5oz.",$6.50,$5.95,HotSauce,https://www.hotsauce.com/pittsburgh-sucks-hot-sauce/
"Poots Peppa Sauce, The Cats Meow, 5oz.",$6.50,$5.95,FireWorks,https://www.hotsauce.com/poots-peppa-sauce-the-cats-meow/
"Primo's Peppers Primonition Hot Sauce, 5oz.",$11.00,$9.95,Primo's Peppers,https://www.hotsauce.com/Primos-Peppers-Primonition-Hot-Sauce/
"Rectal Rocket Fuel Island Jerk Hot Sauce, 5oz.",$7.00,$6.49,HotSauce,https://www.hotsauce.com/rectal-rocket-fuel-island-jerk-hot-sauce/
"Ring of Fire Asian Chile Marinade, 12.5oz.",$11.00,$9.95,Ring Of Fire,https://www.hotsauce.com/ring-of-fire-asian-chile-marinade/
"Salsa Stoopid, 16oz.",$11.00,$9.95,CaJohns,https://www.hotsauce.com/salsa-stoopid/
"Screaming Sphincter Habanero Salsa, 16oz.",$8.00,$7.49,Screaming Sphincter,https://www.hotsauce.com/screaming-sphincter-habanero-salsa/
"Spicy Shark Caribbean Reef Shark Scotch Bonnet Hot Sauce, 5oz.",$11.00,$9.95,Spicy Shark,https://www.hotsauce.com/Spicy-Shark-Caribbean-Reef-Shark-Scotch-Bonnet-Hot-Sauce/
"Spicy Shark Tiger Shark Ghost Pepper Hot Sauce, 5oz.",$11.00,$9.95,Spicy Shark,https://www.hotsauce.com/Spicy-Shark-Tiger-Shark-Ghost-Pepper-Hot-Sauce/
"Tahiti Joe's Maui Pepper Mangonesian Hot Sauce, 5oz.",$6.50,$5.95,Maui Pepper,https://www.hotsauce.com/tahiti-joes-maui-pepper-mangonesian-hot-sauce/
"Tahiti Joe's Onionator XXX Ghost Pepper Hot Sauce, 5oz.",$7.50,$6.95,Tahiti Joes,https://www.hotsauce.com/tahiti-joes-onionator-xxx-ghost-pepper-hot-sauce/
"Tears of Joy Texas Cactus Hot Sauce, 5oz.",$8.50,$7.49,HotSauce,https://www.hotsauce.com/tears-of-joy-texas-cactus-hot-sauce/
