name,priceNormal,priceWithoutax,branch,link
"Alice Cooper No More Mr. Nice Guy Medium Hot Sauce, 5oz.",$11.00,$10.00,Alice Cooper,https://www.hotsauce.com/Alice-Cooper-No-More-Mr-Nice-Guy-Medium-Hot-Sauce/
"Alice Cooper Welcome To My Nightmare Mild Hot Sauce, 5oz.",$9.00,$8.00,Alice Cooper,https://www.hotsauce.com/Alice-Cooper-Welcome-To-My-Nightmare-Mild-Hot-Sauce/
"Angry Goat Pepper Co. Black Bison Hot Sauce, 5oz.",$9.50,$8.95,Angry Goat,https://www.hotsauce.com/angry-goat-pepper-co-black-bison-hot-sauce/
"Angry Goat Pepper Co. Dark Swizzle Hot Sauce, 5oz.",$9.00,$8.49,Angry Goat,https://www.hotsauce.com/angry-goat-pepper-co-dark-swizzle-hot-sauce/
"Angry Goat Pepper Co. Dreams Of Calypso Hot Sauce, 5oz.",$9.00,$7.95,Angry Goat,https://www.hotsauce.com/Angry-Goat-Pepper-Co-Dreams-Of-Calypso-Hot-Sauce/
"Angry Goat Pepper Co. Hippy Dippy Green Hot Sauce, 5oz.",$9.00,$8.49,Angry Goat,https://www.hotsauce.com/angry-goat-pepper-co-hippy-dippy-green-hot-sauce/
"Angry Goat Pepper Co. Hot Cock Hot Sauce, 5oz.",$9.50,$8.95,Angry Goat,https://www.hotsauce.com/Angry-Goat-Pepper-Co-Hot-Cock-Hot-Sauce/
"Angry Goat Pepper Co. Purple Hippo Hot Sauce, 5oz.",$9.50,$8.95,Angry Goat,https://www.hotsauce.com/angry-goat-pepper-co-purple-hippo-hot-sauce/
"Angry Goat Pepper Co. Sacrifice Hot Sauce, 5oz.",$9.00,$8.49,Angry Goat,https://www.hotsauce.com/angry-goat-pepper-co-sacrifice-hot-sauce/
"Angry Goat Pepper Co. Sweaty Beaver Hot Sauce, 5oz.",$9.50,$8.95,Angry Goat,https://www.hotsauce.com/Angry-Goat-Pepper-Co-Sweaty-Beaver-Hot-Sauce/
"Angry Goat Pepper Co. Yellow Flamingo Hot Sauce, 5oz.",$9.00,$8.49,Angry Goat,https://www.hotsauce.com/angry-goat-pepper-co-yellow-flamingo-hot-sauce/
"Ass Kickin Hot Salt 9 Pack, 9/1.1oz.",$31.50,$26.95,Ass Kickin,https://www.hotsauce.com/ass-kickin-hot-salt-9-pack/
"Bravado Spice Co. Garlic and Arbol Moruga Scorpion Hot Sauce, 5oz.",$14.00,$12.49,Bravado Spice Co,https://www.hotsauce.com/Bravado-Spice-Co-Garlic-Arbol-Moruga-Scorpion-Hot-Sauce/
"Bravado Spice Co. Pineapple and Jalapeno Margarita Mix, 16oz.",$10.50,$8.95,Bravado Spice Co,https://www.hotsauce.com/Bravado-Spice-Co-Pineapple-And-Jalapeno-Margarita-Mix/
"Bumblefoot's The Sauce, 5oz.",$7.50,$6.49,Bumblefoot's,https://www.hotsauce.com/Bumblefoots-The-Sauce/
"Burns & McCoy Excubiarium Salsa Verde Hot Sauce, 5oz.",$13.50,$11.95,Burns & McCoy,https://www.hotsauce.com/Burns-McCoy-Excubiarium-Salsa-Verde-Hot-Sauce/
"Burns & McCoy Reaper Verde Hot Sauce, 5oz.",$10.00,$7.95,Burns & McCoy,https://www.hotsauce.com/Burns-McCoy-Verde-Hot-Sauce/
"CaJohn's Classic Small Batch Chile Lime Taco Sauce, 5oz.",$8.00,$7.49,CaJohns,https://www.hotsauce.com/cajohns-classic-small-batch-chile-lime-taco-sauce/
"CaJohn's Key Lime Select Salsa, 16oz.",$9.00,$7.95,CaJohns,https://www.hotsauce.com/Cajohns-Key-Lime-Select-Salsa/
"CaJohn's Memento Mori Hot Sauce, 5oz.",$15.00,$12.95,CaJohns,https://www.hotsauce.com/Cajohns-Memento-Mori-Hot-Sauce/
"Caribbean Condiment Pirates Blend Garbanero Sauce, 10oz.",$8.50,$7.95,Half Moon Bay,https://www.hotsauce.com/caribbean-condiment-pirates-blend-garbanero-sauce/
"Caribbean Condiment Pirates Blend Garlapeno Sauce, 10oz.",$8.50,$7.95,Half Moon Bay,https://www.hotsauce.com/caribbean-condiment-pirates-blend-garlapeno-sauce/
"Cutino Chipotle Hot Sauce, 4oz.",$12.00,$10.95,Cutino,https://www.hotsauce.com/Cutino-Chipotle-Hot-Sauce/
"Cutino Jalapeno Hot Sauce, 4oz.",$12.00,$10.95,Cutino,https://www.hotsauce.com/Cutino-Jalapeno-Hot-Sauce/
"Cutino Miso Hot Sauce, 4oz.",$12.00,$10.95,Cutino,https://www.hotsauce.com/Cutino-Miso-Hot-Sauce/
"Cutino Verde Hot Sauce, 4oz.",$12.00,$10.95,Cutino,https://www.hotsauce.com/Cutino-Verde-Hot-Sauce/
"Da Bomb Green Habanero Salsa Verde, 15.5oz.",$8.50,$7.95,Da Bomb,https://www.hotsauce.com/da-bomb-green-habanero-salsa-verde/
"Danny Cash's Garlic Serrano Salvation Sauce (w/mini bible), 5oz.",$8.50,$7.95,Danny Cash,https://www.hotsauce.com/danny-cashs-garlic-serrano-salvation-hot-sauce-mini-bible/
"Dave's Gourmet Creamy Ginger Citrus Hot Sauce, 8oz.",$9.50,$8.95,Daves Gourmet,https://www.hotsauce.com/daves-gourmet-creamy-ginger-citrus-hot-sauce/
"Dirty Dick's Peachy Green Hot Pepper Sauce, 5oz.",$8.50,$7.95,Dirty Dicks,https://www.hotsauce.com/dirty-dicks-peachy-green-hot-pepper-sauce/
"Heartbeat Blueberry Habanero Hot Sauce, 6oz.",$13.50,$11.95,Heartbeat Hot Sauces,https://www.hotsauce.com/Heartbeat-Blueberry-Habanero-Hot-Sauce/
"Heartbeat Hot Sauces 4 Pack, 4/6oz.",$54.00,$47.80,Heartbeat Hot Sauces,https://www.hotsauce.com/Heartbeat-Hot-Sauces-4-Pack/
"Heartbeat Jalapeno Hot Sauce, 6oz.",$13.50,$11.95,Heartbeat Hot Sauces,https://www.hotsauce.com/Heartbeat-Jalapeno-Hot-Sauce/
"Heartbeat Pineapple Habanero Hot Sauce, 6oz.",$13.50,$11.95,Heartbeat Hot Sauces,https://www.hotsauce.com/Heartbeat-Pineapple-Habanero-Hot-Sauce/
"Heartbeat Red Habanero Hot Sauce, 6oz.",$13.50,$11.95,Heartbeat Hot Sauces,https://www.hotsauce.com/Heartbeat-Red-Habanero-Hot-Sauce/
"Hellfire Fear This! Reaper Hot Sauce, 5oz.",$16.00,$14.95,Hellfire Hot Sauce,https://www.hotsauce.com/hellfire-fear-this-reaper-hot-sauce/
"Hellfire Firearrhea Hot Sauce, 5oz.",$17.00,$14.95,Hellfire Hot Sauce,https://www.hotsauce.com/Hellfire-Firearrhea-Hot-Sauce/
"Hellfire Gourmet Red Hot Sauce, 5oz.",$9.00,$7.95,Hellfire Hot Sauce,https://www.hotsauce.com/hellfire-gourmet-red-hot-sauce/
"Hellfire Hellboy Annung un Rama Hot Sauce, 5oz.",$13.00,$11.95,Hellfire Hot Sauce,https://www.hotsauce.com/Hellfire-Hellboy-Annung-Un-Rama-Hot-Sauce/
"Hellfire Hellboy Extreme Hot Sauce, 5oz.",$18.00,$16.95,Hellfire Hot Sauce,https://www.hotsauce.com/Hellfire-Hellboy-Extreme-Hot-Sauce/
"Hellfire Hellboy Legendary AF Hot Sauce, 5oz.",$17.00,$15.95,Hellfire Hot Sauce,https://www.hotsauce.com/Hellfire-Hellboy-Legendary-AF-Hot-Sauce/
"Hellfire Lucifer's Last Blast Hot Sauce, 5oz.",$17.00,$15.49,Hellfire Hot Sauce,https://www.hotsauce.com/Hellfire-Lucifers-Last-Blast-Hot-Sauce/
"Hellfire Pure Hell Hot Sauce, 5oz.",$11.00,$9.95,Hellfire Hot Sauce,https://www.hotsauce.com/hellfire-pure-hell-hot-sauce/
"High River Sauces Green Manalishi Verde Hot Sauce, 5oz.",$8.00,$7.49,High River Sauces,https://www.hotsauce.com/High-River-Sauces-Green-Manalishi-Verde-Hot-Sauce/
"High River Sauces Tears of the Sun Private Reserve Hot Sauce, 5oz.",$12.00,$9.95,High River Sauces,https://www.hotsauce.com/High-River-Sauces-Tears-Of-The-Sun-Private-Reserve-Hot-Sauce/
"Karma Sauce Ashes-2-Ashes Hot Sauce, 5oz.",$13.00,$11.95,Karma,https://www.hotsauce.com/karma-sauce-ashes-2-ashes-hot-sauce/
"Karma Sauce Funken Hot Yellow Moruga Edition Sauce, 5oz.",$11.00,$9.95,Karma,https://www.hotsauce.com/karma-sauce-funken-hot-sauce/
"Karma Sauce Red Habanero Cherry Bomb Hot Sauce, 5oz.",$9.50,$8.95,Karma,https://www.hotsauce.com/karma-sauce-cherry-bomb-hot-sauce/
"Karma Sauce The Goblin Hot Sauce, 5oz.",$10.50,$9.95,Karma,https://www.hotsauce.com/karma-sauce-the-goblin-hot-sauce/
"Marie Sharp's Original Garlic Habanero Pepper Sauce, 5oz.",$6.50,$5.95,Marie Sharps,https://www.hotsauce.com/Marie-Sharps-Original-Garlic-Habanero-Pepper-Sauce/
"Marie Sharp's Pure Love Pineapple Habanero Pepper Sauce, 5oz.",$7.00,$5.95,Marie Sharps,https://www.hotsauce.com/Marie-Sharps-Pure-Love-Pineapple-Habanero-Pepper-Sauce/
"Marie Sharp's Pure Mango Habanero Pepper Sauce, 5oz.",$7.00,$5.95,Marie Sharps,https://www.hotsauce.com/marie-sharps-pure-mango-habanero-pepper-sauce/
"Melinda's NEW Creamy Style Ghost Pepper Wing Sauce, 12oz.",$7.50,$6.95,Melinda's,https://www.hotsauce.com/Melindas-Creamy-Style-Ghost-Pepper-Wing-Sauce/
"Melinda's NEW Creamy Style Habanero Wing Sauce, 12oz.",$7.50,$6.95,Melinda's,https://www.hotsauce.com/Melindas-Creamy-Style-Habanero-Wing-Sauce/
"Melinda's NEW GHOST Pepper Steak Sauce, 12oz.",$7.50,$6.95,Melinda's,https://www.hotsauce.com/Melindas-New-Ghost-Pepper-Steak-Sauce/
"Melinda's NEW Jalapeno Green Hot Sauce, 12oz.",$7.50,$6.95,Melinda's,https://www.hotsauce.com/Melindas-Jalapeno-Green-Hot-Sauce/
"Melinda's NEWEST Creamy Style Wing Sauces Gift Set, 4/12oz.",$30.00,$27.80,Melinda's,https://www.hotsauce.com/Melindas-Newest-Creamy-Style-Wing-Sauces-Gift-Set/
"Melinda's NEWEST Hot Sauces Gift Set, 5/12oz.",$37.50,$34.75,Melinda's,https://www.hotsauce.com/Melindas-Newest-Hot-Sauces-Gift-Set/
"Pain Is Good Batch #114 Jamaican Style Hot Sauce, 7oz.",$13.00,$10.49,Pain Is Good,https://www.hotsauce.com/pain-is-good-batch-114-jamaican-style-hot-sauce/
"Pain Is Good Batch #218 Louisiana Style, 7oz.",$13.00,$10.49,Pain Is Good,https://www.hotsauce.com/pain-is-good-batch-218-louisiana-style-hot-sauce/
"Pain Is Good Batch #37 Garlic Style Hot Sauce, 7oz.",$13.00,$10.49,Pain Is Good,https://www.hotsauce.com/pain-is-good-batch-37-garlic-style-hot-sauce/
"Pain is Good Jalapeno Hot Sauce, 7oz.",$12.00,$10.49,Pain Is Good,https://www.hotsauce.com/most-wanted-pain-is-good-jalapeno-hot-sauce/
"Primo's Peppers Primonition Hot Sauce, 5oz.",$11.00,$9.95,Primo's Peppers,https://www.hotsauce.com/Primos-Peppers-Primonition-Hot-Sauce/
"Rising Smoke Buenos Nachos Hot Sauce, 5oz.",$9.50,$8.95,Rising Smoke SauceWorks,https://www.hotsauce.com/Rising-Smoke-Sauceworks-Buenos-Nachos-Hot-Sauce/
"Rising Smoke Fiesta Caliente Hot Sauce, 5oz.",$9.50,$8.95,Rising Smoke SauceWorks,https://www.hotsauce.com/Rising-Smoke-Sauceworks-Fiesta-Caliente-Hot-Sauce/
"Spicy Shark Caribbean Reef Shark Scotch Bonnet Hot Sauce, 5oz.",$11.00,$9.95,Spicy Shark,https://www.hotsauce.com/Spicy-Shark-Caribbean-Reef-Shark-Scotch-Bonnet-Hot-Sauce/
"Spicy Shark Tiger Shark Ghost Pepper Hot Sauce, 5oz.",$11.00,$9.95,Spicy Shark,https://www.hotsauce.com/Spicy-Shark-Tiger-Shark-Ghost-Pepper-Hot-Sauce/
"Tears of Joy Texas Cactus Hot Sauce, 5oz.",$8.50,$7.49,HotSauce,https://www.hotsauce.com/tears-of-joy-texas-cactus-hot-sauce/
"Torchbearer Garlic Carolina Reaper Hot Sauce, 5oz.",$18.00,$16.95,Torchbearer,https://www.hotsauce.com/Torchbearer-Garlic-Carolina-Reaper-Hot-Sauce/
"Torchbearer Oh My Garlic! Sauce, 12oz.",$8.00,$7.49,Torchbearer,https://www.hotsauce.com/Torchbearer-Oh-My-Garlic-Sauce/
"Veronica Grains Farmhouse Ale Serrano Hot Sauce, 5oz.",$7.50,$6.95,HotSauce,https://www.hotsauce.com/veronica-grains-serrano-hot-sauce/
