Name,Price,Price witout Tax,Brand,Link
"Angry Goat Pepper Co. Dreams Of Calypso Hot Sauce, 5oz.",$9.00,$7.95,Angry Goat,https://www.hotsauce.com/Angry-Goat-Pepper-Co-Dreams-Of-Calypso-Hot-Sauce/
"Angry Goat Pepper Co. Yellow Flamingo Hot Sauce, 5oz.",$9.00,$8.49,Angry Goat,https://www.hotsauce.com/angry-goat-pepper-co-yellow-flamingo-hot-sauce/
"Bee Sting Mango Passion Hot Sauce, 5oz.",$5.50,$4.95,Bee Sting,https://www.hotsauce.com/bee-sting-mango-passion-hot-sauce/
Blair's Q Heat Exotic Hot Sauce Gourmet Sampler 4 Pack / 2oz.,$17.00,$15.95,Blairs Sauces,https://www.hotsauce.com/blairs-q-heat-exotic-hot-sauce-gourmet-sampler-4-pack/
"Blair's Q Heat Habanero Mango Exotic Hot Sauce, 8.44oz.",$10.50,$9.95,Blairs Sauces,https://www.hotsauce.com/blairs-q-heat-habanero-mango-exotic-hot-sauce/
"Blair's Sweet Death Sauce with Mango, 5oz.",$9.50,$8.95,Blairs Sauces,https://www.hotsauce.com/blairs-sweet-death-with-mango-hot-sauce/
"Blowout Habanero Serious Hot Sauce, 5oz.",$6.50,$5.95,FireWorks,https://www.hotsauce.com/blowout-habanero-hot-sauce/
"Body Heat XXX Hot, 5oz.",$6.50,$5.95,FireWorks,https://www.hotsauce.com/body-heat-xxx-hot-sauce/
"Burns & McCoy Mango Habanero Hot Sauce, 5oz.",$10.00,$7.95,Burns & McCoy,https://www.hotsauce.com/Burns-McCoy-Mango-Habanero-Hot-Sauce/
"Burns & McCoy Smoked Habanero Roasted Garlic Hot Sauce, 5oz.",$10.00,$7.95,Burns & McCoy,https://www.hotsauce.com/Burns-McCoy-Smoked-Habanero-Roasted-Garlic-Hot-Sauce/
"CaJohn's Gourmet Mango Burst Salsa, 16oz.",$9.00,$7.95,CaJohns,https://www.hotsauce.com/cajohns-gourmet-mango-burst-salsa/
"CaJohn's Tiki Bar Mild Hot Sauce, 5oz.",$9.50,$8.95,CaJohns,https://www.hotsauce.com/cajohns-tiki-bar-mild-hot-sauce/
"CaJohn's Tiki Bar Torch Hot Sauce, 5oz.",$9.50,$8.95,CaJohns,https://www.hotsauce.com/cajohns-tiki-bar-torch-hot-sauce/
"CamelToe Chipotle Mango Hot Sauce, 5oz.",$6.50,$5.95,HotSauce,https://www.hotsauce.com/cameltoe-chipotle-mango-hot-sauce/
"Chef Fartenburn's Gourmet Hot Sauce, 5oz.",$5.50,$4.95,HotSauce,https://www.hotsauce.com/chef-fartenburns-gourmet-hot-sauce/
"Crazy Jerry's Brain Damage Mind Blowin Hot Sauce, 5oz.",$9.00,$7.95,Crazy Jerrys,https://www.hotsauce.com/crazy-jerrys-brain-damage-mind-blowin-hot-sauce/
"Da Bomb Ghost Pepper Hot Sauce, 4oz.",$19.50,$14.95,Da Bomb,https://www.hotsauce.com/da-bomb-ghost-pepper-hot-sauce/
"Danny Cash's Salvation Mango Pineapple Hot Sauce, 5oz.",$8.50,$7.95,Danny Cash,https://www.hotsauce.com/danny-cashs-salvation-mango-pineapple-hot-sauce/
"Dat'l Do It Devil Drops, 5oz.",$6.50,$5.95,Datl Do It,https://www.hotsauce.com/datl-do-it-devil-drops/
"Dirty Dick's Hot Pepper Sauce With a Tropical Twist, 5oz.",$8.50,$7.49,Dirty Dicks,https://www.hotsauce.com/dirty-dicks-hot-pepper-sauce-with-tropical-twist/
"Fire Ant Juice Gourmet Hot Sauce, 5oz.",$6.50,$5.95,HotSauce,https://www.hotsauce.com/fire-ant-juice-gourmet-hot-sauce/
"Heartbreaking Dawns Jalapeno Pineapple Hot Sauce, 5oz.",$6.50,$5.95,Heartbreaking Dawns,https://www.hotsauce.com/heartbreaking-dawns-jalapeno-pineapple-hot-sauce/
"Heartbreaking Dawns Mango Habanero Hot Sauce, 5oz.",$6.50,$5.95,Heartbreaking Dawns,https://www.hotsauce.com/heartbreaking-dawns-mango-habanero-hot-sauce/
"Hellfire Chilimasters Reserve Hot Sauce, 6.8oz.",$10.00,$8.95,Hellfire Hot Sauce,https://www.hotsauce.com/hellfire-chilimasters-reserve-hot-sauce/
"Hellfire Ritual Habitual Hot Sauce, 5oz.",$10.00,$8.95,Hellfire Hot Sauce,https://www.hotsauce.com/Hellfire-Ritual-Habitual-Hot-Sauce/
"Hellfire Ritual Hot Sauce, 5oz.",$12.00,$10.49,Hellfire Hot Sauce,https://www.hotsauce.com/Hellfire-Ritual-Hot-Sauce/
"Hellfire The Elixir Hot Sauce, 6.8oz.",$11.00,$9.95,Hellfire Hot Sauce,https://www.hotsauce.com/hellfire-the-elixir-hot-sauce/
"High River Sauces Tears of the Sun Hot Sauce, 5.4oz.",$7.50,$6.95,High River Sauces,https://www.hotsauce.com/high-river-sauces-tears-of-the-sun-hot-sauce/
"High River Sauces Tears of the Sun Private Reserve Hot Sauce, 5oz.",$12.00,$9.95,High River Sauces,https://www.hotsauce.com/High-River-Sauces-Tears-Of-The-Sun-Private-Reserve-Hot-Sauce/
"Iguana Tropic Thunder Red Jalapeno & Habanero Tropical Pepper, 5oz.",$6.50,$5.95,Iguana Sauces,https://www.hotsauce.com/iguana-tropic-thunder-red-jalapeno-habanero-tropical-pepper-sauce/
"Karma Sauce Curry Karma Hot Sauce, 5oz.",$8.50,$7.95,Karma,https://www.hotsauce.com/karma-sauce-curry-karma-hot-sauce/
"Karma Sauce Ghost Island Hot Sauce, 5oz.",$11.00,$9.95,Karma,https://www.hotsauce.com/karma-sauce-ghost-island-hot-sauce/
"Marie Sharp's Exotic Steak Hot Sauce, 11.5oz.",$8.00,$6.95,Marie Sharps,https://www.hotsauce.com/marie-sharps-exotic-hot-sauce/
"Marie Sharp's Pure Mango Habanero Pepper Sauce, 5oz.",$7.00,$5.95,Marie Sharps,https://www.hotsauce.com/marie-sharps-pure-mango-habanero-pepper-sauce/
"Melinda's Mango Habanero Sauce, 5oz.",$6.50,$5.95,Melinda's,https://www.hotsauce.com/melindas-mango-habanero-sauce/
"Melinda's NEW GHOST Pepper Steak Sauce, 12oz.",$7.50,$6.95,Melinda's,https://www.hotsauce.com/Melindas-New-Ghost-Pepper-Steak-Sauce/
"Pappy's Chicks Dig Me Mango Chipotle Grilling Sauce, 12.7oz.",$7.50,$6.95,Pappy's BBQ,https://www.hotsauce.com/chicks-dig-me-mango-chipotle-grilling-sauce/
"Pickapeppa Brown Hot Sauce, 5oz.",$6.50,$5.95,Pickapeppa,https://www.hotsauce.com/pickapeppa-brown-hot-sauce/
"Pickapeppa Gingery Mango Hot Sauce, 5oz.",$6.00,$5.49,Pickapeppa,https://www.hotsauce.com/pickapeppa-gingery-mango-hot-sauce/
"Pickapeppa Hot Mango Sauce, 5oz.",$6.00,$5.49,Pickapeppa,https://www.hotsauce.com/pickapeppa-hot-mango-sauce/
"Pickapeppa Spicy Mango Hot Sauce, 5oz.",$6.00,$5.49,Pickapeppa,https://www.hotsauce.com/pickapeppa-spicy-mango-hot-sauce/
"Rincon Heat Mango Chipotle Hot Sauce, 5oz.",$7.00,$6.49,HotSauce,https://www.hotsauce.com/rincon-heat-mango-chipotle-hot-sauce/
"Spicy Shark Tiger Shark Ghost Pepper Hot Sauce, 5oz.",$11.00,$9.95,Spicy Shark,https://www.hotsauce.com/Spicy-Shark-Tiger-Shark-Ghost-Pepper-Hot-Sauce/
"TABASCO® Cayenne Garlic Pepper Sauce, 5oz.",$7.50,$5.95,Tabasco,https://www.hotsauce.com/tabasco-garlic-pepper-sauce/
"TABASCO® Habanero Sauce, 5oz.",$10.00,$7.95,Tabasco,https://www.hotsauce.com/tabasco-habanero-pepper-sauce/
"Tahiti Joe's Maui Pepper Apples Ass Hot Sauce, 5oz.",$6.50,$5.95,Maui Pepper,https://www.hotsauce.com/tahiti-joes-maui-pepper-apples-ass-hot-sauce/
"Tahiti Joe's Maui Pepper Chipotle Raspberry Mango Hot Sauce, 5oz.",$6.50,$5.95,Maui Pepper,https://www.hotsauce.com/tahiti-joes-maui-pepper-chipotle-raspberry-mango-hot-sauce/
"Tahiti Joe's Maui Pepper Mango Meltdown Medium Heat, 5oz.",$6.50,$5.95,Maui Pepper,https://www.hotsauce.com/tahiti-joes-maui-pepper-mango-meltdown-medium-heat/
"Tahiti Joe's Maui Pepper Mango Meltdown X-Treme Heat, 5oz.",$6.50,$5.95,Maui Pepper,https://www.hotsauce.com/tahiti-joes-maui-pepper-mango-meltdown-x-treme-heat/
"Tahiti Joe's Maui Pepper Mangonesian Hot Sauce, 5oz.",$6.50,$5.95,Maui Pepper,https://www.hotsauce.com/tahiti-joes-maui-pepper-mangonesian-hot-sauce/
"Tahiti Joe's Maui Pepper Sunset Salsa Pineapple - Hot, 12oz.",$6.50,$5.95,Maui Pepper,https://www.hotsauce.com/tahiti-joes-maui-pepper-hot-sunset-pineapple-salsa/
"Tahiti Joe's Maui Pepper Sunset Salsa Pineapple - Medium, 12oz.",$6.50,$5.95,Maui Pepper,https://www.hotsauce.com/tahiti-joes-maui-pepper-medium-sunset-pineapple-salsa/
"The Cheech Mojo Mango Habanero Hot Sauce, 5oz.",$6.50,$5.95,Cheech Sauces,https://www.hotsauce.com/the-cheech-mojo-mango-habanero-hot-sauce/
"Tiki Bar Hotter Hot Sauce, 5oz.",$8.00,$7.49,CaJohns,https://www.hotsauce.com/tiki-bar-hotter-hot-sauce/
