Name,Price,Price witout Tax,Brand,Link
"Busha Browne's Spicy Jerk Sauce, 5oz.",$7.50,$6.95,Busha Brownes,https://www.hotsauce.com/busha-brownes-spicy-jerk-sauce/
"Busha Browne's Traditional Jerk Seasoning Rub, 4oz.",$6.50,$5.95,Busha Brownes,https://www.hotsauce.com/busha-brownes-traditional-jerk-seasoning-rub/
"Dirty Dick's Peachy Green Hot Pepper Sauce, 5oz.",$8.50,$7.95,Dirty Dicks,https://www.hotsauce.com/dirty-dicks-peachy-green-hot-pepper-sauce/
"Spicy Shark Caribbean Reef Shark Scotch Bonnet Hot Sauce, 5oz.",$11.00,$9.95,Spicy Shark,https://www.hotsauce.com/Spicy-Shark-Caribbean-Reef-Shark-Scotch-Bonnet-Hot-Sauce/
"WalkersWood Jamaican Jerk Seasoning, 9.25lb.",$79.00,$64.95,WalkersWood,https://www.hotsauce.com/walkerswood-jamaican-jerk-seasoning/
"WalkersWood Las'Lick Jerk Sauce, 6oz.",$5.50,$4.95,WalkersWood,https://www.hotsauce.com/walkerswood-laslick-jerk-sauce/
"WalkersWood Mild Jerk Seasoning, 10oz.",$7.50,$6.95,WalkersWood,https://www.hotsauce.com/walkerswood-mild-jerk-seasoning/
"WalkersWood One Stop Savory Sauce, 6oz.",$4.50,$3.95,WalkersWood,https://www.hotsauce.com/walkerswood-one-stop-savory-sauce/
"WalkersWood Spicy Jamaican Jerk Barbecue Sauce, 17oz.",$11.00,$9.95,WalkersWood,https://www.hotsauce.com/walkerswood-spicy-jamaican-jerk-barbecue-sauce/
