name,priceNormal,priceWithoutax,branch,link
"Arizona Gunslinger Chipotle Pepper Salsa, 16oz.",$7.50,$6.95,Arizona Gunslinger,https://www.hotsauce.com/Arizona-Gunslinger-Chipotle-Pepper-Salsa/
"Arizona Gunslinger Roasted Garlic Salsa, 16oz.",$7.50,$6.95,Arizona Gunslinger,https://www.hotsauce.com/Arizona-Gunslinger-Roasted-Garlic-Salsa/
"Bone Suckin Garlic & Honey Wing Sauce, 12.25oz.",$8.00,$7.49,Bone Suckin BBQ,https://www.hotsauce.com/bone-suckin-garlic-honey-wing-sauce/
"Bone Suckin Hiccuppin Hot Habanero Hot Sauce, 5oz.",$7.50,$6.95,Bone Suckin BBQ,https://www.hotsauce.com/bone-suckin-habanero-sauce-hiccuppin-hot/
"Bone Suckin Honey & Habanero Wing Sauce, 12.25oz.",$7.50,$6.95,Bone Suckin BBQ,https://www.hotsauce.com/bone-suckin-honey-habanero-wing-sauce/
"Bone Suckin HOT Barbecue Sauce, 16oz.",$8.00,$7.49,Bone Suckin BBQ,https://www.hotsauce.com/bone-suckin-bbq-sauce-hot/
"Bone Suckin HOT Thicker Style Barbecue Sauce, 16oz.",$8.00,$7.49,Bone Suckin BBQ,https://www.hotsauce.com/bone-suckin-hot-and-thick-barbecue-sauce/
"Bone Suckin Original Barbecue Sauce, 16oz.",$8.00,$7.49,Bone Suckin BBQ,https://www.hotsauce.com/bone-suckin-bbq-sauce-original/
"Bone Suckin Thicker Style Barbecue Sauce, 16oz.",$8.00,$7.49,Bone Suckin BBQ,https://www.hotsauce.com/bone-suckin-thick-barbecue-sauce/
"Bourbon Q Barbecue Rub for Sissies, 16oz.",$15.50,$13.95,Kentucky Bourbon Q,https://www.hotsauce.com/Bourbon-Q-Barbecue-Rub-For-Sissies/
"Bourbon Q Distiller's Choice BBQ Sauce, 12.7oz.",$8.50,$7.95,Kentucky Bourbon Q,https://www.hotsauce.com/BourbonQ-Distillers-Choice-BBQ-Sauce/
"Bourbon Q Hottest Ride In Town Barbecue Rub, 16oz",$15.50,$13.95,Kentucky Bourbon Q,https://www.hotsauce.com/Bourbon-Q-Hottest-Ride-In-Town-Barbecue-Rub/
"Bourbon Q Moonshine Madness Barbecue Rub, 16oz",$15.50,$13.95,Kentucky Bourbon Q,https://www.hotsauce.com/Bourbon-Q-Moonshine-Madness-Barbecue-Rub/
"Bumblefoot's Bumblicious! Hot Sauce, 5oz.",$7.50,$6.95,Bumblefoot's,https://www.hotsauce.com/Bumblefoots-Bumblicious-Hot-Sauce/
"CaJohn's (Special Edition) Barrel Aged Bourbon Vanilla Cayenne Chipotle Apple Pie Sauce, 12.7oz.",$30.00,$24.95,CaJohns,https://www.hotsauce.com/Cajohns-Barrel-Aged-Bourbon-Vanilla-Cayenne-Chipotle-Apple-Pie-Sauce/
"CaJohn's Apple Smoked Spiced Rum Ancho Barbeque Sauce, 16oz.",$8.50,$7.95,CaJohns,https://www.hotsauce.com/cajohns-apple-smoked-spiced-rum-ancho-barbeque-sauce/
"CaJohn's Applewood Smoked Bourbon Chipotle Barbecue Sauce, 16oz.",$8.50,$7.95,CaJohns,https://www.hotsauce.com/cajohns-applewood-smoked-bourbon-chipotle-barbecue-sauce/
"CaJohn's Black Cherry Bourbon Barbecue Sauce, 16oz.",$9.00,$7.95,CaJohns,https://www.hotsauce.com/cajohns-black-cherry-bourbon-barbecue-sauce/
"CaJohn's Black Cherry Vanilla Hot Sauce, 5oz.",$10.00,$8.49,CaJohns,https://www.hotsauce.com/cajohns-black-cherry-vanilla-hot-sauce/
"CaJohn's Bourbon Infused Hot Sauce, 5oz.",$9.00,$8.49,CaJohns,https://www.hotsauce.com/cajohns-bourbon-infused-hot-sauce/
"CaJohn's Bourbon Street Fiery BBQ Sauce, 16oz.",$9.00,$7.95,CaJohns,https://www.hotsauce.com/Cajohns-Bourbon-Street-Fiery-BBQ-Sauce/
"CaJohn's Bourbon Street Smoky BBQ Sauce, 16oz.",$9.00,$7.95,CaJohns,https://www.hotsauce.com/Cajohns-Bourbon-Street-Smoky-BBQ-Sauce/
"CaJohn's Bourbon Street Spicy BBQ Sauce, 16oz.",$9.00,$8.49,CaJohns,https://www.hotsauce.com/Cajohns-Bourbon-Street-Spicy-BBQ-Sauce/
"CaJohn's Fiery BBQ Sauce, 16oz.",$9.00,$7.95,CaJohns,https://www.hotsauce.com/Cajohns-Fiery-Bbq-Sauce/
"CaJohn's Irish Scream BBQ Sauce, 16oz.",$8.50,$7.95,CaJohns,https://www.hotsauce.com/cajohns-irish-scream-bbq-sauce/
"CaJohn's Mesquite Smoked Raspberry Vodka New-Mex Barbeque Sauce, 16oz.",$8.50,$7.95,CaJohns,https://www.hotsauce.com/cajohns-mesquite-smoked-raspberry-vodka-new-mex-barbeque-sauce/
"CaJohn's Mesquite Smoked Tequila Lime Chile Barbeque Sauce, 16oz.",$8.50,$7.95,CaJohns,https://www.hotsauce.com/cajohns-mesquite-smoked-tequila-lime-chile-barbeque-sauce/
"CaJohn's Spicy BBQ Sauce, 16oz.",$9.00,$7.95,CaJohns,https://www.hotsauce.com/Cajohns-Spicy-Bbq-Sauce/
"CaJohn's The Reaper BBQ Sauce, 16oz.",$10.50,$9.95,CaJohns,https://www.hotsauce.com/cajohns-the-reaper-bbq-sauce/
"CaJohn's Trinidad Scorpion BBQ Sauce, 16oz.",$10.50,$9.49,CaJohns,https://www.hotsauce.com/cajohns-trinidad-scorpion-bbq-sauce/
"Fighting Cock Kentucky Bourbon BBQ Sauce, 12.7oz.",$7.50,$6.95,Pappy's BBQ,https://www.hotsauce.com/fighting-cock-kentucky-bourbon-bbq-sauce/
"Historic Lynchburg Tennessee Whiskey BBQ Seasoning & Rub, 5oz.",$8.50,$7.95,Tennessee Whiskey,https://www.hotsauce.com/historic-lynchburg-tennessee-whiskey-bbq-seasoning-rub/
"Iguana Smoky Chipotle Mini Pepper Sauce, 2oz.",$3.00,$2.49,Iguana Sauces,https://www.hotsauce.com/iguana-smoky-chipotle-mini-pepper-sauce/
"Iguana Smoky Jalapeno Chipotle Salsa, 16oz.",$9.00,$8.49,Iguana Sauces,https://www.hotsauce.com/iguana-smoky-jalapeno-chipotle-salsa/
"Iguana Tropic Thunder Red Jalapeno & Habanero Tropical Pepper, 5oz.",$6.50,$5.95,Iguana Sauces,https://www.hotsauce.com/iguana-tropic-thunder-red-jalapeno-habanero-tropical-pepper-sauce/
"Ingleby Farms Mesquite BBQ Pepper Sauce, 11.5oz.",$7.50,$6.95,HotSauce,https://www.hotsauce.com/ingleby-farms-mesquite-bbq-pepper-sauce/
"Kentucky Straight Bacon Bourbon Barbecue Sauce, 14.5oz.",$7.50,$6.95,Kentucky Straight,https://www.hotsauce.com/kentucky-straight-bacon-bourbon-barbecue-sauce/
"Kentucky Straight Bourbon Barbecue Sauce, 15oz.",$7.50,$6.95,Kentucky Straight,https://www.hotsauce.com/kentucky-straight-bourbon-barbecue-sauce/
"Mary's Gourmet Cherry Rub, 6.5oz.",$9.50,$8.95,Pork Rubbers,https://www.hotsauce.com/marys-gourmet-cherry-rub/
"Naga Jolokia 10 BBQ Sauce, 16oz.",$11.00,$9.95,CaJohns,https://www.hotsauce.com/naga-jolokia-10-bbq-sauce/
"Pain Is Good Batch #218 Louisiana Style, 7oz.",$13.00,$10.49,Pain Is Good,https://www.hotsauce.com/pain-is-good-batch-218-louisiana-style-hot-sauce/
"Pain is Good Chipotle Hot Sauce, 7oz.",$12.00,$10.49,Pain Is Good,https://www.hotsauce.com/most-wanted-pain-is-good-chipotle-hot-sauce/
"Pain Is Good Ghost Pepper Spicy Virginia Peanuts, 9oz.",$10.00,$8.95,Pain Is Good,https://www.hotsauce.com/Pain_Is_Good_Ghost_Pepper_Spicy_Virginia_Peanuts/
"Pappy's Not made In China BBQ and Dipping Sauce, 12.7oz.",$7.50,$6.95,Pappy's BBQ,https://www.hotsauce.com/not-made-in-china-bbq-and-dipping-sauce/
"Red Ghost Honey BBQ Ghost Wing Sauce, 12oz.",$7.50,$6.95,HotSauce,https://www.hotsauce.com/red-ghost-honey-bbq-ghost-wing-sauce/
"Spicy Shark Thresher Shark Chipotle Hot Sauce, 5oz.",$11.00,$9.95,Spicy Shark,https://www.hotsauce.com/Spicy-Shark-Thresher-Shark-Chipotle-Hot-Sauce/
"Stubb's Bar-B-Q Spice Rub, 4.62oz.",$9.50,$7.95,Stubbs,https://www.hotsauce.com/stubbs-bbq-spice-rub/
"Stubb's Beef Spice Rub, 2oz.",$6.50,$5.95,Stubbs,https://www.hotsauce.com/stubbs-beef-spice-rub/
"Stubb's Chicken Spice Rub, 5.04oz.",$6.50,$5.95,Stubbs,https://www.hotsauce.com/stubbs-chicken-spice-rub/
"Stubb's Dr. Pepper Anytime Sauce, 12oz.",$7.00,$6.49,Stubbs,https://www.hotsauce.com/stubbs-dr-pepper-anytime-sauce/
"Stubb's Dr. Pepper Legendary Bar-B-Q Sauce, 18oz.",$7.00,$6.49,Stubbs,https://www.hotsauce.com/stubbs-dr-pepper-bbq-sauce/
"Stubb's Hickory Bourbon Legendary Bar-B-Q Sauce, 18oz.",$6.50,$5.95,Stubbs,https://www.hotsauce.com/stubbs-hickory-bourbon-bbq-sauce/
"Stubb's Hickory Liquid Smoke, 5oz.",$3.50,$2.95,Stubbs,https://www.hotsauce.com/stubbs-hickory-liquid-smoke/
"Stubb's Mesquite Liquid Smoke, 5oz.",$4.50,$3.95,Stubbs,https://www.hotsauce.com/stubbs-mesquite-liquid-smoke/
"Stubb's Original Legendary Bar-B-Q Sauce, 18oz.",$6.50,$5.95,Stubbs,https://www.hotsauce.com/stubbs-original-bbq-sauce/
"Stubb's Pork Marinade, 12oz.",$6.50,$5.95,Stubbs,https://www.hotsauce.com/stubbs-pork-marinade/
"Stubb's Smokey Mesquite Legendary Bar-B-Q Sauce, 18oz.",$6.50,$5.95,Stubbs,https://www.hotsauce.com/stubbs-smokey-mesquite-bbq-sauce/
"Stubb's Spicy Legendary Bar-B-Q Sauce, 18oz.",$6.50,$5.95,Stubbs,https://www.hotsauce.com/stubbs-spicy-bbq-sauce/
"SuckleBusters Chipotle BBQ, 12oz.",$9.00,$7.95,SuckleBusters,https://www.hotsauce.com/sucklebusters-chipotle-bbq/
"SuckleBusters Original BBQ, 12oz.",$7.50,$6.95,SuckleBusters,https://www.hotsauce.com/sucklebusters-original-bbq/
"SuckleBusters Sweet Texas Pecan BBQ Rub, 14.5oz.",$13.00,$10.95,SuckleBusters,https://www.hotsauce.com/sucklebusters-sweet-texas-pecan-bbq-rub/
"Sucklebusters Texas Hickory BBQ Rub, 13oz.",$12.00,$10.95,SuckleBusters,https://www.hotsauce.com/sucklebusters-texas-hickory-bbq-rub/
"Sucklebusters Texas Mesquite BBQ Rub, 13oz.",$12.00,$10.95,SuckleBusters,https://www.hotsauce.com/sucklebusters-texas-mesquite-bbq-rub/
"The Cheech Smokin' Chipotle Hot Sauce, 5oz.",$6.50,$5.95,Cheech Sauces,https://www.hotsauce.com/the-cheech-smokin-chipotle-hot-sauce/
