Name,Price,Price witout Tax,Brand,Link
"17th Street Barbecue Sauce Hog Warsh, 18oz.",$8.00,$7.49,17th Street Barbecue,https://www.hotsauce.com/17th-Street-Barbecue-Sauce-Hog-Warsh/
"17th Street Barbecue Sauce Little Kick, 18oz.",$8.00,$7.49,17th Street Barbecue,https://www.hotsauce.com/17th-Street-Barbecue-Sauce-Little-Kick/
"17th Street Barbecue Sauce Mike's Original, 18oz.",$8.00,$7.49,17th Street Barbecue,https://www.hotsauce.com/17th-Street-Barbecue-Sauce-Mikes-Original/
"American Style BBQ Beef Barbecue Sauce, 19oz.",$8.00,$7.49,American Style BBQ,https://www.hotsauce.com/american-style-bbq-beef-barbecue-sauce/
"American Style BBQ Chicken Barbecue Sauce, 19oz.",$8.00,$7.49,American Style BBQ,https://www.hotsauce.com/american-style-bbq-chicken-barbecue-sauce/
"Anal Angst X-Hot Hot Sauce, 5.7oz.",$8.50,$7.95,Professor Payne,https://www.hotsauce.com/Anal-Angst-X-Hot-Hot-Sauce/
"Analize This XXX Garlic Hot Sauce, 5oz.",$6.50,$5.95,Tahiti Joes,https://www.hotsauce.com/analize-this-xxx-garlic-hot-sauce/
"Biker Bitch Hot n Wild Hot Sauce, 5oz.",$6.50,$5.95,Tahiti Joes,https://www.hotsauce.com/biker-bitch-hot-n-wild-hot-sauce/
"Blind Betty's Original Recipe Hot Sauce, 5oz.",$7.00,$6.49,Blind Bettys,https://www.hotsauce.com/blind-bettys-original-recipe-hot-sauce/
"Bourbon Q Barrel Select Kentucky Bourbon Grilling Sauce, 12.7oz.",$8.50,$7.95,Kentucky Bourbon Q,https://www.hotsauce.com/Bourbon-Q-Barrel-Select-Kentucky-Bourbon-Grilling-Sauce/
"Bourbon Q Classic Kentucky Bourbon BBQ Sauce, 12.7oz.",$8.50,$7.95,Kentucky Bourbon Q,https://www.hotsauce.com/Kentucky-Bourbon-BBQ-Sauce/
"Bourbon Q Distiller's Choice BBQ Sauce, 12.7oz.",$8.50,$7.95,Kentucky Bourbon Q,https://www.hotsauce.com/BourbonQ-Distillers-Choice-BBQ-Sauce/
"Bourbon Q Kentucky Bourbon BBQ Sauce Gift Pack, 3/12.7oz.",$23.00,$19.95,Kentucky Bourbon Q,https://www.hotsauce.com/Bourbon-Q-Kentucky-Bourbon-BBQ-Sauce-Gift-Pack/
"Buttplug Relief Extra Hot Sauce, 5oz.",$6.50,$5.95,Tahiti Joes,https://www.hotsauce.com/buttplug-relief-extra-hot-sauce/
"CaJohn's Apple Smoked Spiced Rum Ancho Barbeque Sauce, 16oz.",$8.50,$7.95,CaJohns,https://www.hotsauce.com/cajohns-apple-smoked-spiced-rum-ancho-barbeque-sauce/
"CaJohn's Applewood Smoked Bourbon Chipotle Barbecue Sauce, 16oz.",$8.50,$7.95,CaJohns,https://www.hotsauce.com/cajohns-applewood-smoked-bourbon-chipotle-barbecue-sauce/
"CaJohn's Black Cherry Bourbon Barbecue Sauce, 16oz.",$9.00,$7.95,CaJohns,https://www.hotsauce.com/cajohns-black-cherry-bourbon-barbecue-sauce/
"CaJohn's Bourbon Street Fiery BBQ Sauce, 16oz.",$9.00,$7.95,CaJohns,https://www.hotsauce.com/Cajohns-Bourbon-Street-Fiery-BBQ-Sauce/
"CaJohn's Bourbon Street Smoky BBQ Sauce, 16oz.",$9.00,$7.95,CaJohns,https://www.hotsauce.com/Cajohns-Bourbon-Street-Smoky-BBQ-Sauce/
"CaJohn's Bourbon Street Spicy BBQ Sauce, 16oz.",$9.00,$8.49,CaJohns,https://www.hotsauce.com/Cajohns-Bourbon-Street-Spicy-BBQ-Sauce/
"CaJohn's Fiery BBQ Sauce, 16oz.",$9.00,$7.95,CaJohns,https://www.hotsauce.com/Cajohns-Fiery-Bbq-Sauce/
"CaJohn's Irish Scream BBQ Sauce, 16oz.",$8.50,$7.95,CaJohns,https://www.hotsauce.com/cajohns-irish-scream-bbq-sauce/
"CaJohn's Mesquite Smoked Raspberry Vodka New-Mex Barbeque Sauce, 16oz.",$8.50,$7.95,CaJohns,https://www.hotsauce.com/cajohns-mesquite-smoked-raspberry-vodka-new-mex-barbeque-sauce/
"CaJohn's Mesquite Smoked Tequila Lime Chile Barbeque Sauce, 16oz.",$8.50,$7.95,CaJohns,https://www.hotsauce.com/cajohns-mesquite-smoked-tequila-lime-chile-barbeque-sauce/
"CaJohn's Smoky BBQ Sauce, 16oz.",$9.00,$7.95,CaJohns,https://www.hotsauce.com/Cajohns-Smoky-Bbq-Sauce/
"CaJohn's Spicy BBQ Sauce, 16oz.",$9.00,$7.95,CaJohns,https://www.hotsauce.com/Cajohns-Spicy-Bbq-Sauce/
"CaJohn's The Reaper BBQ Sauce, 16oz.",$10.50,$9.95,CaJohns,https://www.hotsauce.com/cajohns-the-reaper-bbq-sauce/
"CaJohn's Trinidad Scorpion BBQ Sauce, 16oz.",$10.50,$9.49,CaJohns,https://www.hotsauce.com/cajohns-trinidad-scorpion-bbq-sauce/
"CamelToe Chipotle Mango Hot Sauce, 5oz.",$6.50,$5.95,HotSauce,https://www.hotsauce.com/cameltoe-chipotle-mango-hot-sauce/
"Gator Hammock Gator Que, 10oz.",$7.50,$6.95,Gator Hammock,https://www.hotsauce.com/gator-hammock-gator-que/
"High River Sauces Rattler BBQ Sauce, 12oz.",$8.00,$7.49,High River Sauces,https://www.hotsauce.com/high-river-sauces-rattler-bbq-sauce/
"Historic Lynchburg Tennessee Whiskey Apple Cinnamon BBQ, 16oz",$8.50,$7.95,Tennessee Whiskey,https://www.hotsauce.com/historic-lynchburg-tennessee-whiskey-apple-cinnamon-bbq/
"Historic Lynchburg Tennessee Whiskey Balsamic BBQ Sauce & Glaze, 16oz.",$8.50,$7.95,Tennessee Whiskey,https://www.hotsauce.com/historic-lynchburg-tennessee-whiskey-balsamic-bbq-sauce-glaze/
"Historic Lynchburg Tennessee Whiskey Hickory Smoked BBQ Sauce, 16oz.",$8.50,$7.95,Tennessee Whiskey,https://www.hotsauce.com/historic-lynchburg-tennessee-whiskey-hickory-smoked-bbq-sauce/
"Historic Lynchburg Tennessee Whiskey Jack Daniel's 100 Proof Hot & Spicy BBQ, 16oz.",$8.50,$7.95,Tennessee Whiskey,https://www.hotsauce.com/historic-lynchburg-tennessee-whiskey-jack-daniels-100-proof-hot-spicy-bbq/
"Historic Lynchburg Tennessee Whiskey Jack Daniel's 151 Proof BBQ, 16oz.",$8.50,$7.95,Tennessee Whiskey,https://www.hotsauce.com/historic-lynchburg-tennessee-whiskey-jack-daniels-151-proof-bbq/
"Historic Lynchburg Tennessee Whiskey Jack Daniel's 86 Proof Sweet N Mild BBQ, 16oz.",$8.50,$7.95,Tennessee Whiskey,https://www.hotsauce.com/historic-lynchburg-tennessee-whiskey-jack-daniels-86-proof-sweet-mild-bbq/
"Historic Lynchburg Tennessee Whiskey Jack in the Bean Sauce, 16oz.",$8.50,$7.95,Tennessee Whiskey,https://www.hotsauce.com/historic-lynchburg-tennessee-whiskey-jack-in-the-bean-sauce/
"Historic Lynchburg Tennessee Whiskey Jalapeno Seafood Cocktail Sauce, 15oz.",$7.50,$6.95,Tennessee Whiskey,https://www.hotsauce.com/historic-lynchburg-tennessee-whiskey-jalapeno-seafood-cocktail-sauce/
"Historic Lynchburg Tennessee Whiskey Spiced Curry Ketchup, 15oz.",$7.50,$6.95,Tennessee Whiskey,https://www.hotsauce.com/historic-lynchburg-tennessee-whiskey-spiced-curry-ketchup/
"Historic Lynchburg Tennessee Whiskey Swineapple Rib Glaze and Dippin' Sauce, 16oz.",$8.50,$7.95,Tennessee Whiskey,https://www.hotsauce.com/historic-lynchburg-tennessee-whiskey-swineapple-rib-glaze-and-dippin-sauce/
"Historic Lynchburg Tennessee Whiskey, Diabetic Friendly, Hot Gourmet Deli and Grillin Sauce, 16oz.",$7.50,$6.95,Tennessee Whiskey,https://www.hotsauce.com/historic-lynchburg-tennessee-whiskey-diabetic-friendly-hot-gourmet-deli-grillin-sauce/
"Historic Lynchburg Tennessee Whiskey, Diabetic Friendly, Mild Gourmet Deli & Grillin Sauce, 16oz.",$7.50,$6.95,Tennessee Whiskey,https://www.hotsauce.com/historic-lynchburg-tennessee-whiskey-diabetic-friendly-mild-gourmet-deli-grillin-sauce/
"Hog's Breath Key West Extra Hot Sauce, 5oz.",$7.00,$6.49,Hogs Breath,https://www.hotsauce.com/hogs-breath-key-west-extra-hot-sauce/
"I Like Pig Butts Sweet BBQ Sauce, 19oz.",$8.00,$7.49,Hot Sauce Fanatics,https://www.hotsauce.com/i-like-pig-butts-sweet-bbq-sauce/
"Key West Key Lime BBQ Sauce, 16oz.",$7.50,$6.95,Key West Key Lime,https://www.hotsauce.com/key-west-key-lime-bbq-sauce/
"Mountain Man Chipotle BBQ Sauce, 12oz.",$7.50,$6.95,Mountain Man,https://www.hotsauce.com/mountain-man-chipotle-bbq-sauce/
"Naga Jolokia 10 BBQ Sauce, 16oz.",$11.00,$9.95,CaJohns,https://www.hotsauce.com/naga-jolokia-10-bbq-sauce/
"Ole Ray's Blackberry Wine BBQ and Cooking Sauce, 13.5oz.",$8.00,$7.49,Ole Rays Sauces,https://www.hotsauce.com/ole-rays-blackberry-wine-bbq-and-cooking-sauce/
"Ole Ray's Classic Gold BBQ and Cooking Sauce, 12oz.",$8.00,$7.49,Ole Rays Sauces,https://www.hotsauce.com/ole-rays-classic-gold-bbq-and-cooking-sauce/
"Ole Ray's Gourmet Sloppy Sauce, 16oz.",$7.50,$6.95,Ole Rays Sauces,https://www.hotsauce.com/ole-rays-gourmet-sloppy-sauce/
"Ole Ray's Kentucky Gold Bourbon BBQ Sauce, 16oz.",$8.00,$7.49,Ole Rays Sauces,https://www.hotsauce.com/ole-rays-kentucky-gold-bourbon-bbq-sauce/
"Ole Ray's Pork-A-Licious Barbecue BBQ Sauce, 16oz.",$8.00,$7.49,Ole Rays Sauces,https://www.hotsauce.com/ole-rays-pork-a-licious-barbecue-bbq-sauce/
"Ole Ray's Red Delicious Apple Bourbon BBQ and Cooking Sauce, 12oz.",$8.00,$7.49,Ole Rays Sauces,https://www.hotsauce.com/ole-rays-red-delicious-apple-bourbon-bbq-and-cooking-sauce/
"Pain Is Good Batch #218 Louisiana Style, 7oz.",$13.00,$10.49,Pain Is Good,https://www.hotsauce.com/pain-is-good-batch-218-louisiana-style-hot-sauce/
"Pappy's Chicks Dig Me Mango Chipotle Grilling Sauce, 12.7oz.",$7.50,$6.95,Pappy's BBQ,https://www.hotsauce.com/chicks-dig-me-mango-chipotle-grilling-sauce/
"Pappy's Hottest Ride in Town BBQ Sauce, 12.7oz.",$7.50,$6.95,Pappy's BBQ,https://www.hotsauce.com/pappys-hottest-ride-in-town-bbq-sauce/
"Pappy's Moonshine Madness BBQ Sauce, 12.7oz.",$7.50,$6.95,Pappy's BBQ,https://www.hotsauce.com/pappys-moonshine-madness-bbq-sauce/
"Pappy's Sauce for Sissies BBQ Sauce, 12.7oz.",$7.50,$6.95,Pappy's BBQ,https://www.hotsauce.com/Pappys-Sauce-For-Sissies-BBQ-Sauce/
"Pappy's XXX White Lightnin' BBQ Sauce, 12.7oz.",$7.50,$6.95,Pappy's BBQ,https://www.hotsauce.com/pappys-xxx-white-lightnin-bbq-sauce/
"Pittsburgh Sucks! Hot Sauce, 5oz.",$6.50,$5.95,HotSauce,https://www.hotsauce.com/pittsburgh-sucks-hot-sauce/
"Rectum Ripper XXX 1/2 Mustard & Ginger, 5oz.",$6.50,$5.95,Tahiti Joes,https://www.hotsauce.com/rectum-ripper-xxx-mustard-ginger/
"Slap Your Mama Red Edition Habanero Hot Sauce, 5.7oz.",$7.50,$6.95,Slap Your Mamma,https://www.hotsauce.com/slap-your-mama-red-edition-habanero-hot-sauce/
"Swamp Honky Chipotle BBQ Sauce, 12oz.",$7.50,$6.95,HotSauce,https://www.hotsauce.com/swamp-honky-chipotle-bbq-sauce/
"Tahiti Joe's Ahi Of Kahuna XX Hot Sauce, 5oz.",$6.50,$5.95,Tahiti Joes,https://www.hotsauce.com/tahiti-joes-ahi-of-kahuna-xx-hot-sauce/
"Tahiti Joe's Killer Garlic XXX Pepper Sauce, 5oz.",$6.50,$5.95,Tahiti Joes,https://www.hotsauce.com/tahiti-joes-killer-garlic-xxx-pepper-sauce/
"Tahiti Joe's Maui Pepper Mangonesian Hot Sauce, 5oz.",$6.50,$5.95,Maui Pepper,https://www.hotsauce.com/tahiti-joes-maui-pepper-mangonesian-hot-sauce/
"Tahiti Joe's Onionator XXX Ghost Pepper Hot Sauce, 5oz.",$7.50,$6.95,Tahiti Joes,https://www.hotsauce.com/tahiti-joes-onionator-xxx-ghost-pepper-hot-sauce/
"Tahiti Joe's Polynesian Hot Sauce (Heat With Flavor), 5oz.",$6.50,$5.95,Tahiti Joes,https://www.hotsauce.com/tahiti-joes-polynesian-hot-sauce-heat-with-flavor/
"Tahiti Joe's Volcano Ahi X Hot Sauce, 5oz.",$6.50,$5.95,Tahiti Joes,https://www.hotsauce.com/tahiti-joes-volcano-ahi-x-hot-sauce/
"Tobago Keys Peruvian Gold Grilling Sauce, 12oz.",$7.00,$6.49,Trinidad Sauces,https://www.hotsauce.com/tobago-keys-peruvian-gold-grilling-sauce/
"Wet Fart XX Hot With Pooh Hot Sauce, 5oz.",$6.50,$5.95,Tahiti Joes,https://www.hotsauce.com/wet-fart-xx-hot-with-pooh-hot-sauce/
